status_id,status_message,link_name,status_type,status_link,status_published,num_reactions,num_comments,num_shares,num_likes,num_loves,num_wows,num_hahas,num_sads,num_angrys
339188887615_10153730190207616,"There will be a live webcast of His Holiness the Dalai Lama's talk on ""Compassion as the Pillar of World Peace"" from the Indiana Farmers Coliseum in Indianapolis, Indiana, USA on June 25, 2016 starting at 12:30pm Eastern Daylight Time (EDT=GMT-4.00). The live webcast can be viewed at https://livestream.com/DalaiLamaEnglish/pillar

Photo of His Holiness greeting the audience on his arrival at the University of Colorado's Coors Event Center in Boulder, Colorado on June 23, 2016. (Photo by Glenn Asakawa/CUBoulder)",Timeline Photos,photo,https://www.facebook.com/DalaiLama/photos/a.10150641618452616.395022.339188887615/10153730190207616/?type=3,2016-06-24 04:30:03,38524,383,4521,36214,2197,97,14,1,1
339188887615_10153727501627616,"His Holiness the Dalai Lama reaching out to well-wishers who gathered to welcome him to Boulder, Colorado, USA on June 22, 2016. (Photo by Jeremy Russell/OHHDL)",Timeline Photos,photo,https://www.facebook.com/DalaiLama/photos/a.10150641618452616.395022.339188887615/10153727501627616/?type=3,2016-06-23 04:30:03,47364,423,2068,44305,2883,158,13,0,5
339188887615_10153725090772616,"His Holiness the Dalai Lama waving to the audience at the end of his talk on ""Compassion and Universal Responsibility"" at the University of Utah's Huntsman Center in Salt Lake City, Utah on June 21, 2016. (Photo/Jeremy Russell/OHHDL) The program can be viewed at https://youtu.be/EAJWg1NVe0I",Timeline Photos,photo,https://www.facebook.com/DalaiLama/photos/a.10150641618452616.395022.339188887615/10153725090772616/?type=3,2016-06-22 04:30:02,83835,923,5663,77871,5644,287,28,1,4
339188887615_10153710047362616,"President Barack Obama greets His Holiness the Dalai Lama at the entrance of the Map Room of the White House on June 15, 2016. (Official White House Photo by Pete Souza)",Timeline Photos,photo,https://www.facebook.com/DalaiLama/photos/a.10150641618452616.395022.339188887615/10153710047362616/?type=3,2016-06-15 12:32:00,194096,3669,24253,174356,18466,1062,103,37,72
339188887615_10153650546872322,Why I'm hopeful about the world's future,,status,,2016-06-14 04:30:37,37231,1187,21916,31407,5607,168,14,30,5
339188887615_10153704953327616,"Watch the conversation ""To End Violence, Engage Youth"" with His Holiness the Dalai Lama and young peacemakers streamed live on the United States Institute of Peace's Facebook page today, starting at 10:00am EDT from Washington DC, USA. https://www.facebook.com/usinstituteofpeace/.

Photo of His Holiness with USIP Youth Leaders during their dialogue in Dharamsala, HP, India on May 3, 2016. (Photo by Tenzin Choejor/OHHDL)",Timeline Photos,photo,https://www.facebook.com/DalaiLama/photos/a.10150641618452616.395022.339188887615/10153704953327616/?type=3,2016-06-13 04:30:07,35270,338,2926,33192,1984,69,16,7,2
339188887615_10153691218917616,"His Holiness the Dalai Lama receiving traditional Indian offerings on his arrival at the Main Tibetan Temple at the start of a three day teaching for Indian Buddhists in Dharamsala, HP, India on June 7, 2016. (Photo by Tenzin Choejor/OHHDL)",Timeline Photos,photo,https://www.facebook.com/DalaiLama/photos/a.10150641618452616.395022.339188887615/10153691218917616/?type=3,2016-06-07 04:30:27,54353,514,2599,51498,2690,144,16,1,4
339188887615_10153689108417616,"If we start now and make the effort, we can make the world a more peaceful place. We have to try. The human population is growing and climate change is having its effect. Violence breaks out because our destructive emotions run out of control. Human rights violations, for example, are related to anger and a lack of respect. We can counter these tendencies by cultivating warm-heartedness and concern for others.",,status,,2016-06-06 04:30:12,120343,1517,35128,109002,11038,213,22,63,5
339188887615_10153682993607616,"Knowledge of mind and emotions should be taught in schools. On the basis of that understanding we can become healthy, happy individuals, families, communities and societies. But if the mind is not disciplined, mere knowledge will not be of much help. We need to use our intelligence to extend our basic compassionate nature, which gives rise to trust, the very basis of friendship—as human beings that's we all need.",,status,,2016-06-03 04:31:58,123547,1551,40080,112954,10283,268,25,11,6
339188887615_10153666933392616,"His Holiness the Dalai Lama talks about the importance of optimism at the end of a two day interactive dialogue with United States Institute of Peace Youth Leaders at his residence in Dharamsala, HP, India on May 4, 2016. The entire program can be viewed at http://bit.ly/1WNYe45.",Be Optimistic,video,https://www.facebook.com/DalaiLama/videos/10153666933392616/,2016-05-26 04:30:44,23154,490,5541,21131,1933,79,9,1,1
339188887615_10153660474712616,"Small children are very pure and open. They have no prejudices or preconceptions. They aren't bothered by the secondary differences of color, faith, nationality, wealth or education that seem to pre-occupy adults. We would be better to be like them and one remedy is to remember that we are all the same as human beings.",,status,,2016-05-23 04:30:03,74583,1002,26071,67283,7185,84,20,7,3
339188887615_10153656050152616,"His Holiness the Dalai Lama playfully greeting young Tibetan students on his way to the Main Tibetan Temple on Vesak, a day honoring the birth, enlightenment, and passing of Buddha in Dharamsala, HP, India on May 21, 2016. (Photo by Tenzin Choejor/OHHDL)",Timeline Photos,photo,https://www.facebook.com/DalaiLama/photos/a.10150641618452616.395022.339188887615/10153656050152616/?type=3,2016-05-21 04:30:03,65665,598,3688,61692,3780,155,36,2,0
339188887615_10153653729217616,"After meeting for discussions at his residence, His Holiness the Dalai Lama joins a group of visiting Thai monks for lunch in Dharamsala, HP, India on May 20, 2016. (Photo by Tenzin Choejor/OHHDL)",Timeline Photos,photo,https://www.facebook.com/DalaiLama/photos/a.10150641618452616.395022.339188887615/10153653729217616/?type=3,2016-05-20 04:30:08,62851,823,3719,59819,2756,251,19,5,1
339188887615_10153645533642616,"Modern education with its focus on material goals and a disregard for inner values is incomplete. There is a need to know about the workings of our minds and emotions. If we start today and make an effort to educate those who are young now in inner values, they will see a different, peaceful, more compassionate world in the future.",,status,,2016-05-16 04:30:04,152631,2084,53267,139585,12731,260,27,24,4
339188887615_10153637391482616,"His Holiness the Dalai Lama with kitchen staff of his hotel during a break in his teachings in Osaka, Japan on May 12, 2016. (Photo by Tenzin Choejor/OHHDL)",Timeline Photos,photo,https://www.facebook.com/DalaiLama/photos/a.10150641618452616.395022.339188887615/10153637391482616/?type=3,2016-05-12 04:30:05,55314,565,2088,52800,2337,62,113,0,2
339188887615_10153635625212616,"His Holiness the Dalai Lama reaching out to a robot on his way to lunch on the first day of his four day teaching in Osaka, Japan on May 10, 2016. (Photo by Tenzin Choejor/OHHDL)",Timeline Photos,photo,https://www.facebook.com/DalaiLama/photos/a.10150641618452616.395022.339188887615/10153635625212616/?type=3,2016-05-11 04:30:03,60797,624,4074,57807,2048,179,741,4,3
339188887615_10153631546532616,"His Holiness the Dalai Lama playfully thanking the crew after the NHK television interview in Osaka, Japan on May 9, 2016. (Photo by Tenzin Choejor/OHHDL)",Timeline Photos,photo,https://www.facebook.com/DalaiLama/photos/a.10150641618452616.395022.339188887615/10153631546532616/?type=3,2016-05-09 04:30:18,42004,399,1434,39629,1711,34,139,1,0
339188887615_10153629244267616,"His Holiness the Dalai Lama is greeted by old friends on his arrival at Narita Airport at the start of a six day visit to Japan on May 8, 2016. (Photo by Jeremy Russell/OHHDL)",Timeline Photos,photo,https://www.facebook.com/DalaiLama/photos/a.10150641618452616.395022.339188887615/10153629244267616/?type=3,2016-05-08 04:30:11,72035,638,2686,66875,3299,84,45,3,2
339188887615_10153625025842616,Scientists have shown that even infants who are too young to talk can distinguish between illustrations of harmful and helpful behaviour and respond positively to help and negatively to harm. They conclude that basic human nature is compassionate. And this gives us hope.,,status,,2016-05-06 04:30:03,114232,990,23661,105480,8268,405,32,9,3
339188887615_10153620924907616,"Victoria from Nigeria and Issa from Iraq look on as His Holiness the Dalai Lama offers cookies to Noria from Afghanistan during the tea break of the dialogue with United States Institute of Peace (USIP) Youth Leaders held at his residence in Dharamsala, India on May 3, 2016. (Photo by Tenzin Choejor/OHHDL)",Timeline Photos,photo,https://www.facebook.com/DalaiLama/photos/a.10150641618452616.395022.339188887615/10153620924907616/?type=3,2016-05-04 04:30:04,56664,580,3702,53411,3067,155,22,1,2
339188887615_10153616837172616,"Change must start with the individual. Building on inner strength and self-confidence we can develop the warm-heartedness that fosters concern for the welfare of others. Of course we have self-interest, but we should pursue our self-interest wisely by thinking of others, not foolishly and narrowly concerned only for ourselves.",,status,,2016-05-02 04:30:34,125038,1371,40993,115918,8868,205,32,9,1
339188887615_10153606696062616,"His Holiness the Dalai Lama with graduates of the Tibetan Studies, Tibetan History and Tibetan Literature programs at the College for Higher Tibetan Studies (CHTS) at Sarah in Dharamsala, HP, India on April 26, 2016. (Photo by Tenzin Choejor/OHHDL)",Timeline Photos,photo,https://www.facebook.com/DalaiLama/photos/a.10150641618452616.395022.339188887615/10153606696062616/?type=3,2016-04-27 04:30:03,54378,541,2179,52373,1825,149,27,2,0
339188887615_10153602943652616,"Although I am a Buddhist monk, I am sceptical that prayers alone will achieve world peace. We need instead to be enthusiastic and self-confident in taking action.",,status,,2016-04-25 04:30:03,202816,2466,34183,188769,13384,557,62,29,11
339188887615_10153596829607616,"Taking care of this planet that is our only home is not just the responsibility of governments and large organizations, although of course they have a role. The whole of humanity, each of us as individuals has a responsibility. We have to consider seriously whether we can indefinitely keep up the materialistic way of life we've got used to.",,status,,2016-04-22 04:30:03,137708,1426,45696,128420,8414,95,22,741,15
339188887615_10153582750762616,"Happiness depends on inner peace, which depends on warm-heartedness. There's no room for anger, jealousy or insecurity. A calm mind and self-confidence are the basis for peaceful relations with others. Scientists have observed that constant anger and fear eat away at our immune system, whereas a calm mind strengthens it. Changing the world for the better begins with individuals creating inner peace within themselves.",,status,,2016-04-15 04:30:02,301814,5893,143867,274694,26440,534,88,48,6
339188887615_10153569646857616,"His Holiness the Dalai Lama interacting with young children on his arrival at the American Embassy School in New Delhi, India on April 8, 2016. (Photo by Tenzin Choejor/OHHDL)",Timeline Photos,photo,https://www.facebook.com/DalaiLama/photos/a.10150641618452616.395022.339188887615/10153569646857616/?type=3,2016-04-09 04:30:19,75879,805,4094,72040,3653,141,36,5,2
339188887615_10153567199622616,"I believe that thinking only of our own comfort and peace to the neglect of other troubles in the world is immoral. The time has come for us to consider seriously how to change our way of life, not through prayer or religious teaching, but through education. Since moral education is sometimes only superficial, we need to devise a systematic approach to exploring inner values and ways to create a more peaceful world.",,status,,2016-04-08 04:30:03,175860,2610,54022,161617,13789,398,31,14,10
339188887615_10153551053182616,"We live in a materialistic world that pays insufficient attention to human values. We seek satisfaction in material things instead of warm-heartedness. But human beings are social animals. We need friendship and that depends on trust. Building trust requires concern for others and defending their rights, not doing them harm. Friendship is directly linked to warm-heartedness, which is also good for our physical health.",,status,,2016-04-01 04:31:04,227522,3770,87580,210037,16751,134,37,550,13
339188887615_10153522428407616,"Just as heat dispels cold, loving-kindness counters anger. We need to learn how to counter our various emotions. Distraction is just a temporary measure. The longer lasting remedy is to be able to see positive qualities in something or someone you otherwise see as negative. Since there is rarely any justification for destructive emotions, we need to become aware of what gives rise to them and what the antidotes are.",,status,,2016-03-25 04:30:10,107654,1735,34689,100113,7293,212,18,11,6
339188887615_10153514428002616,"His Holiness the Dalai Lama with the Indian National Women's Cricket Team during their meeting at his residence in Dharamsala, HP, India on March 23, 2016. (Photo by Tenzin Choejor/OHHDL)",Timeline Photos,photo,https://www.facebook.com/DalaiLama/photos/a.10150641618452616.395022.339188887615/10153514428002616/?type=3,2016-03-23 04:30:07,65846,627,2508,63874,1811,129,28,2,2
339188887615_10153507119842616,"His Holiness the Dalai Lama talks about how we all can contribute to a better and more compassionate humanity in the short clip from his talk to the staff of the Mayo Clinic in Rochester, Minnesota, USA on February 29, 2016. The full program can be viewed at https://youtu.be/82Ig6UkPAqI",Contributing to a Better Humanity,video,https://www.facebook.com/DalaiLama/videos/10153507119842616/,2016-03-21 04:29:45,55912,1108,19276,51675,4072,140,17,4,4
339188887615_10153479382657616,"Everyone wants to lead a peaceful, happy life, but happiness and success aren't measured by how much money you have, but by whether you have inner peace in your heart.",,status,,2016-03-11 05:30:13,268411,3802,76182,248728,19261,301,82,25,14
339188887615_10153460835357616,"There is a link between our physical and verbal actions and our emotions. If, instead of anger, hatred and suspicion, we are moved by loving-kindness, we will naturally have greater respect for others and our actions will be non-violent.",,status,,2016-03-04 05:30:24,136579,1678,36775,126700,9618,199,41,11,10
339188887615_10153446287117616,"In my experience, what we need is a calm mind and warm-heartedness provides a basis for that. That's how we make ourselves happy as individuals in families, local communities and nations. I believe that if we can train those who are young today in these qualities the world will be a more peaceful place later in this century.",,status,,2016-02-26 05:30:03,167730,2217,40318,152285,14987,322,92,18,26
