status_id,status_message,link_name,status_type,status_link,status_published,num_reactions,num_comments,num_shares,num_likes,num_loves,num_wows,num_hahas,num_sads,num_angrys
9208539755_10154393972629756,,Devonne by Demi,photo,https://www.facebook.com/DevonneByDemi/photos/a.319070271597541.1073741828.314678402036728/566509183520314/?type=3,2016-06-24 12:55:10,9649,102,0,8834,772,39,3,0,1
9208539755_10154388611909756,"Atlanta! Tyson Jackson & I have an urgent message for you  #HondaCivicTour #FutureNow 
Tix: http://bit.ly/HCTFNATL Atlanta Falcons",Atlanta we're coming for you!!,video,https://www.facebook.com/DemiLovato/videos/10154388611909756/,2016-06-22 16:32:35,8245,147,268,7152,955,11,125,1,1
9208539755_10154388424749756,,Devonne by Demi,photo,https://www.facebook.com/DevonneByDemi/photos/a.319070271597541.1073741828.314678402036728/565766530261246/?type=3,2016-06-22 15:03:43,8844,81,0,7871,918,50,2,2,1
9208539755_10154383147154756,"One day, my mom came home from the spa and I saw how her skin was glowing and how visibly relaxed she was... That image stuck with me and inspired me to develop Devonne by Demi. I hope you all have been enjoying my products as much I do! And if you haven't tried it yet, now's the time!

www.devonnebydemi.com",Timeline Photos,photo,https://www.facebook.com/DemiLovato/photos/a.54794019755.62263.9208539755/10154383147154756/?type=3,2016-06-20 14:35:02,117618,677,797,109406,7748,375,63,18,8
9208539755_10154374872439756,,Devonne by Demi,photo,https://www.facebook.com/DevonneByDemi/photos/a.319070271597541.1073741828.314678402036728/563182850519614/?type=3,2016-06-17 12:55:40,11947,153,0,10752,1101,81,5,2,6
9208539755_10154374680029756,"In case you missed it, watch my performance of ""Stone Cold"" with Brad Paisley from the Good Morning America Summer Concert Series #DemiOnGMA 😊",Video: Demi Lovato Performs 'Stone Cold' With Brad Paisley,video,http://abcnews.go.com/GMA/video/demi-lovato-performs-stone-cold-brad-paisley-39922587,2016-06-17 11:20:15,65680,920,3073,58218,6865,541,36,8,12
9208539755_10154374373034756,,Brad Paisley,video,https://www.facebook.com/bradpaisley/videos/10154902041318098/,2016-06-17 09:03:37,23502,228,2,21084,2247,92,75,2,2
9208539755_10154374351489756,Wow just had an absolute blast on Good Morning America. THANK YOU for coming out and singing with me. #DemiOnGMA,Timeline Photos,photo,https://www.facebook.com/DemiLovato/photos/a.54794019755.62263.9208539755/10154374351489756/?type=3,2016-06-17 08:56:45,82809,392,491,77043,5472,241,43,6,4
9208539755_10154373332129756,So ready to perform on the Good Morning America Summer Concert Series tomorrow morning. Tune in to ABC 830am ET! #DemiOnGMA,Timeline Photos,photo,https://www.facebook.com/DemiLovato/photos/a.54794019755.62263.9208539755/10154373332129756/?type=3,2016-06-16 22:30:01,11067,176,192,9868,1128,60,7,1,3
9208539755_10154369471749756,"I have been non-stop getting ready for tour, so I have been LIVING in my SKECHERS. They're so comfortable so they're making these rehearsals a breeze. #SkechersDemiStyle",Timeline Photos,photo,https://www.facebook.com/DemiLovato/photos/a.54794019755.62263.9208539755/10154369471749756/?type=3,2016-06-16 12:45:00,120010,1006,1119,108359,10697,845,86,8,15
9208539755_10154369996754756,Can't WAIT to show you guys the new video for #WithoutAFight with Brad Paisley 😝,Timeline Photos,photo,https://www.facebook.com/DemiLovato/photos/a.54794019755.62263.9208539755/10154369996754756/?type=3,2016-06-15 21:03:00,94633,422,896,88029,5899,632,60,6,7
9208539755_10154369371569756,"Meet the Acne Rescue Treatment, Devonne by Demi's newest product! I've been using it with every pimple and I think it might be my new favorite product! Give it a try; it's now live on our site at www.devonnebydemi.com!",Devonne by Demi - Acne Rescue Treatment,video,https://www.facebook.com/DemiLovato/videos/10154369371569756/,2016-06-15 11:41:43,24606,423,571,21490,2941,142,27,2,4
9208539755_10154367679919756,About to show you your new fav product (it's definitely mine) Are you ready? Devonne by Demi,Timeline Photos,photo,https://www.facebook.com/DemiLovato/photos/a.54794019755.62263.9208539755/10154367679919756/?type=3,2016-06-14 17:28:33,178838,1647,1454,163252,14601,829,119,14,23
9208539755_10154355055209756,Hey Nick Jonas your new album is AMAZING. I'm so proud of you. Everyone needs to buy #LYWC now! http://smarturl.it/LastYearComplicated,Last Year Was Complicated (Deluxe Edition) by Nick Jonas on iTunes,link,http://smarturl.it/LastYearComplicated,2016-06-09 23:36:06,15185,130,262,13631,1451,88,11,4,0
9208539755_10154335949099756,"Honda Civic Tour: Future Now kicks off in one month!! You could snag a trip to the LA finale show to hang out with Nick Jonas & me! ✈👯 Honda.us/Trip

No purchase necessary. US/18+ Honda.us/Rules",Trip to LA to meet Demi and Nick,link,http://honda.us/Trip,2016-06-02 12:23:11,12944,201,225,11753,1077,101,6,4,3
9208539755_10154334566344756,Ahh tour is happening so soon!! Can't wait ☺️ bit.ly/HCTFNTickets,Timeline Photos,photo,https://www.facebook.com/DemiLovato/photos/a.54794019755.62263.9208539755/10154334566344756/?type=3,2016-06-01 22:54:03,50575,582,1757,45252,4963,78,266,9,7
9208539755_10154333422439756,"Join me and take the #MusiCaresChallenge: post a picture of you with your favorite album, tag some friends to do the same, and donate ANY amount to MusiCares (they help musicians in need!): http://grm.my/1THWnrl",| GRAMMY.org,link,http://grm.my/1THWnrl,2016-06-01 11:24:26,48340,283,475,44656,3483,163,32,1,5
9208539755_10154327305599756,"This morning I lost my world and the world's most special woman. I miss her more than words can even describe. There is an emptiness in my heart that only her spirit can fill and I pray that I will feel her by my side every single day until we meet again. I attribute my strength to her.. She held on when she lost the love of her life.. The one she was married to for 53 years. She smiled even though she lost a son just this year. She told everyone she loved them every single chance she got and she joked even when her strokes left her unable to speak properly. The smile that she had not only could light up a whole room but it most definitely lit up the entire nursing home. She was my great-grandmother but we were so close that I never knew it was possible that anyone could have the bond that we shared even 70 years a part. The pain I feel is almost unbearable but because of her strength I will power through it. The love and support I have received has been empowering and so special to me.. I love all of you so much and I am forever grateful for the prayers, texts and fan art my Lovatics have made me. Thank you.

Mimaw, I hope you are with Papa now.. I hate that I can't hear your voice but I love that you are no longer in pain. I love you so much and I miss you more than anyone could ever imagine. I'll miss your smile, your wittiness, painting your nails and your kisses. I really do love you more. Rest in peace and most importantly rest in the Lord. #RIPMimaw",Timeline Photos,photo,https://www.facebook.com/DemiLovato/photos/a.54794019755.62263.9208539755/10154327305599756/?type=3,2016-05-29 21:00:40,598405,13413,10632,437285,30836,427,162,129515,128
9208539755_10154318639429756,Thank you TIDAL! 😘,Demi Lovato's Soulful Inspirations Playlist - Listen to the playlist on TIDAL.,link,http://tidal.com/playlist/5bed015c-b261-4cab-894e-5c95fc293881,2016-05-26 13:15:58,15118,200,231,13574,1406,127,5,0,6
9208539755_10154316423404756,,Brad Paisley,video,https://www.facebook.com/bradpaisley/videos/10154837784133098/,2016-05-25 16:13:06,8558,74,0,7923,586,40,8,0,1
9208539755_10154314079364756,,Devonne by Demi,photo,https://www.facebook.com/DevonneByDemi/photos/a.319070271597541.1073741828.314678402036728/554362041401695/?type=3,2016-05-24 18:04:07,15509,111,1,14422,991,81,14,1,0
9208539755_10154303374569756,Tomorrow I'll be performing on the Billboard Music Awards on ABC at 8e/5p. Don't miss it! #BBMAs,Timeline Photos,photo,https://www.facebook.com/DemiLovato/photos/a.54794019755.62263.9208539755/10154303374569756/?type=3,2016-05-21 14:11:00,13149,235,267,11736,1313,89,8,3,0
9208539755_10154303987079756,,Brad Paisley,video,https://www.facebook.com/bradpaisley/videos/10154825551203098/,2016-05-21 01:35:39,15249,103,3,13699,1432,103,8,3,4
9208539755_10154303295274756,Performing on the Billboard Music Awards in two days. Can't wait! See you May 22nd at 8e/5p on ABC. #BBMAs,Timeline Photos,photo,https://www.facebook.com/DemiLovato/photos/a.54794019755.62263.9208539755/10154303295274756/?type=3,2016-05-20 19:13:01,25306,215,456,22843,2322,129,10,1,1
9208539755_10154303236759756,"The stage we're designing for Honda Civic Tour: Future Now is so 🔥 . Watch to see what Nick Jonas and I are putting together...

Get tix: http://livemu.sc/1Oy2A7w",The Stage with Nick Jonas presented by Honda Civic Tour - Demi Lovato,video,http://www.vevo.com/watch/demi-lovato/The-Stage-with-Nick-Jonas-presented-by-Honda-Civic-Tour/USH5V1622731,2016-05-20 17:30:38,8769,82,115,7982,758,23,5,1,0
9208539755_10154297453329756,I'm leaving some spots open on tour for new music...,Lightning In A Bottle | Honda Civic Tour ft. Demi Lovato & Nic...,video,https://www.facebook.com/DemiLovato/videos/10154297453329756/,2016-05-18 17:05:42,20648,281,1274,18250,2245,129,18,3,3
9208539755_10154297643594756,"In case u were under a rock yesterday, here's my #carpoolkaraoke with Nick Jonas on The Late Late Show with James Corden   https://youtu.be/0HeJKcynrGI",gph.is,link,http://gph.is/1qpV0FO,2016-05-18 14:50:46,145957,1110,4250,129553,11663,146,4565,4,26
9208539755_10154293017079756,,Brad Paisley,video,http://smarturl.it/waflyricvideo,2016-05-16 17:51:52,10294,98,0,9369,891,26,7,1,0
9208539755_10154292951964756,So fucking excited for #CarpoolKaraoke tonight…you guys are gonna love James Corden and I grilling Nick Jonas,Carpool Karaoke with James Corden,video,https://www.facebook.com/DemiLovato/videos/10154292951964756/,2016-05-16 17:13:24,52588,557,935,48131,3507,66,877,3,4
9208539755_10154292831314756,GUYS LOOK WHAT'S AIRING TONIGHT!!!,Timeline Photos,photo,https://www.facebook.com/DemiLovato/photos/a.54794019755.62263.9208539755/10154292831314756/?type=3,2016-05-16 16:08:32,293911,1038,1455,277666,14623,1213,385,9,15
9208539755_10154284868659756,"Sooo I did this thing with Brad Paisley and now it's finally out!  Go get #WithoutAFight on iTunes! http://smarturl.it/withoutafight
http://vevo.ly/cToqJL","Brad Paisley ft. Demi Lovato - ""Without A Fight""",video,https://www.facebook.com/DemiLovato/videos/10154284868659756/,2016-05-13 10:00:06,28919,368,2103,25784,2874,240,21,0,0
9208539755_10154283054789756,,Brad Paisley,video,https://www.facebook.com/bradpaisley/videos/10154802824268098/,2016-05-12 13:53:24,15064,169,1,13612,1253,191,5,1,2
9208539755_10154280971844756,I'm not just saying this because my song's in it but The Angry Birds Movie was hysterical and u guys need to see it 😂😂 (AND my song's in it!),Timeline Photos,photo,https://www.facebook.com/DemiLovato/photos/a.54794019755.62263.9208539755/10154280971844756/?type=3,2016-05-11 16:28:41,82179,582,1135,75427,5778,214,300,8,17
9208539755_10154280519734756,"I owe so much to this man and his team at CAST Centers. Thank you for saving my life and congrats on 14 years of sobriety Mike Bayer. If you know someone who is looking for help please go to CastCenters.com.

Here's a note from Mike:

・・・

To all my friends,

Yesterday I celebrated my 14th year of sobriety. 14 years ago, isolated from my family and loved ones, I was in an incredibly dark place. I was hearing voices that weren't there, hadn't eaten for days, and spent every penny I had left. Like so many other people who are struggling, I was completely hopeless and empty. These are just some of the many negative effects of addiction. 

After having been to that hell and back, I want to share how energized and proud of my journey I am today. I learned that my purpose in life is to help others. In the last 14 years I have helped people from all walks of life find themselves: Those perceived to be on ""top"" and those at ""rock bottom"". It became increasingly clear to me that only the people at the ""top"" have access to the best treatment in the world. That just didn't seem right, so I started a company with the notion that everyone should have access to an outstanding level of care. 

CAST Centers, a company I founded 10 years ago in Venice, CA in my tiny studio apartment has now grown into a leading treatment center that provides the highest quality of individualized care. I am excited to announce that we are now accepting insurance. This allows us to continue to provide the same level of service and unique care that the company was founded on but for more people. If you know anyone that is in need, our door is always open. Thank you for joining me on my journey, and in helping others find the freedom to be their best selves.

Love,

Mike Bayer",Timeline Photos,photo,https://www.facebook.com/DemiLovato/photos/a.54794019755.62263.9208539755/10154280519734756/?type=3,2016-05-11 12:02:23,76327,339,446,70797,4772,130,44,8,11
9208539755_10154279074764756,"Want a chance to win 2 premium tickets to a Honda Civic Tour: Future Now show, a backstage VIP tour and a meet & greet with Nick Jonas and me?

Enter at Honda.us/Tix and learn more about the Power of Dreams VIP Sweepstakes from Honda Stage!",Timeline Photos,photo,https://www.facebook.com/DemiLovato/photos/a.54794019755.62263.9208539755/10154279074764756/?type=3,2016-05-10 19:33:41,31028,296,338,28090,2635,81,16,14,4
9208539755_10154278767419756,Boxing with Jay Glazer at #unbreakable on a machine called the raptor.... By far one of the hardest workouts I've ever done!!!,,video,https://www.facebook.com/DemiLovato/videos/10154278767419756/,2016-05-10 16:03:44,56835,758,1540,51308,3854,1257,78,4,3
9208539755_10154276265874756,"The way this show is coming together is so dope Nick Jonas  #HondaCivicTour #FutureNow

Get your tickets! http://livemu.sc/1W6pcEn",The Set List | Honda Civic Tour: Future Now,video,https://www.facebook.com/DemiLovato/videos/10154276265874756/,2016-05-09 14:58:21,24975,458,1548,21104,2941,77,18,4,5
9208539755_10154261896664756,"Just got to #AOLACCESS NYC and we're live streaming on go90, watch here: aol.com/newfront",Timeline Photos,photo,https://www.facebook.com/DemiLovato/photos/a.54794019755.62263.9208539755/10154261896664756/?type=3,2016-05-03 19:38:35,184378,1235,1477,172223,11315,682,59,11,17
9208539755_10154261124654756,Can't wait to perform tonight at #AOLACCESS NYC hosted by AOL!,Timeline Photos,photo,https://www.facebook.com/DemiLovato/photos/a.54794019755.62263.9208539755/10154261124654756/?type=3,2016-05-03 12:53:39,10400,93,63,9701,625,51,2,2,0
9208539755_10154260940124756,,Latina Magazine,photo,https://www.facebook.com/latinamagazine/photos/a.203115535602.258518.48654660602/10156872092770603/?type=3,2016-05-03 11:06:14,180293,1002,1,165811,12883,1484,64,13,7
9208539755_10154260934189756,Thank you Latina Magazine for having me on the cover of your June/July issue! 🤗 #DemiOnLatina,Demi Lovato is Latina Magazine's June/July 2016 Cover Star! | Latina Magazine,link,http://latina.com/Demi,2016-05-03 11:03:58,30134,192,415,27495,2432,171,15,2,1
9208539755_10154256895134756,"Things are starting to heat up outside, and I want my #Lovatics to stay #coolforthesummer with my fave NYC New York Color products. Regram this post with the hashtag #LovaticsNYCsweepstakes for a chance to win a full set of Get It All Lipstick and a multi-benefit Get It All Mascara! 😘😘😘 Open to U.S. residents only. No purch nec. http://bit.ly/1WNQ9da",Timeline Photos,photo,https://www.facebook.com/DemiLovato/photos/a.54794019755.62263.9208539755/10154256895134756/?type=3,2016-05-01 18:23:01,41447,662,652,37664,3584,155,13,8,1
9208539755_10154246519354756,"Designing my own Honda Civic for Honda Civic Tour: Future Now was so much fun!

The initial matte black paint has peeled away to reveal this beautiful rose gold color, making the car look like it's always in motion.

See how it all came together at Honda.us/CustomCivic!",Custom Honda Civic Inspiration - Demi Lovato,video,http://honda.us/CustomCivic,2016-04-27 11:04:46,12298,136,258,11243,952,84,7,2,3
9208539755_10154245574964756,"Can't please everybody and you don't have to have all the answers, but what's important is to stand up for what you believe in ✌🏼️",,status,,2016-04-26 23:47:06,41323,597,1887,37754,3383,59,24,28,68
9208539755_10154242550324756,#RepealHB2,Timeline Photos,photo,https://www.facebook.com/DemiLovato/photos/a.54794019755.62263.9208539755/10154242550324756/?type=3,2016-04-25 16:01:31,34149,692,1747,31336,2157,436,14,126,75
9208539755_10154237421254756,I'm making a point to raise the bar for #HondaCivicTour #FutureNow and it starts with just one mic. Tickets: livemu.sc/1VNEhc5,Focused On My Voice,video,https://www.facebook.com/DemiLovato/videos/10154237421254756/,2016-04-23 17:45:00,18297,221,688,16489,1671,111,11,3,1
9208539755_10154232491809756,"Omg..... RIP Prince.... 😨😔😢

This fucking sucks... Prince on repeat all day. Just like I did with Michael and Whitney 😔",,status,,2016-04-21 12:06:37,164238,1093,1626,149330,2132,373,50,12299,53
9208539755_10154228595054756,Want a chance to win my custom Civic or LA trip to meet Nick Jonas + me? Learn more from Honda Stage and enter at HondaCivicTour.com. US/18+ Honda.us/Rules,Timeline Photos,photo,https://www.facebook.com/DemiLovato/photos/a.54794019755.62263.9208539755/10154228595054756/?type=3,2016-04-19 19:56:48,19928,218,370,18321,1393,182,20,6,1
9208539755_10154228455389756,Sun kissed ☀️ www.devonnebydemi.com #natural #freckles #nomakeup #DevonneByDemi,Timeline Photos,photo,https://www.facebook.com/DemiLovato/photos/a.54794019755.62263.9208539755/10154228455389756/?type=3,2016-04-19 18:19:39,511017,5093,6984,475867,32323,2491,239,46,42
9208539755_10154218316329756,"I hate it when people say ""if you put salt on watermelon, it makes it sweeter."" 🤔😒😑",,status,,2016-04-15 12:49:58,78138,1260,768,73233,1761,113,2964,21,43
9208539755_10154215689624756,"Just for my lovatics, here's a sneak peek of my cover of ""I Will Survive"" from #AngryBirdsMovie!!","Demi Lovato - ""I Will Survive"" (Teaser)",video,https://www.facebook.com/DemiLovato/videos/10154215689624756/,2016-04-14 10:44:09,75812,3837,16950,64315,10167,1168,132,5,13
9208539755_10154214698184756,#ThankYouKobe 🙏🏼 still gotta play that game of horse soon 😝 Kobe Bryant,,status,,2016-04-13 23:41:26,44365,166,179,42763,1405,19,163,11,2
9208539755_10154213874494756,If u stream me or Nick Jonas on TIDAL u can enter to win tix to #HondaCivicTour this summer! #TIDALXFutureNow,TIDAL – TICKET GIVEAWAY,link,http://read.tidal.com/article/tidal-x-future-now-ticket-giveaway,2016-04-13 15:13:18,20908,176,275,19603,1185,98,13,5,3
9208539755_10154211912634756,Excited to be a finalist for Top Social Media Artist at the Billboard Music Awards!!! Glad you guys like following along 😜 #BBMAs,Timeline Photos,photo,https://www.facebook.com/DemiLovato/photos/a.54794019755.62263.9208539755/10154211912634756/?type=3,2016-04-12 20:44:56,27692,308,518,25607,1926,135,15,2,5
9208539755_10154210643499756,,Devonne by Demi,video,https://www.facebook.com/DevonneByDemi/videos/537593829745183/,2016-04-12 10:29:44,32692,337,1,29380,3032,249,24,2,3
9208539755_10154189619139756,,GLAAD,photo,https://www.facebook.com/GLAAD/photos/a.468379118839.258644.186319338839/10154836515788840/?type=3,2016-04-04 15:09:45,17200,206,0,15822,1076,245,13,8,35
9208539755_10154189340694756,So late posting this... GLAAD Awards  💁🏻💁🏻💁🏻,Timeline Photos,photo,https://www.facebook.com/DemiLovato/photos/a.54794019755.62263.9208539755/10154189340694756/?type=3,2016-04-04 13:30:39,228982,1708,1892,216904,10607,1328,101,25,16
9208539755_10154189105519756,Excited to announce I'm singing a song for The Angry Birds Movie! Can't wait for u to hear it and see the movie in May 🤗,Timeline Photos,photo,https://www.facebook.com/DemiLovato/photos/a.54794019755.62263.9208539755/10154189105519756/?type=3,2016-04-04 12:12:33,65894,772,2144,61086,4117,489,194,1,6
9208539755_10154186476099756,🙌🏼😭 love this!! #8yearslater #Somethingsneverchange  #glaadawards #besties,Timeline Photos,photo,https://www.facebook.com/DemiLovato/photos/a.54794019755.62263.9208539755/10154186476099756/?type=3,2016-04-03 13:18:04,460029,2068,8309,435847,22322,496,1224,118,19
9208539755_10154186399584756,Last night I was given the Vanguard award from GLAAD and one of my best friends presented it to me with words that totally made me cry.. That friend is my brother Nick Jonas and I'm so thankful for our friendship. Love you and thanks for last night 🙏,Timeline Photos,photo,https://www.facebook.com/DemiLovato/photos/a.54794019755.62263.9208539755/10154186399584756/?type=3,2016-04-03 12:43:07,229292,965,1452,217670,10584,907,87,22,20
9208539755_10154186309389756,I'm still in awe from last night.. GLAAD made me feel so special and loved.. It blows my mind that I got such a meaningful award simply by doing what people should ALREADY be doing!!! I am so honored and I will never forget last night... Thank you SO much to GLAAD and everyone who sent me congratulations videos and were there in person to support me. I love you all so much and once again... THANK YOU!!!! ❤️💛💚💙💜,VIDEO: Demi Lovato honored with Vanguard Award at #glaadawards in LA,link,http://www.glaad.org/blog/video-demi-lovato-honored-vanguard-award-glaadawards-la,2016-04-03 12:09:57,62877,398,861,59010,3641,178,40,1,6
9208539755_10154181905109756,,Devonne by Demi,photo,https://www.facebook.com/DevonneByDemi/photos/a.319070271597541.1073741828.314678402036728/533666660137900/?type=3,2016-04-01 19:27:09,10293,205,1,9352,622,31,287,1,0
9208539755_10154173480164756,<3,Children's Hospital Los Angeles,video,https://www.facebook.com/ChildrensLA/videos/10153891118690673/,2016-03-30 20:09:14,50488,377,0,44927,5312,213,16,15,3
9208539755_10154172902249756,See you Saturday?,GLAAD,link,http://glaad.org/win,2016-03-30 17:19:08,8545,163,0,7873,608,55,5,3,1
9208539755_10154155138879756,,Devonne by Demi,photo,https://www.facebook.com/DevonneByDemi/photos/a.319070271597541.1073741828.314678402036728/529179470586619/?type=3,2016-03-26 23:26:24,9144,107,0,8491,594,50,8,0,0
9208539755_10154145251284756,"Lovatics! Now you can buy 2 tix and get 2 for #HondaCivicTour!

Just use the code ""DemiNickCIVIC"" at http://livemu.sc/Honda2For2. Don't wait, this only lasts until 11:59PM PT on 3/28 or as tickets last!","Buy 2 Tickets, Get 2 Tickets!",link,http://livemu.sc/Honda2For2,2016-03-24 20:51:52,13649,175,259,12718,842,68,11,9,1
9208539755_10154143610094756,#TBT http://smarturl.it/dlca1,Timeline Photos,photo,https://www.facebook.com/DemiLovato/photos/a.54794019755.62263.9208539755/10154143610094756/?type=3,2016-03-24 14:31:27,294061,2426,3440,276492,13625,3646,151,59,88
9208539755_10154134757434756,Nick Jonas and I have MAJOR news! We're headlining the Honda Civic Tour: Future Now! Here's a special message for you 👋 and there's more to come! Go to HondaCivicTour.com for dates and tickets.,Honda Civic Tour: Future Now Announcement with Nick Jonas - Demi Lovato,video,http://honda.us/2016announce,2016-03-22 16:28:51,10978,116,252,10158,760,47,10,2,1
9208539755_10154134124434756,"My heart is broken. These events have eternal impact on the lives of countless people. #Brussels, you're in my prayers",,status,,2016-03-22 13:55:19,133210,1310,1366,124515,2443,48,24,6093,87
9208539755_10154113241844756,Had so much fun on the The Late Late Show with James Corden!! #NataliesHouse,Timeline Photos,photo,https://www.facebook.com/DemiLovato/photos/a.54794019755.62263.9208539755/10154113241844756/?type=3,2016-03-17 00:23:02,69661,266,357,67119,2167,66,304,4,1
9208539755_10154112018204756,Nick Jonas and I are LIVE! Ask us your #FutureNowTour questions & get tickets: http://livemu.sc/GetTickets,,video,https://www.facebook.com/DemiLovato/videos/10154112018204756/,2016-03-16 16:03:03,273995,31608,9885,252890,18864,1654,480,42,65
9208539755_10154111676369756,Today Nick Jonas and I are gonna live chat right here on Facebook!! Come say hi 👋2pm PT/5pm ET,Timeline Photos,photo,https://www.facebook.com/DemiLovato/photos/a.54794019755.62263.9208539755/10154111676369756/?type=3,2016-03-16 14:37:09,31565,617,577,29455,1923,164,18,3,2
9208539755_10154111490074756,Glam from yesterday 💋💋💋,Timeline Photos,photo,https://www.facebook.com/DemiLovato/photos/a.54794019755.62263.9208539755/10154111490074756/?type=3,2016-03-16 13:30:18,444908,3697,4942,421075,20600,2792,257,78,106
9208539755_10154085484434756,Thx to everyone who watched me and Nick Jonas on #VSSwimSpecial!! So much more of that on our #FutureNowTour this summer! 🙌,Demi Lovato,link,http://www.ticketmaster.com/Demi-Lovato-tickets/artist/1224909?tm_link=edp_Artist_Name,2016-03-09 23:00:28,13469,158,196,12600,806,45,9,8,1
9208539755_10154085167634756,,Devonne by Demi,photo,https://www.facebook.com/DevonneByDemi/photos/a.319070271597541.1073741828.314678402036728/521280868043146/?type=3,2016-03-09 20:12:21,9966,76,0,9322,607,24,6,4,3
9208539755_10154084394704756,Had an amazing time with the Victoria's Secret Angels & Nick Jonas shooting the #VSSwimSpecial! Watch it tonight at 9/8c on CBS!! 👙😜,,video,https://www.facebook.com/DemiLovato/videos/10154084394704756/,2016-03-09 14:25:36,22651,250,954,20824,1650,151,23,0,3
