status_id,status_message,link_name,status_type,status_link,status_published,num_reactions,num_comments,num_shares,num_likes,num_loves,num_wows,num_hahas,num_sads,num_angrys
153080620724_10156841583755725,,Donald J. Trump's cover photo,photo,https://www.facebook.com/DonaldTrump/photos/a.10151443611915725.833012.153080620724/10156841583485725/?type=3,2016-03-27 08:31:03,135083,8853,5989,128988,5553,166,64,29,282
153080620724_10156838069015725,"Remember, I am the only candidate who is self-funding. While I am given little credit for this by the voters, I am not bought like others!",,status,,2016-03-26 19:39:36,202063,15680,16038,192965,7704,258,718,47,371
153080620724_10156836395520725,We will WIN! Everyone get out & VOTE TRUMP! MAKE AMERICA GREAT AGAIN!,A.B. Stoddard: How The Donald can win,link,http://thehill.com/opinion/ab-stoddard/274103-ab-stoddard-how-the-donald-can-win,2016-03-26 16:45:08,60196,4670,3548,57397,2339,127,91,27,215
153080620724_10156836399595725,Nobody will protect our Nation like Donald J. Trump. Our military will be greatly strengthened and our borders will be strong. Illegals out!,,status,,2016-03-26 14:42:51,237703,12198,12900,227776,7738,236,1014,106,833
153080620724_10156831961580725,"We are almost there! Thank you for your continued support, AMERICA!",Timeline Photos,photo,https://www.facebook.com/DonaldTrump/photos/a.488852220724.393301.153080620724/10156831961580725/?type=3,2016-03-26 12:00:58,127640,9216,10822,120850,5565,516,184,109,416
153080620724_10156832020610725,"Top suspect in Paris massacre, Salah Abdeslam, who also knew of the Brussels attack, is no longer talking. Weak leaders, ridiculous laws!",,status,,2016-03-26 09:30:54,59742,5788,3634,56163,866,113,60,134,2406
153080620724_10156831895100725,After winning the nomination- it will be so easy focusing on just one candidate in the general. I will be Hillary or Bernie's worst nightmare-- so we can MAKE AMERICA GREAT AGAIN!,Poll: Trump beats both foes head-to-head,link,http://www.politico.com/story/2016/03/2016-republican-poll-trump-cruz-kasich-221111,2016-03-26 06:30:51,106065,7064,6882,101027,4097,170,546,41,184
153080620724_10156831870180725,"Hashtag #TrumpTrain, #Trump2016, #MakeAmericaGreatAgain, & now #PetsForTrump on Instagram- and you could appear in a future post! Thank you for all of your support!","Donald J. Trump on Instagram: ""#PetsForTrump that are on the #TrumpTrain! #Trump2016""",link,https://instagram.com/p/BDYtkdcmhZb/,2016-03-25 21:15:06,71509,4931,5111,66458,3751,90,1045,25,140
153080620724_10156830279930725,We are going to MAKE AMERICA SAFE AND GREAT AGAIN! Everyone have a GREAT weekend!,Nick Adams - Trump Revolution Could Be More Incredible Than Reagan Revolution,link,http://bit.ly/25oJHyjTRUMP2016,2016-03-25 17:30:09,75061,6426,6221,71248,3259,285,98,19,152
153080620724_10156829071580725,WOW! Thank you for your support- this just might be the largest residential campaign sign of 2016! We will MAKE AMERICA GREAT AGAIN!,,video,https://www.facebook.com/DonaldTrump/videos/10156829071580725/,2016-03-25 12:27:25,135798,7369,12790,127973,5584,1656,209,69,307
153080620724_10156828392265725,"Dr. Ben Carson- I concur. 

""I believe in God who can change people- he can make any of us better."" Dr. Ben Carson",,status,,2016-03-25 10:04:16,98198,5031,6016,92782,5024,60,87,14,231
153080620724_10156827234885725,"GOOD MORNING! Thank you for the great news, California! I will see you all very soon!",Timeline Photos,photo,https://www.facebook.com/DonaldTrump/photos/a.488852220724.393301.153080620724/10156827234885725/?type=3,2016-03-25 06:00:19,65314,7111,7585,61456,3194,338,121,27,178
153080620724_10156825828300725,"It is amazing how often I am right, only to be criticized by the media. Illegal immigration, take the oil, build the wall, Muslims, NATO!",,status,,2016-03-24 23:11:07,99631,9269,5010,95156,3411,141,569,46,308
153080620724_10156824815450725,"Thank you, Judge Jeanine. The voters are tired of the games in Washington, D.C. It is time to clean up- and with the support of the American people I plan on doing just that- so we can MAKE AMERICA GREAT AGAIN!",Fox News,video,https://www.facebook.com/FoxNews/videos/10154153972106336/,2016-03-24 20:30:21,56250,5898,15,52202,3420,356,123,18,131
153080620724_10156824515590725,"I didn't start the fight with Lyin' Ted Cruz over the GQ cover pic of Melania, he did. He knew the PAC was putting it out - hence, Lyin' Ted!",,status,,2016-03-24 18:53:02,103130,20454,6824,98158,2605,220,1487,103,557
153080620724_10156823927765725,"THANK YOU, AMERICA! We are going to MAKE AMERICA GREAT AGAIN!",Timeline Photos,photo,https://www.facebook.com/DonaldTrump/photos/a.488852220724.393301.153080620724/10156823927765725/?type=3,2016-03-24 17:01:28,90281,6296,8368,85727,3826,334,134,48,212
153080620724_10156823225820725,"A disgrace! Just weeks before she stepped down as secretary of state, Hillary Clinton sent President Obama a memo urging him to close the Guantanamo Bay prison and offering strategies to do so. As a result, these terrorists are going back- to kill Americans! 

Hillary wrote to President Obama:
""I remain a strong advocate of your policy to close the Guantanamo Bay detention facility (GTMO) responsibly and to ensure U.S. detention policy and practice for terrorism suspects are consistent with U.S. values and do not strengthen our enemies.""",Fox Business,video,https://www.facebook.com/FoxBusiness/videos/10154020396340238/,2016-03-24 14:50:20,39053,5155,12,32686,218,691,53,204,5201
153080620724_10156822760425725,"Europe and the U.S. must immediately stop taking in people from Syria. This will be the destruction of civilization as we know it! So sad! It was just announced that as many as 5000 ISIS fighters have infiltrated Europe. Also, many in U.S.  I TOLD YOU SO! I alone can fix this problem!",,status,,2016-03-24 12:57:34,131653,11001,15658,125103,3807,325,214,228,1976
153080620724_10156822182390725,Endorsements for Lyin' Ted,Endorsements for Lyin' Ted,video,https://www.facebook.com/DonaldTrump/videos/10156822182390725/,2016-03-24 10:57:43,34349,5650,7938,30120,902,74,3066,30,157
153080620724_10156821522675725,"N.A.T.O. is obsolete and must be changed to additionally focus on terrorism as well as some of the things it is currently focused on! 

We pay a disproportionate share of the cost of N.A.T.O. Why? It is time to renegotiate, and the time is now!",,status,,2016-03-24 09:45:26,49105,4200,4876,47179,1564,67,39,11,245
153080620724_10156821508015725,Thank you! It is time- we need to defeat Hillary Clinton in November! MAKE AMERICA GREAT AGAIN!,Poll: Majority of Republicans say party should get behind Trump at convention,link,http://thehill.com/blogs/ballot-box/274054-poll-majority-of-republicans-say-party-should-get-behind-trump-at-convention,2016-03-24 08:22:20,87773,6016,5957,83840,3351,123,111,29,319
153080620724_10156819927995725,"Thank you for your support, Niagara County Republican Party! Will see you soon. LETS MAKE AMERICA GREAT AGAIN!",Niagara County GOP endorses Trump,link,http://www.niagara-gazette.com/news/local_news/niagara-county-gop-endorses-trump/article_5a256068-affc-5420-9e6a-5e0f80a1049b.html,2016-03-24 05:45:23,51856,2740,2522,49803,1772,120,49,12,100
153080620724_10156818521150725,"While I believe I will clinch before Cleveland and get more than 1237 delegates, it is unfair in that there have been so many in the race!",,status,,2016-03-23 20:09:08,54924,8017,1502,53028,1411,64,220,38,163
153080620724_10156817463110725,"Low energy Jeb Bush just endorsed a man he truly hates, Lyin' Ted Cruz. Honestly, I can't blame Jeb in that I drove him into oblivion!
I think having Jeb's endorsement hurts Lyin' Ted. Jeb spent more than $150,000,000 and got nothing. I spent a fraction of that and am first!",,status,,2016-03-23 19:01:02,87603,8168,4495,81189,2609,178,3430,29,168
153080620724_10156817293160725,We try so hard to be politically correct. We should try harder instead to solve the problem!,A terrorist attack has happened in Europe. Let the standard response begin... | Coffee House,link,http://blogs.spectator.co.uk/2016/03/a-terrorist-attack-has-happened-in-europe-let-the-standard-response-begin/,2016-03-23 17:00:12,39610,3011,2859,37734,1154,48,72,432,170
153080620724_10156816869320725,"Just watched Hillary deliver a prepackaged speech on terror. She's been in office fighting terror for 20 years- and look where we are! I will be the best by far in fighting terror. I'm the only one that was right from the beginning, & now Lyin' Ted & others are copying me.",Associated Press: ISIS Has Prepped 400 Fighters To Attack Europe In 'Waves',link,http://bit.ly/1o789T7Trump2016,2016-03-23 15:02:56,76279,8365,11463,71182,1819,249,169,214,2646
153080620724_10156816783435725,"Lyin' Ted Cruz steals foreign policy from me, and lines from Michael Douglas— just another dishonest politician.",,status,,2016-03-23 14:48:54,62434,6182,3659,58925,1049,185,580,73,1622
153080620724_10156816405945725,"THANK YOU, ARIZONA! Final polling numbers are in- we won by over 100,000 votes. I am honored to receive your support- TOGETHER, we will MAKE AMERICA SAFE & GREAT AGAIN!",Timeline Photos,photo,https://www.facebook.com/DonaldTrump/photos/a.488852220724.393301.153080620724/10156816405945725/?type=3,2016-03-23 13:29:05,254035,11437,17918,240950,10354,1367,496,166,702
153080620724_10156815951310725,"Obama, and all others, have been so weak, and so politically correct, that terror groups are forming and getting stronger! Shame.",,status,,2016-03-23 12:15:50,85844,5299,5916,81234,1585,130,104,310,2481
153080620724_10156815489210725,I would rather be CORRECT than politically correct!,"January 2016 – Donald Trump Warned Brussels, Belgium – The New York Times Mocked Him For It…",video,http://theconservativetreehouse.com/2016/03/22/january-2016-donald-trump-warned-brussels-belgium-the-new-york-times-mocked-him-for-it/,2016-03-23 11:15:00,154758,6437,20790,147801,5731,750,215,71,190
153080620724_10156812850960725,We will BUILD THE WALL- in order to MAKE AMERICA SAFE AGAIN!,Lou Dobbs,video,https://www.facebook.com/LouDobbsTonight/videos/10153520901642951/,2016-03-23 09:30:30,40136,3743,1,37862,1927,167,62,12,106
153080620724_10156733042395725,Thank you for your votes! Show that you stand with the man who will #MakeAmericaGreatAgain - visit the official campaign store now!,SHOW YOUR SUPPORT for the #TRUMPTRAIN,link,http://shop.donaldjtrump.com/,2016-03-23 07:30:00,6292,1300,409,5835,361,10,14,1,71
153080620724_10156811256145725,Thank you for your endorsement Congressman Lou Barletta! Lets build the GOP party bigger than ever before!,"Rep. Lou Barletta endorses Trump, hopes others will too",link,http://www.politico.com/blogs/2016-gop-primary-live-updates-and-results/2016/03/lou-barletta-endorses-donald-trump-221099,2016-03-23 06:00:48,65401,2673,4351,63058,2066,156,46,10,65
153080620724_10156813083705725,"Good morning! Hopefully the Republican Party can come together and have a big WIN in November, paving the way for many great Supreme Court Justices!",,status,,2016-03-23 04:45:21,88012,3852,2619,84699,2876,80,74,12,271
153080620724_10156813075250725,"Incompetent Hillary, despite the horrible attack in Brussels today, wants borders to be weak and open-and let the Muslims flow in. No way!",,status,,2016-03-23 00:35:57,84542,7464,7052,78064,1900,277,179,169,3953
153080620724_10156812535790725,"Thank you, Arizona! #Trump2016 #AZPrimary",Timeline Photos,photo,https://www.facebook.com/DonaldTrump/photos/a.488852220724.393301.153080620724/10156812535790725/?type=3,2016-03-22 22:33:59,129660,7250,12639,122176,6175,498,221,94,496
153080620724_10156811134435725,"The police in our country are not appreciated. We do not give them the kind of respect they must have. The fact is- they do an incredible job! We have to give them more authority, and far more respect. Without the great police forces we have throughout the United States- we would not be sitting here right now!",Daniel Scavino Jr.,video,https://www.facebook.com/DanScavino/videos/1716516681897394/,2016-03-22 17:29:48,172982,9095,14,163953,8152,564,107,29,177
153080620724_10156809968595725,"Don't let them silence you! Stop by Sammy's Mexican Grill in Tucson, Arizona- and enjoy some delicious food. All Americans need to stand up TOGETHER against hatred and those trying to stop our rights to freedom and liberty.",Trump thanks Latina supporter; now mounting backlash threatens her business,link,http://www.kgun9.com/news/local-news/trump-thanks-latina-supporter-now-mounting-backlash-threatens-her-business,2016-03-22 15:30:43,88015,7182,10861,82150,2801,266,99,351,2348
153080620724_10156809922420725,"My heart & prayers go out to all of the victims of the terrible #Brussels tragedy. This madness must be stopped, and I will stop it.",,status,,2016-03-22 13:32:18,211073,11354,13884,199274,6137,124,149,4830,559
153080620724_10156809401800725,"As president- I would be very, very tough on the borders, and I would NOT be allowing certain people to come into this country without absolute perfect documentation!","Trump backs tougher border security, waterboarding after Brussels attacks",link,https://ca.news.yahoo.com/trump-looks-expand-lead-arizona-utah-cast-votes-100403800.html,2016-03-22 11:37:28,98822,6356,7402,93929,4403,123,182,18,167
153080620724_10156809330505725,Watch this clip from earlier this year. Time and time again- I have been right about terrorism. It's time to get tough!,January 2016,video,https://www.facebook.com/DonaldTrump/videos/10156809330505725/,2016-03-22 11:24:48,60052,3834,11234,57385,1904,508,38,69,148
153080620724_10156808929000725,We need to be careful with who comes into America- or we are going to have problems like you have never seen before! It is time to wake up!,Fox News,video,https://www.facebook.com/FoxNews/videos/10154159919896336/,2016-03-22 10:30:32,108530,6488,7,103173,2463,150,33,2003,708
153080620724_10156809072915725,I have proven to be far more correct about terrorism than anybody--- and it's not even close. Hopefully Arizona and Utah will be voting for me today!,,status,,2016-03-22 10:29:44,129033,7564,6163,124114,4258,115,289,38,219
153080620724_10156808963545725,"President Obama looks and sounds so ridiculous making his speech in Cuba, especially in the shadows of Brussels. He is being treated badly!",,status,,2016-03-22 10:09:12,65435,5821,2937,61825,1138,132,1762,108,470
153080620724_10156808566585725,"Get Out To Vote Arizona & Utah! You can help #MakeAmericaGreatAgain.

Arizona: https://www.donaldjtrump.com/arizona

Utah: http://www.donaldjtrump.com/utah

Text TRUMP to 88022 to join the #TrumpTrain!",Get Out To Vote: Arizona & Utah,video,https://www.facebook.com/DonaldTrump/videos/10156808566585725/,2016-03-22 09:00:00,39400,4981,6190,36755,1881,60,63,18,623
153080620724_10156806519660725,We are beating the Establishment! This is a movement and together we will Make America Great Again!,Low Information Donors: GOP Money Men Waste $520 Million on Now-Dropped Out Candidates Against...,link,http://www.breitbart.com/big-government/2016/03/21/low-information-donors-gop-money-men-waste-520-million-on-now-dropped-out-candidates-against-donald-trump/,2016-03-22 08:00:38,22659,2524,2334,20860,765,123,746,37,128
153080620724_10156808089010725,"Do you all remember how beautiful and safe a place Brussels was. Not anymore, it is from a different world! U.S. must be vigilant and smart!",,status,,2016-03-22 07:05:11,127718,9478,9518,120968,2237,116,70,3475,852
153080620724_10156805441085725,Watch my speech at #AIPAC2016. #MakeAmericaGreatAgain,,video,https://www.facebook.com/DonaldTrump/videos/10156805441085725/,2016-03-21 20:51:18,80762,11236,24590,74767,5171,462,87,21,254
153080620724_10156804692035725,THANK YOU! #AIPAC2016,Timeline Photos,photo,https://www.facebook.com/DonaldTrump/photos/a.488852220724.393301.153080620724/10156804692035725/?type=3,2016-03-21 18:25:22,183405,10574,7895,174996,6928,286,176,44,975
153080620724_10156804414725725,Join me live at AIPAC.,LIVE Stream: Donald Trump Speaks at AIPAC Policy Conference (3-21-16),video,https://youtu.be/bHmINZRwiZU,2016-03-21 17:31:38,17726,3251,1755,16338,1217,79,17,9,66
153080620724_10156803829320725,Outstanding! A top priority- so we can MAKE AMERICA SAFE & GREAT AGAIN!,"Donald J. Trump on Instagram: ""#Repost @donaldtrump2016_ __________ Thank you! #TrumpTrain...",link,https://instagram.com/p/BDOYoLPmhfj/,2016-03-21 16:45:01,97446,4965,9504,92323,3993,152,754,24,200
153080620724_10156803819655725,The last person that Hillary or Bernie want to run against is Donald Trump- and that is fact!,,status,,2016-03-21 15:28:52,96381,5614,3690,92189,3029,105,868,12,178
153080620724_10156803286415725,Off duty police officer attends my Arizona rally - and explains his entire experience. #Trump2016,Truth About Trump Rallies,video,https://www.facebook.com/DonaldTrump/videos/10156803286415725/,2016-03-21 13:33:05,91861,8190,54871,86484,4439,707,66,45,120
153080620724_10156802950345725,We need to be RESPECTED! The first time a sitting U.S. President visits Cuba since 1928- and President Raul Castro can't even greet President Obama on the airport tarmac!,Fox Business,video,https://www.facebook.com/FoxBusiness/videos/10154006464695238/,2016-03-21 12:03:51,56719,6091,2,53013,1428,250,1726,70,232
153080620724_10156802391385725,"If we don't have a border, we don't have a country. I want people to come in LEGALLY and follow the laws of our great country!",Diversity: Four Illegals Held in Brutal Gang Rape in Massachusetts - Breitbart,link,http://www.breitbart.com/big-government/2016/03/20/four-illegals-held-in-brutal-gang-rape-in-massachusetts/,2016-03-21 09:48:15,64656,5739,9290,59947,1649,110,59,175,2716
153080620724_10156792974505725,"Thank you AmericaForTheTRUMP for the inspiring video. I truly care about our great nation and will #MakeAmericaGreatAgain!

https://www.youtube.com/watch?v=xKOQdcVoRys",The Real Donald J. Trump,video,https://www.facebook.com/DonaldTrump/videos/10156792974505725/,2016-03-21 07:30:00,91232,8081,41281,84688,5730,407,92,39,274
153080620724_10156800081030725,"CBS Focus Group: Hillary 'Worst Liar I Think I've Ever Seen,' She 'Lied About Lying'","CBS Focus Group: Hillary 'Worst Liar I Think I've Ever Seen,' She 'Lied About Lying' - Breitbart",link,http://www.breitbart.com/video/2016/03/20/focus-group-calls-hillary-clinton-worst-liar-i-think-ive-ever-seen-says-she-lied-about-lying/,2016-03-21 06:00:38,30690,2402,3824,28917,663,82,856,17,155
153080620724_10156798652570725,"Wow, President Obama just landed in Cuba, a big deal, and Raul Castro wasn't even there to greet him. He greeted Pope and others. No respect!",,status,,2016-03-20 16:59:10,96605,13058,7328,88732,1169,518,5602,112,472
153080620724_10156797836045725,"Why is it that the horrendous protesters, who scream, curse punch, shut down roads/doors during my RALLIES,  are never blamed by media? SAD!",,status,,2016-03-20 15:30:37,255569,26437,25950,241057,4115,383,478,1134,8402
153080620724_10156797548800725,"Failed presidential candidate Mitt Romney, the man who ""choked"" and let us all down, is now endorsing Lyin' Ted Cruz. This is good for me! Mitt is a mixed up man who doesn't have a clue- no wonder he lost!",,status,,2016-03-20 12:57:23,100156,9224,5064,94131,2279,140,3289,48,269
153080620724_10156796517075725,I am the candidate that will bring real change to DC and MAKE AMERICA GREAT AGAIN!,AZ Mom Who Lost Son to Illegal Explains Why She Endorsed Trump over Cruz,link,http://www.breitbart.com/big-government/2016/03/19/arizona-mom-who-lost-son-to-illegal-immigrant-explains-why-she-endorsed-donald-trump-over-ted-cruz/,2016-03-20 11:30:15,57473,3125,5266,54715,1830,61,40,716,111
153080620724_10156796508335725,I am fueled by your love and support. This is a movement!,Two Weeks in Trump Nation,link,http://www.politico.com/magazine/gallery/2016/03/two-weeks-in-trump-nation-000624?slide=0,2016-03-20 08:59:35,53763,4214,2680,50825,2661,70,92,11,104
153080620724_10156794327800725,"LYIN' Ted Cruz is Pro Amnesty. Just another all talk, no action politician. #TrumpTrain #Trump2016",Lying Ted Cruz,video,https://www.facebook.com/DonaldTrump/videos/10156794327800725/,2016-03-20 06:00:00,54344,6348,11462,51301,1100,153,311,60,1419
153080620724_10156794415490725,"THANK YOU TUCSON, ARIZONA! I had a fabulous afternoon with the #TrumpTrain!","Donald J. Trump on Instagram: ""THANK YOU #Tucson, #Arizona! #TrumpTrain #Trump2016""",link,https://instagram.com/p/BDKHPFFmhbn/,2016-03-19 22:43:38,89191,4568,5169,85292,3396,139,158,26,180
153080620724_10156798590900725,"An amazing rally in Tucson, Arizona! THANK YOU for your support! Do not forget to #VoteTrump on Tuesday! EVERYONE get out to the polls!
#MakeAmericaGreatAgain",Timeline Photos,photo,https://www.facebook.com/DonaldTrump/photos/a.488852220724.393301.153080620724/10156798590800725/?type=3,2016-03-19 20:48:30,114404,5395,11804,109361,3917,163,234,44,685
153080620724_10156793895205725,Do you believe that Hillary Clinton now wants Obamacare for illegal immigrants? She should spend more time taking care of our great Vets!,,status,,2016-03-19 20:45:12,117292,11239,15679,107834,3037,443,235,152,5591
153080620724_10156793233615725,ANOTHER GREAT NATIONAL GOP POLL! Thank you for your support! We will MAKE AMERICA GREAT AGAIN-- TOGETHER!,Timeline Photos,photo,https://www.facebook.com/DonaldTrump/photos/a.488852220724.393301.153080620724/10156793233615725/?type=3,2016-03-19 19:30:34,69974,4006,5121,66677,2716,246,111,19,205
153080620724_10156793682890725,"An honor to be endorsed by General Robert Charles Oaks! THANK YOU, GENERAL!

4 Star General Robert Charles Oaks is a retired U.S. Air Force general who served as commander of Air Training Command and United States Air Forces in Europe. Oaks was also a general authority of The Church of Jesus Christ of Latter-day Saints (LDS Church) from 2000 to 2009. He is a first cousin to LDS Church apostle Dallin H. Oaks. General Robert Oaks, and his wonderful wife Gloria are amazing leaders- and they want a leader in the White House!",Timeline Photos,photo,https://www.facebook.com/DonaldTrump/photos/a.488852220724.393301.153080620724/10156793682890725/?type=3,2016-03-19 18:11:24,146173,5057,12674,141106,4232,512,74,37,212
153080620724_10156792925795725,"THANK YOU ARIZONA! 20,000 amazing supporters! Get out and #VoteTrump on Tuesday. I love you!",Timeline Photos,photo,https://www.facebook.com/DonaldTrump/photos/a.488852220724.393301.153080620724/10156792925795725/?type=3,2016-03-19 15:04:18,139474,8751,12935,132575,5356,846,172,66,459
153080620724_10156792023145725,Thank you. I recognize and understand what our border agents are dealing with 24 hours a day- 7 days a week. We will BUILD THE WALL!,Border Patrol union: 'Trump is the only candidate' to support agents,link,http://www.washingtonexaminer.com/border-patrol-union-trump-is-the-only-candidate-to-support-agents/article/2586274,2016-03-19 10:45:54,145050,7530,16628,138817,5314,394,188,29,308
153080620724_10156790409025725,"I guess I have reached yet another ""ceiling""  - 49.7%, with four people. My highest Reuters poll yet! Thank you!",Timeline Photos,photo,https://www.facebook.com/DonaldTrump/photos/a.488852220724.393301.153080620724/10156790409025725/?type=3,2016-03-19 08:30:40,84902,5330,7383,80136,3744,571,196,33,222
153080620724_10156790391065725,THANK YOU FOR YOUR SUPPORT! LETS MAKE AMERICA GREAT AGAIN!,Timeline Photos,photo,https://www.facebook.com/DonaldTrump/photos/a.488852220724.393301.153080620724/10156790391065725/?type=3,2016-03-19 06:00:02,127820,7534,11201,121359,5234,275,223,67,662
153080620724_10156790405830725,,Donald J. Trump's cover photo,photo,https://www.facebook.com/DonaldTrump/photos/a.10151443611915725.833012.153080620724/10156790405790725/?type=3,2016-03-19 01:28:06,47138,3548,2746,44378,2080,78,74,23,505
153080620724_10156790102020725,MAKE AMERICA GREAT AGAIN!,,status,,2016-03-18 23:44:31,79417,6304,3395,74088,3997,120,495,58,659
153080620724_10156789796550725,"THANK YOU- Salt Lake City, Utah! I love you! Lets MAKE AMERICA GREAT AGAIN!",Timeline Photos,photo,https://www.facebook.com/DonaldTrump/photos/a.488852220724.393301.153080620724/10156789796550725/?type=3,2016-03-18 22:14:35,68201,4312,2701,64885,2815,108,81,10,302
153080620724_10156789343880725,"We are landing in Salt Lake City, Utah for a presidential rally! Tomorrow- we are in Arizona! We need to MAKE AMERICA GREAT AGAIN - NOW! If you are interested in attending- tickets are available at www.DonaldJTrump.com.",Timeline Photos,photo,https://www.facebook.com/DonaldTrump/photos/a.488852220724.393301.153080620724/10156789343880725/?type=3,2016-03-18 19:56:20,29655,4054,2856,27977,1468,77,26,8,99
153080620724_10156788093845725,"""Newt Gingrich on 'Anti-Trump' Republicans: Should Form Lost Republicans for Hillary.""",Newt Gingrich on 'Anti-Trump' Republicans: Should Form 'Lost Republicans for Hillary' - Breitbart,link,http://www.breitbart.com/2016-presidential-race/2016/03/18/newt-gingrich-on-anti-trump-republicans-should-form-lost-republicans-for-hillary/,2016-03-18 18:15:42,27960,3695,3172,26083,799,66,848,19,145
153080620724_10156788554075725,"With millions of dollars of negative and phony ads against me by the establishment, my numbers continue to go up. Can anyone explain this?",Anti-Trump Ad Spending Tops $63 Million,link,http://abcnews.go.com/Politics/63-million-counting-anti-trump-ads-airwaves/story?id=37752543,2016-03-18 17:00:56,83325,16439,9254,76862,3098,366,2601,52,346
153080620724_10156788133850725,Senator Lindsey Graham made horrible statements about LYIN' TED CRUZ – and then he endorsed him. No wonder nobody trusts politicians!,,status,,2016-03-18 14:48:10,74326,7747,5112,69889,1730,240,2136,42,289
