status_id,status_message,link_name,status_type,status_link,status_published,num_reactions,num_comments,num_shares,num_likes,num_loves,num_wows,num_hahas,num_sads,num_angrys
64637653943_10154335476168944,What can I say CLEVELAND! Thank you! We did it for ya'll! #PROMISEKEPT #StriveForGreatness #TheLand #ChampionshipParade,Timeline Photos,photo,https://www.facebook.com/LeBron/photos/a.146568808943.115160.64637653943/10154335476168944/?type=3,2016-06-22 20:54:28,278725,2876,5701,265395,12063,837,275,32,123
64637653943_10154332309698944,UNBELIEVABLE!!! #JustAKidFromAkron #IPROMISE UNINTERRUPTED,UNINTERRUPTED,video,https://www.facebook.com/Uninterrupted/videos/944613305658271/,2016-06-21 16:34:51,86756,1916,3,79524,6320,754,114,21,23
64637653943_10154332246068944,YOU WORK FOR WHAT YOU HAVE… This one's for you!!! #WEAREFAMILY #StriveForGreatness #IPROMISE,Timeline Photos,photo,https://www.facebook.com/LeBron/photos/a.146568808943.115160.64637653943/10154332246068944/?type=3,2016-06-21 16:09:12,188399,2542,8995,178687,8938,553,121,16,84
64637653943_10154165371883944,Zero Dark Thirty-23 activated #StriveForGreatness,Timeline Photos,photo,https://www.facebook.com/LeBron/photos/a.146568808943.115160.64637653943/10154165371883944/?type=3,2016-04-16 22:18:34,54158,3699,2450,52314,1334,351,100,16,43
64637653943_10154161295298944,"#IPROMISE #KickGameCray #NikeLifer #StriveForGreatness
view all 1,398 comments",Timeline Photos,photo,https://www.facebook.com/LeBron/photos/a.146568808943.115160.64637653943/10154161295298944/?type=3,2016-04-15 08:21:17,74212,2062,1595,72680,1168,290,45,8,21
64637653943_10154157151258944,#MambaDay #Salute,Timeline Photos,photo,https://www.facebook.com/LeBron/photos/a.146568808943.115160.64637653943/10154157151258944/?type=3,2016-04-13 13:07:59,591136,3679,31780,573719,9707,806,234,6594,76
64637653943_10154152372443944,"Don't spend as Much time together as we used to but happy as hell to see them all doing so well for themselves and their families! When we do link up, we pick up right where we left off like we suppose to. Love u boys til the death. #FabFive #AkronBoys #StriveForGreatness",Timeline Photos,photo,https://www.facebook.com/LeBron/photos/a.146568808943.115160.64637653943/10154152372443944/?type=3,2016-04-12 06:29:00,80038,867,1259,78603,1160,169,90,3,12
64637653943_10154149896233944,Baby Z will not let u take off her Dada shoes! No way Jose. Don't get beat up! #SheIsCrazy #KickGameCrayThough #LeBron13,Timeline Photos,photo,https://www.facebook.com/LeBron/photos/a.146568808943.115160.64637653943/10154149896233944/?type=3,2016-04-10 20:45:23,60581,698,555,58870,1250,93,358,1,9
64637653943_10154144139273944,You'd be surprised what you can get into on an off day... #MeetRon Blaze Pizza,LeBron James Is Blaze Pizza's Newest Team Member,video,https://www.facebook.com/LeBron/videos/10154144139273944/,2016-04-08 16:29:51,26073,1613,4280,24374,640,72,980,3,4
64637653943_10154143565508944,"LET'S GOOOO!!!!!! All proceeds from the first ride auction go to the LeBron James Family Foundation: https://www.cedarpoint.com/events/things-to-do/events/Valravn-Launch-Party 

Huge s/o to Jason and Tony again for always putting my kids first. Best amusement park in the damn universe. #WEAREFAMILY #IPROMISE Cedar Point",Timeline Photos,photo,https://www.facebook.com/LeBron/photos/a.146568808943.115160.64637653943/10154143565508944/?type=3,2016-04-08 12:43:44,11693,153,132,11477,152,49,15,0,0
64637653943_10154143292873944,My queen!! You continue to amaze me day in and day out. Rose gold Beats???? KILLED IT! #ShesTheRealStar #PromPROMISE,LeBron James Family Foundation,photo,https://www.facebook.com/lebronjamesfamilyfoundation/photos/a.397092633656107.91998.384225958276108/1149290331769663/?type=3,2016-04-08 10:45:54,7882,202,0,7489,350,31,10,2,0
64637653943_10154141615123944,"How can you look at this and not smile?? Proud of my kids and thankful for Micki, Margaret, Terry and everyone at WKYC Channel 3 - Cleveland who took time from their BUSY day to make their trip special. Also a huge shout out to Don and the Bridgestone Invitational team. #IPROMISE #WEAREFAMILY",LeBron James Family Foundation,photo,https://www.facebook.com/lebronjamesfamilyfoundation/photos/a.397092633656107.91998.384225958276108/1148720591826637/?type=3,2016-04-07 18:30:50,2749,59,0,2692,46,4,6,0,1
64637653943_10154141512693944,Congrats brother!! Happy to be there for every last one of them 3s! #FlameThrower #RocketLauncher #Swish,Timeline Photos,photo,https://www.facebook.com/LeBron/photos/a.146568808943.115160.64637653943/10154141512693944/?type=3,2016-04-07 17:27:06,68743,710,1829,67626,724,331,52,2,8
64637653943_10154132071003944,Good times in the James Gang household thesedays!! Bronny and Bryce brought home 1st place at their tournament in Columbus this weekend! Congrats to the whole North Coast Blue Chips squad on the accomplishment. Keep #StriveForGreatness #ProudPops,Timeline Photos,photo,https://www.facebook.com/LeBron/photos/a.146568808943.115160.64637653943/10154132071003944/?type=3,2016-04-04 15:36:00,51417,537,550,50597,617,165,29,3,6
64637653943_10154132068023944,"Who knew a three-year-old boy's dream and a Little Tikes hoop could lead to all this? So proud of my Foundation's partnership with Little Tikes and excited that our first LJFF-branded toy is in stores now! It's still kind of surreal, but the ""Dream Big"" basketball hoop is now available at Toys''R''Us and a portion of the proceeds goes back to my Foundation and our efforts to keep kids in school. This is such a special thing for me, and we're just getting started. We have at least 20 more products to come, all encouraging young kids to dream big! #blessed #IPROMISE #StriveForGreatness",Timeline Photos,photo,https://www.facebook.com/LeBron/photos/a.146568808943.115160.64637653943/10154132068023944/?type=3,2016-04-04 08:24:49,55555,837,2106,53680,1610,218,40,2,5
64637653943_10154127694393944,UNKNWN life!!,Timeline Photos,photo,https://www.facebook.com/LeBron/photos/a.146568808943.115160.64637653943/10154127694393944/?type=3,2016-04-02 15:06:26,49183,751,384,48306,642,65,157,5,8
64637653943_10154115982563944,Welcome to the family DeJounte! Let's work kid. #KlutchSports #StriveForGreatness,Timeline Photos,photo,https://www.facebook.com/LeBron/photos/a.146568808943.115160.64637653943/10154115982563944/?type=3,2016-03-30 16:59:01,118907,1111,14842,114479,4009,325,76,8,11
64637653943_10154115975953944,I love it every time I get one of these photos. Congrats on the new ride!! #IPROMISE,Timeline Photos,photo,https://www.facebook.com/LeBron/photos/a.146568808943.115160.64637653943/10154115975953944/?type=3,2016-03-30 13:46:44,15376,190,84,15182,135,20,35,1,3
64637653943_10154107168813944,POWER. RECLINING. BACK. SEAT. #NuffSaid,Kia Motors America,photo,https://www.facebook.com/kia/photos/a.207526270364.170617.156773665364/10154015765930365/?type=3,2016-03-28 14:35:26,3292,115,0,3227,47,4,12,1,1
64637653943_10154094395008944,This isn't all of us by the way. And we're just getting started #StriveForGreatness  #Klutch,Timeline Photos,photo,https://www.facebook.com/LeBron/photos/a.146568808943.115160.64637653943/10154094395008944/?type=3,2016-03-25 22:18:39,41397,493,437,40811,469,51,54,1,11
64637653943_10154093995843944,Not a bad way to spend your day off!! Caught UNINTERRUPTED's Striving For Greatness in VR #Samsung837,Timeline Photos,photo,https://www.facebook.com/LeBron/photos/a.146568808943.115160.64637653943/10154093995843944/?type=3,2016-03-25 20:03:51,17027,179,168,16752,149,101,20,4,1
64637653943_10154087151968944,We don't mess around with the TV game… Getting the screening room set. #SpringHill,Timeline Photos,photo,https://www.facebook.com/LeBron/photos/a.146568808943.115160.64637653943/10154087151968944/?type=3,2016-03-25 10:13:01,33740,1153,381,32885,295,502,45,5,8
64637653943_10154086888778944,Welcome to the family lil bro! #klutchsports #UNINTERRUPTED #StriveForGreatness,UNINTERRUPTED,video,https://www.facebook.com/Uninterrupted/videos/886939474758988/,2016-03-24 07:41:10,5602,168,0,5511,63,18,9,0,1
64637653943_10154067441833944,It's your time now Irish!!! #STATE #GOIRISH #IPROMISE #STRIVEFORGREATNESS,Timeline Photos,photo,https://www.facebook.com/LeBron/photos/a.146568808943.115160.64637653943/10154067441833944/?type=3,2016-03-19 08:18:42,45752,386,475,45087,433,194,33,1,4
64637653943_10154062521698944,Happy St. Patty's Day folks! Have all the fun but please stay safe as well. #GoIrish #IPROMISE #StriveForGreatness,Timeline Photos,photo,https://www.facebook.com/LeBron/photos/a.146568808943.115160.64637653943/10154062521698944/?type=3,2016-03-17 17:51:45,89540,753,2064,88208,983,267,62,8,12
64637653943_10154055886823944,Good seeing the homies! All love over here fam! Keep pushing forward Gs #StriveForGreatness,Timeline Photos,photo,https://www.facebook.com/LeBron/photos/a.146568808943.115160.64637653943/10154055886823944/?type=3,2016-03-15 19:41:00,58484,446,755,57708,616,116,40,2,2
64637653943_10154055884683944,Levitate. Levitate. Levitate. Levitate #StriveForGreatness,Timeline Photos,photo,https://www.facebook.com/LeBron/photos/a.146568808943.115160.64637653943/10154055884683944/?type=3,2016-03-15 16:29:37,102449,1189,3681,99913,1379,1040,97,5,15
64637653943_10154038719343944,IT'S ON. #SMASHVILLE #Blaze,Timeline Photos,photo,https://www.facebook.com/LeBron/photos/a.146568808943.115160.64637653943/10154038719343944/?type=3,2016-03-11 15:16:37,10223,506,139,9981,113,85,39,3,2
64637653943_10154037626528944,S/O to Coach D and the squad. Bring it home for our city #WEAREZIPS #WEAREFAMILY #IPROMISE #StriveForGREATNESS,Akron Zips Men's Basketball,photo,https://www.facebook.com/ZipsMBB/photos/a.260727874045386.57953.204097076375133/892564664195034/?type=3,2016-03-11 10:35:37,1782,60,0,1754,21,7,0,0,0
64637653943_10154027901813944,"It's Not Who You Are Underneath, It's What You Do That Defines You! #IPROMISE",Timeline Photos,photo,https://www.facebook.com/LeBron/photos/a.146568808943.115160.64637653943/10154027901813944/?type=3,2016-03-08 20:12:16,48193,1006,1972,46875,778,100,414,6,20
64637653943_10154014446468944,"Nothing like being around great people! Great dinner, great times!",Timeline Photos,photo,https://www.facebook.com/LeBron/photos/a.146568808943.115160.64637653943/10154014446468944/?type=3,2016-03-03 11:57:01,80250,896,465,79060,949,153,74,9,5
64637653943_10154014444358944,Congrats Coach D and best of luck in the conference tourney! #GoZips,Timeline Photos,photo,https://www.facebook.com/LeBron/photos/a.146568808943.115160.64637653943/10154014444358944/?type=3,2016-03-03 07:45:30,5865,94,67,5806,44,9,5,0,1
64637653943_10154003921943944,ALL BLACK!!!! I see you with the Cavs love too. I hope you guys enjoy the ride.,Timeline Photos,photo,https://www.facebook.com/LeBron/photos/a.146568808943.115160.64637653943/10154003921943944/?type=3,2016-02-27 18:37:43,22442,281,103,22133,200,81,23,2,3
64637653943_10154002815843944,"From home, to the office, to the court, I wouldn't be successful without the people I have around me. BIG s/o to my guy Will who's been killing it at Blaze in Storrs, CT!! Received an email this morning with Will's story and I'm proud of the work he's putting in. 
 
PEOPLE. PEOPLE. PEOPLE. That's the key.",Timeline Photos,photo,https://www.facebook.com/LeBron/photos/a.146568808943.115160.64637653943/10154002815843944/?type=3,2016-02-27 16:19:01,18044,252,179,17714,217,62,42,4,5
64637653943_10154002807383944,They make my world go 'round… #BestJobInTheWorld #CantForgetBabyGirl #IPROMISE,Timeline Photos,photo,https://www.facebook.com/LeBron/photos/a.146568808943.115160.64637653943/10154002807383944/?type=3,2016-02-27 11:04:47,125702,909,1179,121706,3168,179,627,7,15
64637653943_10154002701298944,It just runs in the family! Healthy lifestyles in the James Gang household. Even Baby Z putting that work in. Mother/Daughter combo. #StriveForGreatness #IPROMISE,Timeline Photos,photo,https://www.facebook.com/LeBron/photos/a.146568808943.115160.64637653943/10154002701298944/?type=3,2016-02-27 10:40:19,87460,859,1093,84732,2076,191,443,5,12
