status_id,status_message,link_name,status_type,status_link,status_published,num_reactions,num_comments,num_shares,num_likes,num_loves,num_wows,num_hahas,num_sads,num_angrys
108755587572_10154435614922573,"Boa noite anjos ! #LENSLIGHTPROJECT
@gustavoarrais
💢👊🏻💢",Timeline Photos,photo,https://www.facebook.com/marcoluque/photos/a.10150132225977573.320756.108755587572/10154435614922573/?type=3,2016-06-24 20:50:53,1685,60,4,1612,57,5,11,0,0
108755587572_10154433920087573,"Sexta-feira, todo mundo feliz! Menos os garçons! rsrsrsrs Esse é Gilson, ""filho de Gil"".",Timeline Photos,photo,https://www.facebook.com/marcoluque/photos/a.10150132225977573.320756.108755587572/10154433920087573/?type=3,2016-06-24 09:35:38,11684,204,60,10287,91,13,1293,1,0
108755587572_10154431822752573,#Musta e esse monstro da natureza oceânica Gabriel Medina! No #altashoras desse sábado!!,Timeline Photos,photo,https://www.facebook.com/marcoluque/photos/a.10150132225977573.320756.108755587572/10154431822752573/?type=3,2016-06-23 18:28:45,47004,298,92,44939,1312,71,682,0,0
108755587572_10154428456992573,"Ra-pa-ez! É Carlos, é?",MUSTAFARY -- CARLOS,video,https://www.facebook.com/marcoluque/videos/10154428456992573/,2016-06-22 15:00:00,60709,9385,14031,50877,1350,52,8418,7,5
108755587572_10154428253957573,"QUE ALEGRIA, PAE! Hoje tem VÍDEO NOVO! Às 17h, béleza? Marque todos seus amigos ""serumaninhos"" nesse post pra dilatação ficar completa!",Timeline Photos,photo,https://www.facebook.com/marcoluque/photos/a.10150132225977573.320756.108755587572/10154428253957573/?type=3,2016-06-22 12:43:40,10495,591,93,9764,279,15,435,2,0
108755587572_10154427923412573,Muito massa o que essa turma de heróis anda aprontando !!👏🏼👏🏼👏🏼👊🏼👊🏼👊🏼,Heróis do Bem,link,https://www.facebook.com/Heróis-do-Bem-1004192883005921/,2016-06-22 10:04:33,383,21,0,369,13,1,0,0,0
108755587572_10154426301787573,"Snapdublagem! 👻 luquemarco 
Espia lá! 😂😂😂😂😂",luquemarco,video,https://www.facebook.com/marcoluque/videos/10154426301787573/,2016-06-21 18:04:36,2234,119,60,1821,32,1,379,1,0
108755587572_10154425235917573,,Marco Luque,video,https://www.facebook.com/marcoluque/videos/10154422810522573/,2016-06-21 10:30:38,7586,675,1,6177,225,4,1179,0,1
108755587572_10154422810522573,"Essa tal de natureza me dilata a alma, pae! #Mustafary",,video,https://www.facebook.com/marcoluque/videos/10154422810522573/,2016-06-20 15:13:42,67656,10240,13819,57106,1512,57,8966,10,5
108755587572_10154422349452573,#coleção #toys,Timeline Photos,photo,https://www.facebook.com/marcoluque/photos/a.10150132225977573.320756.108755587572/10154422349452573/?type=3,2016-06-20 07:47:35,9800,168,28,9265,397,82,54,2,0
108755587572_10154422276102573,"TODOS os vídeos estão no canal! Bora lá, paeee: youtube.com/marcoluquetv",Marco Luque's cover photo,photo,https://www.facebook.com/marcoluque/photos/a.10150753543577573.448595.108755587572/10154087489387573/?type=3,2016-06-20 07:04:01,8637,243,73,8292,222,4,119,0,0
108755587572_10154420409392573,"Que honra mais dilatada, pae! Em menos de 1 ano, mais de 600mil serumaninhos inscritos: www.youtube.com/marcoluquetv",Marco Luque,link,http://www.youtube.com/marcoluquetv,2016-06-19 13:47:07,12310,180,26,11704,364,31,211,0,0
108755587572_10154420382062573,"INSCREVA-SE: www.youtube.com/marcoluquetv
*Vídeos às segundas e quartas!",Marco Luque's cover photo,photo,https://www.facebook.com/marcoluque/photos/a.10150753543577573.448595.108755587572/10153643167677573/?type=3,2016-06-19 13:35:42,13285,304,67,12815,287,6,177,0,0
108755587572_10154418330297573,Aeee cururus!!! Recadinho sobre hoje! #AltasHoras,,video,https://www.facebook.com/marcoluque/videos/10154418330297573/,2016-06-18 18:48:21,8615,237,113,7609,153,7,796,44,6
108755587572_10154414484902573,"É fds chegando, pae! Venha comigo no refrão! Venha! #Mustafary",Timeline Photos,photo,https://www.facebook.com/marcoluque/photos/a.10150132225977573.320756.108755587572/10154414484902573/?type=3,2016-06-17 10:56:57,35556,850,281,32962,689,26,1878,0,1
108755587572_10154412530177573,"INSCREVA-SE: www.youtube.com/marcoluquetv
*Vídeos às segundas e quartas!",Marco Luque's cover photo,photo,https://www.facebook.com/marcoluque/photos/a.10150753543577573.448595.108755587572/10153608941622573/?type=3,2016-06-16 17:39:29,2447,47,26,2396,29,1,21,0,0
108755587572_10154411399402573,"Isso é desumano, mano!",O CHUVEIRINHO,video,https://www.facebook.com/marcoluque/videos/10154411399402573/,2016-06-16 10:16:09,37439,5952,6103,28764,123,154,8391,4,3
108755587572_10154409509697573,Ae mano! Fui dá de ispertão no currísculo e a parada reverteu no reverso...,JACKSON FAIVE -- CASTELHANO,video,https://www.facebook.com/marcoluque/videos/10154409509697573/,2016-06-15 15:59:17,24973,2593,2995,21324,244,20,3381,3,1
108755587572_10154408449117573,Ame o Amor. Ame Amar. #Mustafary ❤️,Timeline Photos,photo,https://www.facebook.com/marcoluque/photos/a.10150132225977573.320756.108755587572/10154408449117573/?type=3,2016-06-15 08:50:24,120503,1628,1396,108558,6011,96,5831,4,3
108755587572_10154407378887573,,,video,https://www.facebook.com/marcoluque/videos/10154407378887573/,2016-06-14 22:09:52,241548,154677,5409,146812,54730,2097,36448,512,949
108755587572_10154406715322573,"Pense num serumaninho camuflado, pae! #Mustafary",Timeline Photos,photo,https://www.facebook.com/marcoluque/photos/a.10150132225977573.320756.108755587572/10154406715322573/?type=3,2016-06-14 16:17:01,66405,473,264,61828,1266,21,3285,2,3
108755587572_10154403851807573,"Que fita jow! Nessa friáca, fui metê o loko pra num trampar e si dei mó mal, tiozão!",JACKSON FAIVE -- CONJUTINITE,video,https://www.facebook.com/marcoluque/videos/10154403851807573/,2016-06-13 15:08:23,17443,2028,2455,15068,185,13,2175,0,2
108755587572_10154403241647573,"MUITO OBRIGADO a todos vocês, seus serumaninhos mais dilatados! Mais de 500k no canal (www.youtube.com/marcoluquetv)! Venha pae, venhaaaaa!!! #Mustafary #MarcoLuqueTV",MUSTAFARY -- 500K,video,https://www.facebook.com/marcoluque/videos/10154403241647573/,2016-06-13 09:57:50,65344,5549,5007,56329,2534,70,6408,0,3
108755587572_10154401319992573,"Eae jows!!! Pra quem perdeu o programa de onti, tá na mão! #RapValentimes #AltasHoras #Jackson5 Rede Globo",Marco Luque se apresenta como Jackson Faive - Altas Horas,video,http://gshow.globo.com/programas/altas-horas/videos/t/programa/v/marco-luque-se-apresenta-como-jackson-faive/5088521/,2016-06-12 15:21:05,8543,209,116,8065,167,10,300,0,1
108755587572_10154400652252573,❤️😍,Timeline Photos,photo,https://www.facebook.com/marcoluque/photos/a.10150132225977573.320756.108755587572/10154400652252573/?type=3,2016-06-12 10:21:36,43194,523,8,42102,959,113,18,1,1
108755587572_10154398026747573,Ae joww! Num perde o #AltasHoras de hoge naum pq o prograna tá romancísptico ao esstremo! #RapValentimesDay #Jackson5 📷 Ramón Vasconcelos,Timeline Photos,photo,https://www.facebook.com/marcoluque/photos/a.10150132225977573.320756.108755587572/10154398026747573/?type=3,2016-06-11 19:50:00,10444,186,51,9826,227,9,381,1,0
108755587572_10154398040232573,Helloooo Riusten!!! Hoje eu estarei no #AltasHoras! Sim! Chupa 3°B! O mundo gira! #EdNerd #DiaDosNamorados 📷 Ramón Vasconcelos,Timeline Photos,photo,https://www.facebook.com/marcoluque/photos/a.10150132225977573.320756.108755587572/10154398040232573/?type=3,2016-06-11 17:01:30,9747,232,48,9026,211,13,497,0,0
108755587572_10154397778327573,Bom dia galeraaaa,,video,https://www.facebook.com/marcoluque/videos/10154397778327573/,2016-06-11 08:28:29,18336,1388,2137,15069,295,20,2951,1,0
108755587572_10154397659617573,,,video,https://www.facebook.com/marcoluque/videos/10154397659617573/,2016-06-11 07:30:27,7590,120,453,7360,163,7,58,0,2
108755587572_10154395175337573,"Que companhia mais délíciósa, pae!",,video,https://www.facebook.com/marcoluque/videos/10154395175337573/,2016-06-10 09:08:53,45054,3439,5952,38841,1588,17,4601,2,5
108755587572_10154392279632573,"Bom dia seus serumaninhos mais dilatadinhos!
Quem viu o vídeo de onti, pae? #sensassã",Marco Luque,video,https://www.facebook.com/marcoluque/videos/10154389462437573/,2016-06-09 08:32:59,15951,1327,0,13148,617,12,2173,0,1
108755587572_10154389462437573,"Que serumaninho não deseja uma sensassã dessa, pae?",MUSTAFARY -- SENSASSÃ,video,https://www.facebook.com/marcoluque/videos/10154389462437573/,2016-06-08 10:12:54,113919,23122,42186,96779,3571,67,13493,5,4
108755587572_10154389345857573,"Tô concorrendo na categoria: ""Melhor criador de personagens"" 
Votem lá seus serumaninhos dilatados: 
www.risadaria.com.br/premio #Mustafary",Timeline Photos,photo,https://www.facebook.com/marcoluque/photos/a.10150132225977573.320756.108755587572/10154389345857573/?type=3,2016-06-08 08:55:17,41340,1107,341,39374,1346,39,579,1,1
108755587572_10154386790782573,"Só de saber que amanhã tem vídeo novo eu me dilato todinho, pae! 
Venhaaaa: www.youtube.com/marcoluquetv",Timeline Photos,photo,https://www.facebook.com/marcoluque/photos/a.10150132225977573.320756.108755587572/10154386790782573/?type=3,2016-06-07 10:57:21,29588,409,124,27201,766,25,1593,2,1
108755587572_10154385196177573,#Mustafary no snap! 👻 luquemarco em 9 8 7 5... er... 6 5...,,video,https://www.facebook.com/marcoluque/videos/10154385196177573/,2016-06-06 20:27:14,14805,601,383,13197,394,7,1206,1,0
108755587572_10154383791527573,"Venha Sharon! Sinta o love invadir seus poros, baby!",SILAS SIMPLESMENTE -- LOVE ME,video,https://www.facebook.com/marcoluque/videos/10154383791527573/,2016-06-06 09:43:48,18145,1824,3026,16037,207,5,1895,0,1
108755587572_10154383758902573,Johnnyes Depps,Timeline Photos,photo,https://www.facebook.com/marcoluque/photos/a.10150132225977573.320756.108755587572/10154383758902573/?type=3,2016-06-06 08:25:21,39016,509,1120,35131,3137,667,72,4,5
108755587572_10154381821697573,"Hey monxters!!! ESTREIA do garçom Gilson no #AltasHoras 👊🏼 Curtiram? Pra quem perdeu, é só dar o play! #filhodegil",Marco Luque apresenta novo personagem: o garçom Gilson - Altas Horas - Catálogo de Vídeos,video,http://goo.gl/wnaoyv,2016-06-05 12:44:19,12931,699,258,11989,328,7,603,1,3
108755587572_10154380635537573,"Ae #LauraFlausini, qual é a melhor estação do ano pra nóiz medir nossos próspios pênis? O inverno judia di nóiz, jow! #Jackson5 #AltasHoras",Timeline Photos,photo,https://www.facebook.com/marcoluque/photos/a.10150132225977573.320756.108755587572/10154380635537573/?type=3,2016-06-05 00:40:57,17604,382,116,15688,280,10,1624,1,1
108755587572_10154380611212573,"Em casa Di Ferrero, o espeto é de pau? Quem tá vendo? Jájá, o #Jackson5 ataca! 😁 #Gilson #Garçom #AltasHoras Rede Globo Isabeli Fontana 👊🏼",Timeline Photos,photo,https://www.facebook.com/marcoluque/photos/a.10150132225977573.320756.108755587572/10154380611212573/?type=3,2016-06-05 00:23:32,10639,327,38,9717,260,5,656,1,0
108755587572_10154379920282573,"Booora que hoje é dia de #AltasHoras e tem novidade na área! Tá demais! Depois do jogo da seleça, o bicho pega! Rede Globo #Garçom #Gilson",Timeline Photos,photo,https://www.facebook.com/marcoluque/photos/a.10150132225977573.320756.108755587572/10154379920282573/?type=3,2016-06-04 17:42:26,6660,243,22,6354,133,9,163,0,1
108755587572_10154377478667573,👀👀👀👀👀👀👀👀👀,Timeline Photos,photo,https://www.facebook.com/marcoluque/photos/a.10150132225977573.320756.108755587572/10154377478667573/?type=3,2016-06-03 17:04:48,66451,1761,5771,59905,720,34,5790,1,1
108755587572_10154376095302573,"Eaí galeraaa! Fimose??? Semana de Love chegando, baby!",SILAS SIMPLESMENTE -- FRUTAS VERMELHAS,video,https://www.facebook.com/marcoluque/videos/10154376095302573/,2016-06-03 10:00:57,13805,953,1345,12359,235,7,1202,1,1
108755587572_10154374408662573,#VaiQueCola 🎥👊🏼👊🏼 Cacau Protasio,Timeline Photos,photo,https://www.facebook.com/marcoluque/photos/a.10150132225977573.320756.108755587572/10154374408662573/?type=3,2016-06-02 11:01:47,21666,262,17,20902,613,16,135,0,0
108755587572_10154372897847573,Porque qui nóiz num si une jow??? #j5,JACKSON FAIVE -- INVERSÃO,video,https://www.facebook.com/marcoluque/videos/10154372897847573/,2016-06-01 18:56:25,42706,5354,15448,38567,572,19,3542,2,4
108755587572_10154368030377573,"Tô incrustilhado com esse tiozinho, jow!!! Dêxa ele pra min... #jackson5",JACKSON FAIVE -- UNFOLLOW,video,https://www.facebook.com/marcoluque/videos/10154368030377573/,2016-05-30 16:25:47,32083,2899,2855,28943,352,18,2748,20,2
108755587572_10154364539327573,"Taee galera! O vídeo do #Mustafary com o cachorro, em alta qualidade!",,video,https://www.facebook.com/marcoluque/videos/10154364539327573/,2016-05-29 08:09:08,106193,20649,29956,88665,4657,55,12802,7,5
108755587572_10154362572197573,"De um lado, uma lenda rastafariana! 
Do outro, Julian Marley! Filho de Bob! 

Hoje (jájá) no #AltasHoras, pae!",Timeline Photos,photo,https://www.facebook.com/marcoluque/photos/a.10150132225977573.320756.108755587572/10154362572197573/?type=3,2016-05-28 19:47:00,162840,2976,2606,151589,5748,341,5151,5,5
108755587572_10154362562542573,"Hoje, o #AltasHoras tá a dilatação em pessoa! Sinta, pae! Rede Globo #Mustafary",HOJE no #AltasHoras!,video,https://www.facebook.com/marcoluque/videos/10154362562542573/,2016-05-28 16:17:00,27703,1084,619,25690,670,13,1328,1,1
108755587572_10154360533987573,"Bora fazer uns snaps, pae! #Mustafary 
Espia lá! 👻 luquemarco",Timeline Photos,photo,https://www.facebook.com/marcoluque/photos/a.10150132225977573.320756.108755587572/10154360533987573/?type=3,2016-05-27 11:47:37,34343,603,186,32141,883,23,1294,1,1
108755587572_10154356349082573,"Deixem os ratos em paz, pae! #Mustafary",MUSTAFARY -- CÓCEGAS,video,https://www.facebook.com/marcoluque/videos/10154356349082573/,2016-05-25 16:13:55,88176,15372,17214,78128,1635,30,8367,5,11
108755587572_10154353252862573,"Oh pae, que onda! ELA ACEITOU! Boraaaa então Paolinha! #AltasHoras",Altas Horas | Paolla Oliveira aceita convite de Marco Luque | Globo Play,link,https://globoplay.globo.com/v/5041095/,2016-05-24 10:14:27,8926,450,122,8170,212,12,532,0,0
108755587572_10154343284657573,"Ra-paz, o dia dos namorados tá logo aí! Aliás, dia NÃO! É a semana todinha, pae!",Mustafary -- Tinino,video,https://www.facebook.com/marcoluque/videos/10154343284657573/,2016-05-23 12:08:00,100527,33527,48263,89755,1662,47,9055,4,4
108755587572_10154347857177573,"Quals picos cêis ten vontade di conhecer, jows? #j5",Jackson Faive -- MAPA MÚMBI,video,https://www.facebook.com/marcoluque/videos/10154347857177573/,2016-05-22 10:46:15,23568,5454,6496,21053,286,9,2218,1,1
108755587572_10154346244692573,Aeee jow! Hoje é dia de #AltasHoras e se prepara que vão rolar vááárias fita cabulóstica! #j5,Timeline Photos,photo,https://www.facebook.com/marcoluque/photos/a.10150132225977573.320756.108755587572/10154346244692573/?type=3,2016-05-21 18:29:50,5213,93,37,4982,80,1,148,2,0
108755587572_10154343475682573,Alô galerinha de Ribeirão Preto - SP! É nesse Domingo (22/05)! Bora dar muitas risadas no Teatro Municipal #Tamojunto,Tamo Junto -- Ribeirão Preto,video,https://www.facebook.com/marcoluque/videos/10154343475682573/,2016-05-20 15:50:47,3064,152,30,2967,76,1,20,0,0
108755587572_10154341290467573,Alô galera de São João da Boa Vista - SP! É nesse sábado (21/05)! Bora dar muitas risadas no Teatro Municipal #Tamojunto,,video,https://www.facebook.com/marcoluque/videos/10154341290467573/,2016-05-19 16:53:34,1700,91,13,1651,39,4,6,0,0
108755587572_10154340928667573,Mustafary!!!!,,video,https://www.facebook.com/marcoluque/videos/10154340928667573/,2016-05-19 14:22:47,110117,155681,1217,71592,22295,1185,14289,250,506
108755587572_10154340582727573,Hoje a tarde o Mustafary vai fazer uns snaps! 👻 luquemarco,,status,,2016-05-19 11:42:50,2168,94,1,2080,47,5,36,0,0
108755587572_10154338016927573,"Rapaz, como é que um ser humano chega numa conclusão dilatada dessa? #Mustafary",Mustafary -- Língua,video,https://www.facebook.com/marcoluque/videos/10154338016927573/,2016-05-18 16:56:59,47485,9696,11449,42418,875,27,4162,1,2
108755587572_10154335572837573,"Seus safadênhos! Entrevista com a #MaryHelp (na íntegra)!
Para quem não viu, boraêêê!!!! #AltasHoras",Altas Horas | Marco Luque faz uma performance como Mary Help | Globo Play,link,https://globoplay.globo.com/v/4978084/,2016-05-17 14:59:11,4185,261,182,3689,201,3,291,1,0
108755587572_10154332816077573,"Minha mina tá encanada, jow... 
Mas esse ano a parada vai reverter ao contrário! 
#diadosnamorados #jackson5 #tácheganu",JACSKON5 -- ROSAS,video,https://www.facebook.com/marcoluque/videos/10154332816077573/,2016-05-16 12:05:00,16572,2617,9658,15367,121,11,1072,1,0
108755587572_10154331122497573,Você acorda feliz? #SilasSimplesmente,SILAS SIMPLESMENTE -- ERECTO,video,https://www.facebook.com/marcoluque/videos/10154331122497573/,2016-05-15 16:44:28,5960,628,747,5438,56,1,462,1,2
108755587572_10154325777127573,"Quem conferiu minha estreia no #AltasHoras???
Se não viu, é só clicar!!!! Tmj monxters",Altas Horas | Serginho entrevista personagens de Marco Luque | Globo Play,link,http://globoplay.globo.com/v/4962752/,2016-05-13 10:08:05,7674,622,397,6936,336,7,395,0,0
108755587572_10154324469842573,"Nessa terça acompanhei um dia de gravação do ""Vai Que Cola""! Me apaixonei pelo projeto e pelas pessoas envolvidas. ❤️❤️ Demais!! Na próxima semana começo a gravar com eles! Paulo Gustavo Fiorella Mattheis  Marcus Majella  Catarina Abdalla Cacau Protasio Samantha Schmütz",Timeline Photos,photo,https://www.facebook.com/marcoluque/photos/a.10150132225977573.320756.108755587572/10154324469842573/?type=3,2016-05-12 18:15:20,7093,217,30,6527,451,92,23,0,0
108755587572_10154324148392573,"Galera de Joinville, esse fim de semana promete!! Vamo dar risada? Vamo! #tamojunto
Dias 14 e 15! Garanta seu ingresso: https://www.ticketcenter.com.br/evento.php?id=931",Joinville -- Tamo Junto,video,https://www.facebook.com/marcoluque/videos/10154324148392573/,2016-05-12 15:41:51,1417,128,35,1374,32,3,8,0,0
108755587572_10154321649492573,Alô Jaraguá do Sul!! É nessa sexta (13/05)!! Borá dar muita risada!! #tamojunto no Teatro Scar!  https://www.ticketcenter.com.br/evento.php?id=932,Jaraguá do Sul -- Tamo Junto,video,https://www.facebook.com/marcoluque/videos/10154321649492573/,2016-05-11 13:30:58,1260,82,43,1218,36,3,2,1,0
108755587572_10154321163407573,"Olha essa mina, jow! Xonei!",Jackson5 -- YOGA,video,https://www.facebook.com/marcoluque/videos/10154321163407573/,2016-05-11 08:55:23,9906,1153,1338,8859,98,6,940,1,2
108755587572_10154319203022573,"Aeee jows! Cêis pediram, taê!!! 
Homenagem que o Jackson5 fez pra sua mamis no #AltasHoras!",Altas Horas | Marco Luque como Jackson Faive | Globo Play,link,http://globoplay.globo.com/v/5009503/,2016-05-10 10:43:50,8335,519,385,7516,246,8,564,1,0
108755587572_10154317539812573,"É muita cabra, pae! #Mustafary",MUSTAFARY -- SOTAQUE,video,https://www.facebook.com/marcoluque/videos/10154317539812573/,2016-05-09 16:58:59,43599,13100,15341,38459,764,22,3952,2,4
108755587572_10154315597272573,Te Amo mãezoca! Vc sempre soube quem eu era e botou lenha na fogueira certa da minha vida. Sou quem sou graças à vc! ❤️❤️,Timeline Photos,photo,https://www.facebook.com/marcoluque/photos/a.10150132225977573.320756.108755587572/10154315597272573/?type=3,2016-05-08 20:21:07,11274,69,10,10500,384,5,9,0,0
108755587572_10154312973257573,"Momento em que Jackson5, no #AltasHoras, saca a carta pra sua mamis em homenagem ao #diadasmães!",Timeline Photos,photo,https://www.facebook.com/marcoluque/photos/a.10150132225977573.320756.108755587572/10154312973257573/?type=3,2016-05-07 21:34:51,14344,475,78,13442,307,10,555,1,0
108755587572_10154312878237573,Corre pra Rede Globo que jájá tem #AltasHoras e vai rolar uma homenagem restignada do Jackson5 pra mamis dele!,,status,,2016-05-07 20:40:58,2525,172,6,2394,62,2,63,0,1
108755587572_10154312410687573,"Ei Serginhooo! Estamos chegandôô! Chupa 3ºB! HOJE TEM #AltasHoras! 
(📷 by Marcos Mazini)",Timeline Photos,photo,https://www.facebook.com/marcoluque/photos/a.10150132225977573.320756.108755587572/10154312410687573/?type=3,2016-05-07 16:30:39,2583,99,15,2444,36,2,99,0,0
108755587572_10154309499477573,"Sabe o ditado que diz: ""O que não te mata, te fortalece?"" 
Então. A recíproca também é verdadeira: ""O que não te fortalece, te mata.""",,status,,2016-05-06 12:06:33,3378,50,175,3190,53,14,118,2,0
108755587572_10154307812692573,"Aeeeee! Que honra! 😁 • Vota em nóiz, queiróiz: www.risadaria.com.br/premio",Timeline Photos,photo,https://www.facebook.com/marcoluque/photos/a.10150132225977573.320756.108755587572/10154307812692573/?type=3,2016-05-05 19:58:24,6145,184,51,5950,152,9,34,0,0
108755587572_10154304716207573,Venha tibetano! Venha! #Mustafary,MUSTAFARY -- TIBETANOS,video,https://www.facebook.com/marcoluque/videos/10154304716207573/,2016-05-04 16:46:15,21374,2797,3197,19210,387,9,1763,1,1
108755587572_10154304679687573,"NOTA – APRESENTAÇÃO DE MARCO LUQUE EM FRANCA É ADIADA

Informamos que, devido a problemas de saúde, a apresentação do humorista Marco Luque no ""Stand up Comedy & Music"", na cidade de Franca, foi adiada. 

A previsão é de que a nova data de apresentação, ainda a ser definida, seja no mês de julho, na 3ª edição do evento, que contará com a presença de Rafael Cortez. Os clientes que adquiriram o ingresso para assistir ao espetáculo do Marco Luque poderão conferir o solo dos dois artistas no mês de julho.

Para aqueles que quiserem estornar o valor pago, devem entrar em contato com o vendedor credenciado que o atendeu ou, caso o ingresso tenha sido adquirido pelo site http://quero2ingressos.com.br/, com os responsáveis pelo mesmo.
Os consumidores também poderão ser atendidos no ponto de venda oficial, localizado no Shopping do Calçado de Franca, com atendimento disponibilizado das 14h às 21h.

Att,
Melina Tavares Comunicação",Timeline Photos,photo,https://www.facebook.com/marcoluque/photos/a.10150132225977573.320756.108755587572/10154304679687573/?type=3,2016-05-04 14:47:58,1070,77,18,999,12,14,2,43,0
108755587572_10154299700912573,"Seje gringo, juvena!
#napegadapoliflota",SILAS SIMPLESMENTE -- Gringos,video,https://www.facebook.com/marcoluque/videos/10154299700912573/,2016-05-02 17:01:57,7167,913,1281,6506,75,4,582,0,0
108755587572_10154296559947573,"Seja um verdadeiro foguete, pae! 
#aprendaseugringodilatado",Mustafary -- FOGUETE,video,https://www.facebook.com/marcoluque/videos/10154296559947573/,2016-05-01 10:46:52,31877,8669,7652,28304,427,12,3128,2,1
108755587572_10154295179682573,"Oh meu pae, que onda! Corra pra Rede Globo que logo mais tô chegando! #AltasHoras #Mustafary (📷 by Reinaldo Marques)",Timeline Photos,photo,https://www.facebook.com/marcoluque/photos/a.10150132225977573.320756.108755587572/10154295179682573/?type=3,2016-04-30 20:07:23,18602,716,179,17468,572,23,537,1,1
108755587572_10154294944577573,"Eaí galera, fimose??? Hoje tem #SilasSimplesmente no #AltasHoras! Tá demais! Liga nóixxx! 👊🏼 (📷 by Ramón Vasconcelos)",Timeline Photos,photo,https://www.facebook.com/marcoluque/photos/a.10150132225977573.320756.108755587572/10154294944577573/?type=3,2016-04-30 18:04:02,5759,125,31,5560,80,5,112,0,1
108755587572_10154290191672573,"Me divertindo com o snap, galera!
Segue lá! 👻 luquemarco",,video,https://www.facebook.com/marcoluque/videos/10154290191672573/,2016-04-28 18:58:00,1315,49,41,1237,24,3,51,0,0
108755587572_10154290047022573,Alô Espírito Santo do Pinhal e Rio Claro!!! Tô chegando com o meu espetáculo #TamoJunto!!! Boraaaaaê!,Timeline Photos,photo,https://www.facebook.com/marcoluque/photos/a.10150132225977573.320756.108755587572/10154290047022573/?type=3,2016-04-28 17:25:29,490,41,3,477,12,0,1,0,0
108755587572_10154287385492573,"Isso não é roupa suja não, lazarenta! #patroadomal",MARY HELP -- Roupa Suja,video,https://www.facebook.com/marcoluque/videos/10154287385492573/,2016-04-27 17:28:33,5103,737,634,4429,107,8,558,1,0
108755587572_10154286384482573,"Eu e minha gata, minha gata e eu.",Timeline Photos,photo,https://www.facebook.com/marcoluque/photos/a.10150132225977573.320756.108755587572/10154286384482573/?type=3,2016-04-27 08:45:19,11272,179,3,11086,128,48,8,0,2
108755587572_10154283910352573,Um jow no programa do outro jôw! #j5,Timeline Photos,photo,https://www.facebook.com/marcoluque/photos/a.10150132225977573.320756.108755587572/10154283910352573/?type=3,2016-04-26 08:14:00,7146,115,37,6960,71,2,111,1,1
108755587572_10154282533292573,"Esse deu azar hein, mano!",Jackson Faive -- Malcom Miela,video,https://www.facebook.com/marcoluque/videos/10154282533292573/,2016-04-25 16:34:39,10397,1081,1752,9573,56,5,763,0,0
108755587572_10154281706522573,Hahahahahahahaha quando o efeito não acontece 😂😂😂😂 meu snap - luquemarco - segue lá,,video,https://www.facebook.com/marcoluque/videos/10154281706522573/,2016-04-25 08:55:40,1473,75,32,1305,16,2,150,0,0
108755587572_10154278426057573,Liga na Rede Globo! #MaryHelp e #Jackson5 já colaram!!! Ó quem vem daqui a poucooo! #EdNerd #AltasHoras,Timeline Photos,photo,https://www.facebook.com/marcoluque/photos/a.10150132225977573.320756.108755587572/10154278426057573/?type=3,2016-04-23 22:30:09,8000,242,34,7694,133,8,162,2,1
108755587572_10154278261112573,É daqui a pouco! Liga na Rede Globo que a #MaryHelp tá chegando com tudo! #altashoras,Timeline Photos,photo,https://www.facebook.com/marcoluque/photos/a.10150132225977573.320756.108755587572/10154278261112573/?type=3,2016-04-23 20:49:55,11186,402,67,10494,352,12,326,0,2
