status_id,status_message,link_name,status_type,status_link,status_published,num_reactions,num_comments,num_shares,num_likes,num_loves,num_wows,num_hahas,num_sads,num_angrys
18478252282_10153523808582283,"Damn what they feedin these lil mufuckas nowadays? I thought that mufucka was in his 30's, i aint know he was a kid.",Comedian Katt Williams Gets the Life Beaten Out of Him By a Teenager [Video],link,http://goo.gl/yDCyCr,2016-03-27 11:23:00,3929,378,234,3536,20,31,329,6,7
18478252282_10153517260007283,That karma get yo ass everytime. A couple a these fucked me all the way up. Whats ya favorite?,25 Hilarious Examples Of Instant Karma That'll Leave You Satisfied.,link,http://goo.gl/DGy4Ps,2016-03-26 20:18:00,2589,93,408,2313,30,18,224,0,4
18478252282_10153517271332283,"She got that ""You spoke too soon mufucka"" face. She just gone ease yo ass into the crazy, but trust, its comin.",Timeline Photos,photo,https://www.facebook.com/MartinLawrence/photos/a.437044652282.236578.18478252282/10153517271332283/?type=3,2016-03-26 18:21:57,12828,285,1106,11953,113,4,757,0,1
18478252282_10153524292497283,Naptown ya boy is in the building tonight! #soundcheck #DoinTime #Indianapolis  Tickets: http://bit.ly/DoinTimeTour,Timeline Photos,photo,https://www.facebook.com/MartinLawrence/photos/a.437044652282.236578.18478252282/10153524292497283/?type=3,2016-03-26 16:28:45,228,34,10,217,10,0,1,0,0
18478252282_10153517235192283,"THATS what Im talkin bout! Ladies out here killin shit. I love seein that. Gotta holla at Beyonce, cause I might need to burrow that, she ridin clean! Which car yall like the best?",17 Female Celebs Who Drive The Hottest Cars,link,http://goo.gl/GVUyl0,2016-03-26 16:28:00,2576,81,108,2516,37,15,5,3,0
18478252282_10153517270107283,Gotta have big dreams an make em happen. Ay but i know i aint the only one that tried to read what he crossed out am i?,Timeline Photos,photo,https://www.facebook.com/MartinLawrence/photos/a.437044652282.236578.18478252282/10153517270107283/?type=3,2016-03-26 13:11:00,5337,152,488,5019,61,6,250,1,0
18478252282_10153517231797283,"This what I like to see, people just lookin out for each other. This is dope.","They Saw A Woman Crying At The Drive-Thru, And What They Did Will Shatter You Heart.",link,http://goo.gl/kwZGcm,2016-03-26 11:46:00,2087,45,154,1960,109,12,0,5,1
18478252282_10153517268367283,"He think he in love now, just wait til he find out about hot sauce on wings, he gone lose his mind.",Timeline Photos,photo,https://www.facebook.com/MartinLawrence/photos/a.437044652282.236578.18478252282/10153517268367283/?type=3,2016-03-25 18:16:00,16775,396,1846,15395,368,7,1002,2,1
18478252282_10153517127307283,"Lotta scattered ass in these pix, I aint mad at whoever compiled the list. Im rollin with Serena on this one. Who yall choosin?",20 Female Celebrities With The Hottest Assets,link,http://goo.gl/9xtpfh,2016-03-25 16:24:00,1549,257,67,1490,29,7,19,3,1
18478252282_10153520869442283,"Columbus last night was dope! 2nd show tonight and tomorrow ya boy in Naptown lets get it! Tickets: http://bit.ly/DoinTimeTour
 #soundcheck #Columbus #DoinTime #Indianapolis",Timeline Photos,photo,https://www.facebook.com/MartinLawrence/photos/a.437044652282.236578.18478252282/10153520869442283/?type=3,2016-03-25 16:12:24,464,42,20,446,15,0,3,0,0
18478252282_10153517267132283,Aint nothin wrong with either of em. Gotta take the good with the bad. Plus we all know a brotha that would hit em both am I lyin?,Timeline Photos,photo,https://www.facebook.com/MartinLawrence/photos/a.437044652282.236578.18478252282/10153517267132283/?type=3,2016-03-25 13:56:00,4633,494,1562,3937,19,38,634,2,3
18478252282_10153517121757283,"Fuuuuuuuuck THAT shit, you aint even gettin my ass on the table. Damn the wax, ill take the ass fro over the pain any day.",Guys Getting EVERYTHING Waxed For The First Time...You'll Be Reduced To Tears!,link,http://goo.gl/8ymNBy,2016-03-25 11:13:00,837,77,66,714,3,8,111,0,1
18478252282_10153520107807283,How I feel cuz it's mothafuckin Friday! Martin show fans been ridin wit me for years. Download my new #Runteldat app by Victorious for exclusive Martin content. ✌🏿️much love,,video,https://www.facebook.com/MartinLawrence/videos/10153520107807283/,2016-03-25 10:54:43,7812,214,959,7319,209,4,279,0,1
18478252282_10153508931627283,"Ay cant blame him for keepin it real as a youngin. All his missin is the big sean song in the background ""I dont fuck with you""",Timeline Photos,photo,https://www.facebook.com/MartinLawrence/photos/a.437044652282.236578.18478252282/10153508931627283/?type=3,2016-03-24 18:26:00,16176,576,1725,14281,186,39,1666,2,2
18478252282_10153510316292283,"ALL that shit got me wonderin what the fuck the internet got me lookin at. I gotta stop scrollin through all this shit, i threw up in my mouth a little bit seein some of this shit. 
http://goo.gl/W66Vhj",15 Pictures That Will Make You Wonder WTF Is Happening,link,http://goo.gl/W66Vhj,2016-03-24 18:13:00,1132,172,196,1003,8,35,83,2,1
18478252282_10153517885092283,#TBT y'all didn't know I used to ball? See this pic in color and spot me in this pic as a youngin by downloading my free new app #Runteldat by Victorious,Timeline Photos,photo,https://www.facebook.com/MartinLawrence/photos/a.437044652282.236578.18478252282/10153517885092283/?type=3,2016-03-24 17:45:12,524,38,12,516,4,0,4,0,0
18478252282_10153517706247283,"Columbus, Ohio ya boy is in the building tonight & tomorrow! #Soundcheck #DoinTime 

Tickets: bit.ly/DoinTimeTour
Philly Tickets: bit.ly/DoinTimePhiladelphia

3/24/16 Columbus, OH / Palace Theatre
3/25/16 Columbus, OH / Palace Theatre
3/26/16 Indianapolis, IN / Indiana Farmers Coliseum
4/1/16 Nashville, TN / Bridgestone Arena     
4/2/16Memphis, TN / Orpheum Theater
4/3/16Memphis, TN / Orpheum Theater
4/22/16 Raleigh, NC / PNC Arena      
4/23/16 Charlotte, NC / Bojangles' Coliseum  
4/29/16 Philadelphia, PA / Liacouras Center        
4/30/16 Boston, MA / Citi Performing Arts Center           
5/14/16 Brooklyn, NY / Barclays Center",,video,https://www.facebook.com/MartinLawrence/videos/10153517706247283/,2016-03-24 16:39:56,174,16,22,165,7,0,2,0,0
18478252282_10153517514507283,"Mic check one, two...Columbus I'm here #soundcheck #DoinTime #Runteldat Get my new app y'all to keep up wit yo boy",Timeline Photos,photo,https://www.facebook.com/MartinLawrence/photos/a.437044652282.236578.18478252282/10153517514507283/?type=3,2016-03-24 15:26:55,5603,153,122,5480,107,2,14,0,0
18478252282_10153510091712283,Whew that public transportation is a mufucka. We all been there but its some weird mufuckas out there. Whats some of the craziest shit yall seen riding that bus/train?,Public transportation can be a strange place (30 Photos),link,http://goo.gl/p67197,2016-03-24 14:23:00,1142,106,139,1042,7,1,89,2,1
18478252282_10153508909742283,That dog dont give a fuck about them compliments. He just want that camera out his face.,Timeline Photos,photo,https://www.facebook.com/MartinLawrence/photos/a.437044652282.236578.18478252282/10153508909742283/?type=3,2016-03-24 13:16:00,10506,226,477,9771,77,4,652,0,2
18478252282_10153510081927283,"Never know how you can get discovered in this game. That boy can sang! RiRi snatched that mic back fast than a mufucka like ""You aint bouta steal the show at MY shit"" Go head RiRi discoverin folks out here.",Rihanna Was Just Blown Away By A Fan On Tour & Her Reaction Is Everything,link,http://goo.gl/J1QRyt,2016-03-24 09:17:00,6045,149,511,5663,141,24,215,1,1
18478252282_10153508895897283,Ay at least he know he gettin some at the end of the night. We all been there.,Timeline Photos,photo,https://www.facebook.com/MartinLawrence/photos/a.437044652282.236578.18478252282/10153508895897283/?type=3,2016-03-23 18:11:00,6926,199,507,6299,48,7,572,0,0
18478252282_10153514545862283,What Would Martin Do Wednesday with topic: If I were President. Got to my new app to see my crazy response. #Runteldat by Victorious. #WWMDW,,video,https://www.facebook.com/MartinLawrence/videos/10153514545862283/,2016-03-23 17:05:00,2080,88,89,2021,24,3,30,0,2
18478252282_10153510012162283,Nicki's shots was so good she dropped two on they ass. Im a fan. Whose was yall favorite?,Kim K Isn't The Only One To Post Nude Selfies – Check Out These 16 Celebs Who Bared It All,link,http://goo.gl/OKtc0q,2016-03-23 16:38:43,1311,69,64,1268,16,7,6,1,13
18478252282_10153514422182283,"Columbus! Tomorrow ya boy ol Marty Mar is coming to your city!  
Tickets: http://bit.ly/DoinTimeColumbusOhio #DoinTime #Columbus","Martin Lawrence at Palace Theatre Columbus on Mar 24, 2016",link,http://bit.ly/DoinTimeColumbusOhio,2016-03-23 16:23:31,88,9,8,87,0,0,1,0,0
18478252282_10153510027182283,Now thats some funny shit. Good peoples right there. Glad it worked out cause that shit coulda went different than a mufucka.,"Family Sends Text To Wrong Number About Their Newborn, So The Stranger Does The Unexpected",link,http://goo.gl/P4ScuA,2016-03-23 14:48:00,3122,81,274,2905,149,5,63,0,0
18478252282_10153514001212283,Headed to Columbus and then Indianapolis...see ya when I see ya! #DoinTime #Runteldat #TeamMartyMar ✌🏿,Timeline Photos,photo,https://www.facebook.com/MartinLawrence/photos/a.437044652282.236578.18478252282/10153514001212283/?type=3,2016-03-23 13:42:27,9206,198,163,9015,154,10,26,1,0
18478252282_10153508855432283,"I wonder if this is race specific cause if a sista or a latina pull out a knife they aint makin no damn sandwich, it may just be a ""filet of a cheatin mufucka.""",Timeline Photos,photo,https://www.facebook.com/MartinLawrence/photos/a.437044652282.236578.18478252282/10153508855432283/?type=3,2016-03-23 13:04:00,15946,1208,4466,14007,131,23,1770,2,13
18478252282_10153508935477283,Its always the weather girls aint it. Just tell me the channel she on so I can support her. Better than lookin at old tittys while you gettin the news,This Busty Bisexual Weather Woman Is Shocking Viewers,link,http://goo.gl/6lArli,2016-03-23 11:28:00,1783,80,94,1660,10,23,90,0,0
18478252282_10153508100492283,Snoops dog look high as fuck,Celebrities And Their Animal Doppelgangers,link,http://goo.gl/UkkQz0,2016-03-22 20:12:00,4652,128,326,4250,35,3,364,0,0
18478252282_10153511707987283,Y'all didn't know I used to play the drums? #Iusedtobeinaband #Iwasineverytalentshow #IfOnlyIcouldSang,Timeline Photos,photo,https://www.facebook.com/MartinLawrence/photos/a.437044652282.236578.18478252282/10153511707987283/?type=3,2016-03-22 19:37:08,18596,451,202,18064,224,28,280,0,0
18478252282_10153508107017283,They hit that shit on the head with this one.,Timeline Photos,photo,https://www.facebook.com/MartinLawrence/photos/a.437044652282.236578.18478252282/10153508107017283/?type=3,2016-03-22 18:14:00,16392,1350,4118,14626,59,27,1678,1,1
18478252282_10153508097562283,Gotta love them thongs. Fergie Ferg doin the damn thang aint she. Jennifer got that granny panty thong tho.,8 Celebs Who Were Badly Caught With Naughty Thong Slips,link,http://goo.gl/4iX2kH,2016-03-22 16:23:00,2512,62,86,2379,19,40,68,3,3
18478252282_10153511008787283,"Ya boy is in Columbus & Indianapolis this week! See y'all soon! 
Tickets: http://bit.ly/DoinTimeTour  #DoinTime #Columbus #Indianapolis",Martin Lawrence,link,http://bit.ly/DoinTimeTour,2016-03-22 15:21:53,74,6,7,73,1,0,0,0,0
18478252282_10153508102867283,That look real patriotic but aint McDonalds Irish? I know i aint trippin am i,Timeline Photos,photo,https://www.facebook.com/MartinLawrence/photos/a.437044652282.236578.18478252282/10153508102867283/?type=3,2016-03-22 13:23:00,7206,160,485,6864,33,9,300,0,0
18478252282_10153508093752283,"Shiiiiit they be lyin with some of that shit. The eyes? Get the fuck outta here. An I aint know Canada was gettin down like that, that must be that free health care.",10 Interesting Facts About Pornography That Will Blow More Than Just Your Mind,link,http://goo.gl/xjP5Hd,2016-03-22 11:15:00,1027,56,32,981,7,6,33,0,0
18478252282_10153506807127283,"Ay, she broke it down fa real. This what i be thinkin when i see these kind of pics too. What they callin em, Thirst traps? I guess that shit is real.",This Girl Breaks Down What Snapchat Photos Really Mean And It's Hilariously Perfect!,link,http://goo.gl/ghxmi4,2016-03-21 18:40:00,631,25,34,599,6,0,26,0,0
18478252282_10153506878122283,They service musta been the bullshit.,Timeline Photos,photo,https://www.facebook.com/MartinLawrence/photos/a.437044652282.236578.18478252282/10153506878122283/?type=3,2016-03-21 16:24:00,10282,347,1233,9445,48,105,677,1,6
18478252282_10153507075747283,"Columbus, ya boy is in town on Thursday & Friday! Lets get it! Tickets: http://bit.ly/DoinTimeColumbusOhio #Columbus #ohio #DoinTime","Martin Lawrence at Palace Theatre Columbus on Mar 24, 2016",link,http://bit.ly/DoinTimeColumbusOhio,2016-03-21 15:15:00,68,17,4,68,0,0,0,0,0
18478252282_10153506804127283,"I dont know what a snapchat is but if mufuckas is shittin in the woods I guess i aint missin shit, literally.",Kate Upton Officially Joined Snapchat and She's Easily the Hottest Girl On There,link,http://goo.gl/E9gZof,2016-03-21 14:38:00,683,47,13,652,5,0,26,0,0
18478252282_10153506811967283,"Shiiiiiiit, more like what it look like when you bouta die. Could yall do this shit?",Timeline Photos,photo,https://www.facebook.com/MartinLawrence/photos/a.437044652282.236578.18478252282/10153506811967283/?type=3,2016-03-21 13:43:00,14624,978,2060,13660,85,414,458,6,1
18478252282_10153507397202283,Shout out to @ludacris for showing love to the Martin show with dat mean elbow drop! Much love brotha. #DragonFlyJones #Martin,,video,https://www.facebook.com/MartinLawrence/videos/10153507397202283/,2016-03-21 11:22:59,8080,213,476,7586,119,1,374,0,0
18478252282_10153506791167283,"Yall peep mama walkin out at the end? She was bouta beat that ass. He did the only thing he could do, act like he aint know what was goin on. What would yall had done if this was your wedding?",You Have To See What Happens When His Side Chick Crashes Their Wedding!,link,http://goo.gl/v39ELs,2016-03-21 09:31:00,479,69,54,443,4,11,18,2,1
18478252282_10153500930892283,"RiRi just fuckin with us now. I just wanna see what she gone wear next, gone catch her wearin a cowboy hat an some sandals an the paparazzi still gone be snappin.",Whoa! Rihanna Bares All and Goes Topless For Her New Video,link,http://goo.gl/46MFQE,2016-03-20 20:02:00,1693,123,64,1623,23,9,37,0,1
18478252282_10153500965052283,"I aint mad at that, he just makin sho the police stay off his ass. Hood inventions.",Timeline Photos,photo,https://www.facebook.com/MartinLawrence/photos/a.437044652282.236578.18478252282/10153500965052283/?type=3,2016-03-20 16:21:00,46177,2209,16885,41817,291,66,3998,3,2
18478252282_10153500922807283,Damn this got a mufucka feelin old. Half of em dont even know what a VCR or a Beta max was. Back when Beepers was the shit.,15 Common Expressions Younger Generations Won't Understand,link,http://goo.gl/YwGC6K,2016-03-20 14:27:00,1918,73,178,1827,20,2,66,3,0
18478252282_10153500948937283,Now thats some funny shit right there. Took me a minute cause I was tryina see them tittys but they got me. How long it take yall? Dont lie either,Timeline Photos,photo,https://www.facebook.com/MartinLawrence/photos/a.437044652282.236578.18478252282/10153500948937283/?type=3,2016-03-20 11:08:00,2086,192,238,1862,7,3,191,4,19
18478252282_10153500917257283,"I been sayin this all along, its art. Need to be in the Olympics. Where my pole dancers at?",This Photographer Perfectly Captured The Beauty Of Underwater Pole Dancing,link,http://goo.gl/e3klWC,2016-03-20 09:19:00,1344,54,103,1305,11,13,15,0,0
18478252282_10153500029432283,"Ben a lucky mufucka aint he? Damn all that tho, they spent all that money on surgery and still live with they mama? Ben is fuckin winning. The mama might be tryina get down, let me read some more.",This 'Lucky Guy' Is Dating A Pair Of Surgically-Enhanced Identical Twins,link,http://goo.gl/TYV1jW,2016-03-19 22:21:00,2933,372,188,2633,17,72,201,5,5
18478252282_10153500039552283,"Damn, thats just damn. What yall think?",Timeline Photos,photo,https://www.facebook.com/MartinLawrence/photos/a.437044652282.236578.18478252282/10153500039552283/?type=3,2016-03-19 20:26:00,14826,590,3709,13066,121,42,1568,12,17
18478252282_10153500027167283,"That aint gone get him out that sentence, that voice prolly got him mo time. But I cant knock him fa trying. It was creative, gotta give him that.",You Must See This Convict Serenade Judge With Adele Inspired Apology,link,http://goo.gl/m3RA9z,2016-03-19 18:19:01,735,77,54,676,4,6,44,2,3
18478252282_10153500032972283,"Shiiiiiiit, i do this everyday i can damn the holidays. Get me a bowl of pebbles an sit my ass down.",Timeline Photos,photo,https://www.facebook.com/MartinLawrence/photos/a.437044652282.236578.18478252282/10153500032972283/?type=3,2016-03-19 15:23:00,1712,42,72,1630,13,1,68,0,0
18478252282_10153502174822283,"Columbus! Marty Mar is coming to the Palace Theatre March 24th & March 25th! Tickets: http://bit.ly/DoinTimeColumbusOhio 
#DoinTime #Columbus #ohio","Martin Lawrence at Palace Theatre Columbus on Mar 24, 2016",link,http://bit.ly/DoinTimeColumbusOhio,2016-03-19 11:21:05,106,22,9,104,2,0,0,0,0
18478252282_10153500025492283,"Ay I cant even front on em. We all been there, bustin slobs and all that. Show ya love with the one you with. Its only nasty when you see the pictures of the shit.",16 Times Celebrities Got Way Too Gross With The PDA & Made Us Uncomfortable,link,http://goo.gl/1JtN9s,2016-03-19 11:18:00,1243,93,44,1162,17,9,43,2,10
18478252282_10153495176827283,"Yall gotta look at #22, I cant explain the shit. You just gotta see it for yaself, i will say peep the expression on the black girl face, funny as fuck.",32 People Having The WORST Day… #20 Is So Awful You'll Feel Bad For Laughing.,link,http://goo.gl/pauTrp,2016-03-18 20:10:00,818,29,84,777,7,5,28,0,1
18478252282_10153495186792283,Thats when shit gone be too real. I dont think we ready fa that one. Mufuckas wouldnt have a reason to leave the house then. Wings straight out the computer? Might be on to some shit.,Timeline Photos,photo,https://www.facebook.com/MartinLawrence/photos/a.437044652282.236578.18478252282/10153495186792283/?type=3,2016-03-18 16:16:00,12826,440,3218,11921,199,7,697,1,1
18478252282_10153495171087283,"Aight, I might fall thru an see this but they better have a thick ass chocolate sista in one a them bathing suits, show how it really be on the beaches. Am I right?",Check Out The Buxom Bombshells In The New 'Baywatch' Movie,link,http://goo.gl/5VbVHH,2016-03-18 16:07:00,1128,94,20,1100,7,5,15,1,0
18478252282_10153495184012283,"Yall know who you are too, mufucka be so happy like they dont have no taxes taken out they shit, whole check just full.",Timeline Photos,photo,https://www.facebook.com/MartinLawrence/photos/a.437044652282.236578.18478252282/10153495184012283/?type=3,2016-03-18 13:14:00,17513,1313,4037,16025,125,5,1345,2,11
18478252282_10153495127977283,"Which one fucked yall up the most? A few caught me off guard. ill just say this, pretty damn obvious how some of these mufuckas ended up with a mugshot.",These 15 Bizarre Mugshots Are Totally Real,link,http://goo.gl/DPoFh4,2016-03-18 11:23:00,1926,224,588,1642,11,26,244,2,1
18478252282_10153495121752283,"See ladies, this right here is proof why guys keep tryina fuck, we just tryina help. Am I right fellas?",11 Things That Happen To You When You Don't Have Sex,link,http://goo.gl/poywpw,2016-03-17 20:13:00,1318,100,251,1233,11,7,64,1,2
18478252282_10153495116702283,"Damn that pizza shit, I say Ladies take that shit to the next level, make em pay a bill. Then you really won something, with none of the calories. Ya welcome.",Genius Girls On Tinder Have Figured Out How To Get Guys To Bring Them Pizza,link,http://goo.gl/WyKRiL,2016-03-17 16:20:00,755,66,45,698,6,1,49,1,0
18478252282_10153495183532283,"Chrissy know how to keep a man dont she yall? Shiiiiiit all she missin is the hot sauce an a brew, then she really in the game.",Timeline Photos,photo,https://www.facebook.com/MartinLawrence/photos/a.437044652282.236578.18478252282/10153495183532283/?type=3,2016-03-17 16:14:00,5711,297,500,5441,103,4,160,1,2
18478252282_10153495182147283,"Might be my favorite bikini right there. Ladies, ya boy Marty Mar endorses the hell outta this right here.",Timeline Photos,photo,https://www.facebook.com/MartinLawrence/photos/a.437044652282.236578.18478252282/10153495182147283/?type=3,2016-03-17 13:13:00,18730,672,1530,16937,142,53,1583,4,11
18478252282_10153495113642283,"I still dont get this shit yall. I aint knockin the hustle, make ya money, but I done seen better asses, and smaller thighs do more damage feel me?","Who Is The Watermelon Woman, And Why Is She One Of the Most Famous People In Brazil?",link,http://goo.gl/dJNYc2,2016-03-17 11:18:00,2045,165,77,1954,26,12,48,2,3
18478252282_10153493225262283,which of these yall play?,Pixel-ache: The 20 Worst Videogames of All Time - Everybody Look Busy,link,http://everybodylookbusy.com/2016/01/pixel-ache-the-20-worst-videogames-of-all-time/?utm_source=WH&utm_medium=CPC&utm_campaign=traffictest,2016-03-17 02:30:00,544,79,68,521,4,2,15,2,0
18478252282_10153490621407283,"The internet dont stop, they got shit fa days dont they? Lemme sit my ass down before they put me in the bullshit.",Kim K Photoshop Battle,link,http://goo.gl/QoSiUr,2016-03-16 20:27:00,381,33,20,348,7,3,20,1,2
18478252282_10153490643727283,"i know all the parents lookin at this picture sayin to they self ""NOT MINES, they aint gone be donating shit but they brains to them books.",Timeline Photos,photo,https://www.facebook.com/MartinLawrence/photos/a.437044652282.236578.18478252282/10153490643727283/?type=3,2016-03-16 18:12:00,1942,89,183,1779,8,29,124,1,1
18478252282_10153495326782283,#WhatWouldMartinDo is back every Wednesday. Download #Runtledat by Victorious to see my response to a fan's question bout being in the #friendzone.,Timeline Photos,photo,https://www.facebook.com/MartinLawrence/photos/a.437044652282.236578.18478252282/10153495326782283/?type=3,2016-03-16 17:27:39,257,33,18,254,0,0,3,0,0
18478252282_10153490496017283,"There some crazy shit happening in these photos, but my man mid tooth getting knock out wins today. What yall think? Yall still out there clubbin like this?","If You Still Think Clubbing Is Cool, These 14 Photos Will Change Your Mind",link,http://goo.gl/TYkN3m,2016-03-16 16:19:00,670,36,94,623,5,2,38,0,2
18478252282_10153495053407283,Columbus up next! #DoinTime #Columbus Tickets: http://bit.ly/DoinTimeTour Philly Tickets: http://bit.ly/DoinTimeTourPhilly,Martin Lawrence,link,http://bit.ly/DoinTimeTour,2016-03-16 14:53:35,63,14,11,63,0,0,0,0,0
18478252282_10153490650327283,Mufucka aint got a care in the world do he? He look like he cool as fuck til you make him spill that drink. I dont wanna be around after that shit pop off.,Timeline Photos,photo,https://www.facebook.com/MartinLawrence/photos/a.437044652282.236578.18478252282/10153490650327283/?type=3,2016-03-16 13:13:00,17085,496,4061,15828,195,6,1050,3,3
18478252282_10153490491957283,"Ay, i just gotta show respect for a brotha keepin the relationship strong, more of us should be doin this. He better slow down on the snacks before they be milkin HIM but other than that, Ladies what yall think?",Cowboy's Hilariously Sexy Photos Were The Perfect Gift For His Wife.,link,http://goo.gl/uHwXii,2016-03-16 11:16:00,942,94,85,846,33,5,57,1,0
18478252282_10153490351237283,"Shiiiiiiiit, she gone have to explain some shit to us then, an i better get a discount on that child support. Cause I aint payin the 5.",Did You Know Two Guys Could Knock You Up At The Same Time?,link,http://goo.gl/PF4dcb,2016-03-15 20:16:00,1798,168,233,1619,14,48,116,1,0
18478252282_10153490626737283,Quickest way for a woman to whoop yo ass sayin some shit like that. I aint gone front it did make me laugh tho.,Timeline Photos,photo,https://www.facebook.com/MartinLawrence/photos/a.437044652282.236578.18478252282/10153490626737283/?type=3,2016-03-15 18:41:00,4365,298,625,3966,10,30,356,1,2
18478252282_10153490336682283,"Sometimes its okay to just shut the fuck up, you aint gotta talk all the time, am I right yall?",16 Dumbest Celeb Quotes You Need To See To Believe,link,http://goo.gl/UPh9PR,2016-03-15 16:43:00,1808,121,104,1656,18,11,122,1,0
18478252282_10153490499312283,"Damn why they do my boy Rick Ross like that. I salute em for gettin healthy, an droppin that weight. He gone fuck around and be vegan in a minute, bouta be rapping bout lemon pepper soy wings.",Timeline Photos,photo,https://www.facebook.com/MartinLawrence/photos/a.437044652282.236578.18478252282/10153490499312283/?type=3,2016-03-15 13:22:00,16221,1317,4528,14329,137,36,1710,6,3
18478252282_10153485663132283,"Dumbasses! THIS is how they catch yall ass. Talkin bout the shit an postin it. Real Gs move in silence am I right? 
http://goo.gl/M9EDKv","The Crazy Lives Of The Children Of Drug Lords, Documented On Social Media",link,http://goo.gl/M9EDKv,2016-03-14 21:28:00,1633,99,107,1574,16,10,29,0,4
18478252282_10153485711507283,"Damn. No words, just damn.",Timeline Photos,photo,https://www.facebook.com/MartinLawrence/photos/a.437044652282.236578.18478252282/10153485711507283/?type=3,2016-03-14 20:32:00,21100,620,1686,19176,105,25,1791,1,2
18478252282_10153490560002283,Download my free app #Runtledat by Victorious. Contest for #MartinMemeMonday: whoever makes the funniest memes out of one of the pics on my app (this is 1 of the 4). Check it out! Winner gets a dope gift from ya boy!,Timeline Photos,photo,https://www.facebook.com/MartinLawrence/photos/a.437044652282.236578.18478252282/10153490560002283/?type=3,2016-03-14 16:49:46,475,39,38,453,11,1,10,0,0
