status_id,status_message,link_name,status_type,status_link,status_published,num_reactions,num_comments,num_shares,num_likes,num_loves,num_wows,num_hahas,num_sads,num_angrys
18478252282_10153602605532283,"Know her mama aint see her leavin the house in none a that. Some of them shorts a lil too tight, mess around an have a loaf of bread in her draws keep messin round.",You know damn well who loves short shorts (35 Photos),link,http://goo.gl/zpHB42,2016-05-04 16:16:00,2394,93,88,2205,56,14,118,0,1
18478252282_10153602602642283,Gotta be careful EVERYBODY got a damn camera now. I know somebody got a shot of me reachin in my nose or pullin my draws out my ass Im just waitin.,These 10 Celebrities Ruined It All In An Instant,link,http://goo.gl/iXBwsK,2016-05-04 11:44:01,1847,70,81,1598,10,32,204,2,1
18478252282_10153602599602283,Shit I cant stop watching these damn ninjas. Im just glad thats all they was cuttin with them swords. Glad aint nobody miss.,Watching Fruit Getting Sliced Mid-Air And In Slow Motion Is Oddly Satisfying,link,http://goo.gl/Noh9QW,2016-05-03 20:14:01,342,17,24,330,3,0,9,0,0
18478252282_10153602613902283,Thats love! Yall go check him out in the theaters this week! Doin his thang.,Timeline Photos,photo,https://www.facebook.com/MartinLawrence/photos/a.437044652282.236578.18478252282/10153602613902283/?type=3,2016-05-03 18:14:00,197,11,5,190,7,0,0,0,0
18478252282_10153602596352283,"I aint heard of ALOTTA this stuff, but hey, whatever floats ya boat. Which one threw yall off the most?",15 Sexual Fetishes You Definitely Have Never Heard Of Before,link,http://goo.gl/dFoPiz,2016-05-03 16:18:00,358,88,59,320,5,11,21,0,1
18478252282_10153605973977283,"Brooklyn, May 14th ya boy ol Marty Mar is at the Barclays Center! Tickets: bit.ly/DoinTimeBrooklyn #DoinTime #Brooklyn","Martin Lawrence at Barclays Center on May 14, 2016",link,http://bit.ly/DoinTimeBrooklyn,2016-05-03 15:31:48,75,6,9,73,2,0,0,0,0
18478252282_10153602612472283,"Well damn. Gettin her lil mermaid on, she definitely under the sea. Ya boy bout to take some swimming lessons yall.",Timeline Photos,photo,https://www.facebook.com/MartinLawrence/photos/a.437044652282.236578.18478252282/10153602612472283/?type=3,2016-05-03 13:12:00,2064,59,106,1928,30,13,93,0,0
18478252282_10153602594322283,Ahhhhhhhh Naaaaaa Usher. I aint wanna know you like that maaaan!! Usher been trippin since him an Chili broke up.,Usher Pulls A Kim K And Proudly Shows Off His Nude Bod On Snapchat,link,http://goo.gl/5mCz7m,2016-05-03 11:20:08,3567,278,180,3002,98,43,416,5,3
18478252282_10153601205772283,"She in her own lil world aint she. Bad part is, lil man bouta just start apologizing outta nowhere for everything, stuff he aint even do. Beyonce done broke up some happy homes with that one.","This Little Girl's Dance To Beyoncé's ""Sorry"" Proves Lemonade Is For Everyone",link,http://goo.gl/cWCcQt,2016-05-02 20:26:00,814,32,23,767,15,3,29,0,0
18478252282_10153601230062283,"Damn, gotta think people. Gotta think.. They probably are the champs in his mind though, an thats all that matters i guess.",Timeline Photos,photo,https://www.facebook.com/MartinLawrence/photos/a.437044652282.236578.18478252282/10153601230062283/?type=3,2016-05-02 18:10:00,3870,537,1631,3136,15,27,681,7,4
18478252282_10153604358157283,"I hate that shit too! Here's one of the winners from last week's #MartinMemeMonday. Get after my contests every week on my new #Runteldat app and I'll give y'all a shout out and a follow just like my girl Chontel Monaee.

Shout out to Victorious Inc.
Download for FREE here:
Apple: http://apple.co/1QAvUtK
Android: http://bit.ly/20Xv4x9",Timeline Photos,photo,https://www.facebook.com/MartinLawrence/photos/a.437044652282.236578.18478252282/10153604358157283/?type=3,2016-05-02 17:42:26,1299,53,383,1112,9,2,169,0,7
18478252282_10153601191442283,"That bad part is, that song was KNOCKIN!! Black Trump need to drop a mixtape on they ass with some dis tracks. I like that guy, Roy Wood Jr. Funny comic.",The Daily Show Proves Donald Trump Quotes Can Double As Rap Lyrics,link,http://goo.gl/U5P2DM,2016-05-02 16:16:00,762,47,108,701,16,2,43,0,0
18478252282_10153601226682283,"Diamond Encrusted? Damn, all i got was a belt encrusted in ""Get yo ass out my house or pay rent"" from my mama. What did yall get for graduation?",Timeline Photos,photo,https://www.facebook.com/MartinLawrence/photos/a.437044652282.236578.18478252282/10153601226682283/?type=3,2016-05-02 13:18:00,606,81,47,533,6,0,66,0,1
18478252282_10153601189982283,"Okay, I aint never seen nobody faint that many times. The first one i was in shock, the second one made me laugh am i wrong fa that yall? She gone get the dad back when she start datin though I already know.",Dad loses it when daughter passes out on an amusement ride (Video),link,http://goo.gl/YMZ4q7,2016-05-02 11:14:00,958,62,252,800,11,6,141,0,0
18478252282_271340336539502,,"Martin Lawrence Live! Kansas City, MO",event,https://www.facebook.com/events/271340336539502/,2016-05-02 07:25:23,1683,37,0,1634,46,2,1,0,0
18478252282_161548767576719,,"Martin Lawrence Live! St. Louis, MO",event,https://www.facebook.com/events/161548767576719/,2016-05-02 07:24:05,759,11,0,735,19,5,0,0,0
18478252282_1027023150679035,,"Martin Lawrence Live! Chicago, IL",event,https://www.facebook.com/events/1027023150679035/,2016-05-02 07:19:27,1198,42,0,1168,22,4,4,0,0
18478252282_1681565812108650,,"Martin Lawrence Live! Dallas, TX",event,https://www.facebook.com/events/1681565812108650/,2016-05-02 07:17:51,1538,48,0,1502,27,7,2,0,0
18478252282_1614352595556951,,"Martin Lawrence Live! Houston, TX",event,https://www.facebook.com/events/1614352595556951/,2016-05-02 07:13:58,2504,60,0,2459,41,0,4,0,0
18478252282_10153603361092283,"#TeamMartyMar New shows added to the #DoinTimeTour. Tickets on sale this Friday at 10am EST! Tickets: bit.ly/DoinTimeTour

5/14 Brooklyn, NY - Barclays Center
6/17 Houston, TX - NRG Arena
6/18 Dallas, TX - Verizon Theatre at Grand Prairie
6/24 Chicago, IL - The Chicago Theatre (On sale at 11am CST)
7/29 Saint Louis, MO - Chaifetz Arena
7/30 Kansas City, MO - Sprint Center",Timeline Photos,photo,https://www.facebook.com/MartinLawrence/photos/a.437044652282.236578.18478252282/10153603361092283/?type=3,2016-05-02 07:00:01,77,21,19,73,4,0,0,0,0
18478252282_10153602609387283,"Im sayin tho, if that was a black daddy, he woulda did that one time an got his ass beat",How this dad hasn't murdered his son is beyond me (Video),link,http://goo.gl/cFhkx8,2016-05-01 20:10:00,480,95,118,403,10,3,61,1,2
18478252282_10153601179992283,"I dont know whats funnier. The fact that he just stood there, the commentary of the camera guys or the fact that the girl was oblivious. This made ya boy laugh hard yall.",Swimsuit model paralyzes old man with a tractor beam of hotness (Video),link,http://goo.gl/BHVhYg,2016-05-01 20:05:01,608,54,75,530,5,0,73,0,0
18478252282_10153601184902283,"That be the look too, makin sure dont nobody get too close. He lookin like his girl bouta get in the pictures he dont want her to see.",Timeline Photos,photo,https://www.facebook.com/MartinLawrence/photos/a.437044652282.236578.18478252282/10153601184902283/?type=3,2016-05-01 18:11:00,755,29,73,669,6,1,79,0,0
18478252282_10153602347677283,Thank you Boston. It's been real! #Brooklyn see you at the Barclays Center  May 14th! Tickets: bit.ly/DoinTimeBrooklyn,,photo,https://www.facebook.com/MartinLawrence/photos/a.10152757985247283.1073741825.18478252282/10153602345757283/?type=3,2016-05-01 17:20:47,110,1,5,103,7,0,0,0,0
18478252282_10153601178007283,"They right, cause I damn sho dont remember alotta them people.
I cant believe screech was doin porn. That Ted Cruz lookin girl bouta get paid tho aint she",Random Forgotten Celebrities That Did Porn,link,http://goo.gl/lZffcM,2016-05-01 16:03:00,538,37,48,504,3,3,26,1,1
18478252282_10153595874342283,This that Ooooooo Weeeee. Somebody gone yell WorldStar and thats when it get real.,"Two girls take turns punching each other in the face, because why not (Video)",link,http://goo.gl/sn0zBj,2016-04-30 20:19:00,623,128,262,533,5,20,60,3,2
18478252282_10153595911807283,That cat bouta give him 5 across the face any minute now. An whoever took the picture aint warning him at all either.,Timeline Photos,photo,https://www.facebook.com/MartinLawrence/photos/a.437044652282.236578.18478252282/10153595911807283/?type=3,2016-04-30 18:43:00,19080,691,2187,16619,148,20,2293,0,0
18478252282_10153600142732283,"#Soundcheck  Boston ya boy is in the building! See ya soon! 

4/30/16 Boston, MA / Citi Performing Arts Center           
5/14/16 Brooklyn, NY / Barclays Center",Timeline Photos,photo,https://www.facebook.com/MartinLawrence/photos/a.437044652282.236578.18478252282/10153600142732283/?type=3,2016-04-30 16:26:32,240,31,11,222,15,2,1,0,0
18478252282_10153595872082283,Nuttin wrong with showin a little ass while you get your squat on. Ladies is doin a service to all the brothas that need that extra motivation to get they ass off the couch with the twinkles.,Proof That Booty Shorts Are The Real Reason Why We Go To The Gym,link,http://goo.gl/Ik5Vtk,2016-04-30 16:17:00,1468,65,41,1376,24,10,54,2,2
18478252282_10153595904602283,Aint nothin wrong with a lil Taco Tuesday...Thru Sunday and Monday. We all been there.,Timeline Photos,photo,https://www.facebook.com/MartinLawrence/photos/a.437044652282.236578.18478252282/10153595904602283/?type=3,2016-04-30 13:37:00,193,13,26,171,3,0,18,0,1
18478252282_10153595869487283,"Gotta start lovin yaself from the inside out, aint no surgery in the world gone fix low self esteem. Plus, Thats a lot of work just for instagram followers...",This Woman Removed All Her Teeth In Order To Be Beautiful,link,http://goo.gl/1dpI3s,2016-04-30 11:15:00,1249,204,132,1085,14,67,47,29,7
18478252282_10153595864562283,"First off, her kids need they ass beat. Second, i salute her for havin the energy at 93, i know some 20 year olds that dont be doin nothin out here. These fellas did the right thing. Respect.",2 Men Saw Their 93-Year-Old Neighbor Mowing Her Lawn. That's When They Did The Unthinkable,link,http://goo.gl/89qd9h,2016-04-29 20:12:00,10637,217,756,10032,535,50,12,6,2
18478252282_10153595884907283,All i need to know is where do I send my resume? Prolly gettin stacks JUST fa that.,Timeline Photos,photo,https://www.facebook.com/MartinLawrence/photos/a.437044652282.236578.18478252282/10153595884907283/?type=3,2016-04-29 18:28:00,11930,387,889,11106,106,16,698,3,1
18478252282_10153598249027283,#MartinFanFriday from @marcofunny82 featured on my app from last week with this dope cartoon artwork. See this week's talent on #Runteldat by Victorious. #MartinPayne #TeamMartyMar,Timeline Photos,photo,https://www.facebook.com/MartinLawrence/photos/a.437044652282.236578.18478252282/10153598249027283/?type=3,2016-04-29 17:11:09,1227,39,43,1172,17,4,34,0,0
18478252282_10153595862957283,"Forget mans best friend, that dog is the homie from now on. Wing dog.",Helpful puppy tries to take off girl's bikini (Video),link,http://goo.gl/nSrgZR,2016-04-29 16:11:00,857,32,56,767,9,11,69,1,0
18478252282_10153598079262283,"Ya boy is in Philly tonight! Boston tomorrow! See y'all soon! #DoinTime

4/29/16 Philadelphia, PA / The Liacouras Center 
4/30/16 Boston, MA / Citi Performing Arts Center 
5/14/16 Brooklyn, NY / Barclays Center",Martin Lawrence,link,http://bit.ly/DoinTimeTour,2016-04-29 15:05:12,95,14,8,89,6,0,0,0,0
18478252282_10153595877687283,"Fellas if ALL yo shit fit in one box, yo lady got the right to kick yo ass out the house. Gone head an leave, accumulate some shit an come back.",Timeline Photos,photo,https://www.facebook.com/MartinLawrence/photos/a.437044652282.236578.18478252282/10153595877687283/?type=3,2016-04-29 13:22:00,2941,111,468,2479,17,10,434,1,0
18478252282_10153595860982283,These tributes got ya boy up in his feelins a lil bit. Prince was THE MAN!!! Whats one of yall favorite Prince songs?,D'Angelo and Maya Rudolph Give a Heartfelt Prince Tribute on 'The Tonight Show',link,http://goo.gl/wABRgy,2016-04-29 11:09:00,2986,368,252,2717,152,2,3,112,0
18478252282_10153592404537283,"Wont catch Marty Mar slipping. I be lookin right an left every time i accept an award, just in case he try something. He mess around an tell me Varnel Hill had the comedy special of the year.",You Have To Watch Kanye West Interrupt Another MAJOR Speech...,link,http://goo.gl/3K3q6V,2016-04-28 20:13:00,879,115,28,753,9,3,113,1,0
18478252282_10153592414617283,Thats just wrong,Timeline Photos,photo,https://www.facebook.com/MartinLawrence/photos/a.437044652282.236578.18478252282/10153592414617283/?type=3,2016-04-28 18:03:00,50091,488,6525,45318,275,65,4359,61,13
18478252282_10153592402562283,THATS what Im talkin bout! Dont be scared ladies put these mufuckas in they place! Im just waitin for the english translation video to drop then Im gone be talkin cash shit. He aint know what to do when she caught his ass.,A Woman Caught This Man Taking Upskirt Photos on the Subway — And She's Clapping Back,link,http://goo.gl/VZTHGc,2016-04-28 16:11:00,534,34,59,490,13,22,5,2,2
18478252282_10153596039997283,Philly! A limited number of tickets have just been released for the show tomorrow at the The Liacouras Center. Get them before they are gone! Tickets: http://bit.ly/DoinTimeTourPhilly,ev9.evenue.net,link,http://bit.ly/DoinTimeTourPhilly,2016-04-28 13:57:11,56,8,3,51,5,0,0,0,0
18478252282_10153592413212283,"Im just waitin for jigga to drop the remix ""Arnold Palmer"" on they ass. Just fa the fellas, cause we aint sippin lemonade no more. That drink is outlawed now.",Timeline Photos,photo,https://www.facebook.com/MartinLawrence/photos/a.437044652282.236578.18478252282/10153592413212283/?type=3,2016-04-28 13:01:00,15134,479,2423,12932,124,14,2063,0,1
18478252282_10153592400957283,"Ay, do what makes you happy. But I will say at first glance I thought this was one of them Wayans boys doin a sequel to White Chicks. What yall think?","People Are Freaking Out Over Lil' Kim's Alleged ""Transformation""",link,http://goo.gl/m7M2k3,2016-04-28 11:19:00,2913,599,296,2203,21,65,515,100,9
18478252282_10153594769102283,Thanks to @indianageorge3 for the signed jersey. Peace and God Bless to you and yours. Continue to do your thang! 👊🏿,Timeline Photos,photo,https://www.facebook.com/MartinLawrence/photos/a.437044652282.236578.18478252282/10153594769102283/?type=3,2016-04-27 20:36:26,11154,186,150,10952,156,27,18,0,1
18478252282_10153592398397283,"Somebody fill me in, i dont know what Im lookin at no more. Is it sexy or the phone recorded em bouta get it in?",Kim Kardashian Steams Up Instagram With Racy Photos For Miami Wedding,link,http://goo.gl/U65XiM,2016-04-27 18:17:00,1845,603,60,1624,24,17,110,9,61
18478252282_10153594581222283,When she tryin to creep with her man's homie. Go to my free app #Runteldat by Victorious to check out the advice I give to his dude. #TeamMartyMar #WhatWouldMartinDoWednesdays #WWMDW,,video,https://www.facebook.com/MartinLawrence/videos/10153594581222283/,2016-04-27 18:16:17,1045,56,62,982,18,2,42,1,0
18478252282_10153592388022283,"That boy cleaner than grannys dishes before sunday service aint he. I thought he was a Detroit playa yall know they known fa dressin, but okay B-More I see you. Steppin clean.",This Guy Has Suits In Colors You Never Knew Existed… And OMG At His Shoes.,link,http://goo.gl/rhZWTq,2016-04-27 16:12:00,3176,152,418,3009,69,15,83,0,0
18478252282_10153594332082283,"Boston see ya this weekend! April 30th ya boy is coming to Citi Performing Arts Center! Tickets: http://bit.ly/DoinTimeTour #DoinTime

4/29/16 Philadelphia, PA / Liacouras Center 
4/30/16 Boston, MA / Citi Performing Arts Center 
5/14/16 Brooklyn, NY / Barclays Center",Martin Lawrence,link,http://bit.ly/DoinTimeTour,2016-04-27 15:13:31,47,7,10,44,3,0,0,0,0
18478252282_10153592405657283,That feelin be better than sex sometimes dont it. You be wantin to ride pass an just look at they ass.,Timeline Photos,photo,https://www.facebook.com/MartinLawrence/photos/a.437044652282.236578.18478252282/10153592405657283/?type=3,2016-04-27 13:14:00,8231,187,1231,7348,74,5,802,1,1
18478252282_10153592383642283,"I been sayin its piss for years, some people say its not. What yall think? Educate ya boy.",Porn Stars Debate If Female Squirt Is Pee. What Do You Think?,link,http://goo.gl/vKOTO6,2016-04-27 11:19:00,1883,853,246,1621,15,41,201,2,3
18478252282_10153588390882283,"Hate em all you want, they aint goin nowhere. An Kris the mastermind, she prolly make another show about the Hate. ""Hatin on the Kardashians"" an make another few mill. Respect",These Celebrities Have One Thing In Common: They All Really Hate The Kardashians,link,http://goo.gl/a6oeDC,2016-04-26 20:18:00,1434,250,53,1280,34,2,107,2,9
18478252282_10153588409472283,"She done outlived all them Golden Girls didnt she? Whew, she must got some dirt on Jesus cause she aint goin nowhere.",Timeline Photos,photo,https://www.facebook.com/MartinLawrence/photos/a.437044652282.236578.18478252282/10153588409472283/?type=3,2016-04-26 18:26:00,39392,784,6490,34744,1167,64,3410,4,3
18478252282_10153588385897283,"Got nothin but love for her. She get better with time, and she know it. Ye pissed her off an the whole internet knew his business. Yall see Whiz aint said Shit else wrong after that.",The Many Changes Of Amber Rose,link,http://goo.gl/dFgrPt,2016-04-26 16:16:00,1991,94,53,1879,35,3,74,0,0
18478252282_10153592624162283,Go to my app #Runteldat by Victorious and take today's poll for #TriviaTuesdays #TeamMartyMar,Timeline Photos,photo,https://www.facebook.com/MartinLawrence/photos/a.437044652282.236578.18478252282/10153592624162283/?type=3,2016-04-26 16:01:27,125,54,30,117,3,1,4,0,0
18478252282_10153592588142283,"Boston! This Saturday, April 30th ya boy is coming to Citi Performing Arts Center! Tickets: http://bit.ly/DoinTimeTour #DoinTime

4/29/16 Philadelphia, PA / Liacouras Center 
4/30/16 Boston, MA / Citi Performing Arts Center 
5/14/16 Brooklyn, NY / Barclays Center",Martin Lawrence,link,http://bit.ly/DoinTimeTour,2016-04-26 15:30:12,50,10,5,50,0,0,0,0,0
18478252282_10153588393552283,"They talmbout switchin the $20 in 2030 at the earliest, but cash bouta be outta circulation in like 5yrs. They aint slick. But i am gone be makin it rain with the Harriets",Timeline Photos,photo,https://www.facebook.com/MartinLawrence/photos/a.437044652282.236578.18478252282/10153588393552283/?type=3,2016-04-26 13:19:00,276,27,58,252,4,0,20,0,0
18478252282_10153588381342283,Know yo ass need to hang up the phone when you cant cross the street an talk at the same time. Gotta pay attention people.,Unbelievable Near Death Encounters Captured on Camera,link,http://goo.gl/5MDSgm,2016-04-26 11:15:00,379,16,52,340,1,27,11,0,0
18478252282_10153588371962283,"Awww Shit, What Jay done did now? We bouta go thru the last album lookin fa clues.",Beyoncé Just Did It Again – Here's How to Listen to Her New Surprise Album,link,http://goo.gl/YJK6s4,2016-04-25 20:12:00,2735,127,152,2420,65,6,242,1,1
18478252282_10153588402677283,Why they do her like that tho? Its some people smaller than her that cant move that fast. I just wanna know what she was really runnin to.,Timeline Photos,photo,https://www.facebook.com/MartinLawrence/photos/a.437044652282.236578.18478252282/10153588402677283/?type=3,2016-04-25 18:22:00,3124,259,574,2738,18,5,363,0,0
18478252282_10153551260907283,"He got that last laugh tho didnt he? Karmas a bitch, a patient one too.",Road rage is a lightning rod for bad karma (Video),link,http://goo.gl/zxCf6x,2016-04-25 17:19:00,609,25,74,539,5,0,65,0,0
18478252282_10153590835127283,"Boston! This weekend ya boy is coming to Citi Performing Arts Center Saturday April 30th! Tickets: http://bit.ly/DoinTimeTour #DoinTime

4/29/16 Philadelphia, PA / Liacouras Center 
4/30/16 Boston, MA / Citi Performing Arts Center 
5/14/16 Brooklyn, NY / Barclays Center",Martin Lawrence,link,http://bit.ly/DoinTimeTour,2016-04-25 15:29:36,59,7,5,56,2,0,1,0,0
18478252282_10153588403757283,"Pooh done got gangsta on em, Timothy Robbin must be trippin",Timeline Photos,photo,https://www.facebook.com/MartinLawrence/photos/a.437044652282.236578.18478252282/10153588403757283/?type=3,2016-04-25 13:23:00,361,20,74,331,1,1,28,0,0
18478252282_10153588364012283,"All i wanna know is what happened next? Somebody send me the followup. Ladies be real, what would yall had done if this was you? Or what did you do if this shit happened to you before?",Girl loses her shit when she catches her BF flirting (Video),link,http://goo.gl/kyun3p,2016-04-25 12:09:31,463,84,77,428,6,5,23,1,0
18478252282_10153584855362283,"Smart girl. Ay, all i can say is you can be petty, just save ya money. Cause people got long memories from when you tried to play em in the past, am i right yall?",Timeline Photos,photo,https://www.facebook.com/MartinLawrence/photos/a.437044652282.236578.18478252282/10153584855362283/?type=3,2016-04-24 20:20:00,1808,89,182,1687,43,6,72,0,0
18478252282_10153584848292283,Aint gone be another one like him EVER! He blessed us with over 30 years of greatness. God Bless. One Love,This Is the Most Heartbreaking Prince Tribute You'll See All Day,link,http://goo.gl/z0A8A3,2016-04-24 20:15:00,5250,68,276,4811,209,2,3,223,2
18478252282_10153584842057283,"Yall know RiRi gone do RiRi i dont know why yall surprised. She said she a bad girl, what you expect?",Rihanna's NSFW 'Needed Me' Video Looks Just Like A 'Spring Breakers' Sequel,link,http://goo.gl/28m0TD,2016-04-24 16:10:00,1081,50,62,1033,32,2,13,0,1
18478252282_10153584853417283,"His boys aint do NOTHIN THO!!? Cmon man, they showin you they aint got no love or loyalty, cant keep em around. Well at least the white girl makin friends.",Timeline Photos,photo,https://www.facebook.com/MartinLawrence/photos/a.437044652282.236578.18478252282/10153584853417283/?type=3,2016-04-24 13:19:00,17978,584,2171,15701,90,84,2086,14,3
18478252282_10153584828172283,Bossy ass Lemur aint he. When is enough enough? What would yall do? Keep in mind he got them claws on em.,This Lemur hilariously demands back scratches,link,http://goo.gl/4OdTAs,2016-04-23 20:01:00,1404,91,311,1234,41,4,124,1,0
18478252282_10153584852957283,Lemons into some lemonade right there. Next time just dont tattoo a mufuckas name on you. You askin fa them to piss you off.,Timeline Photos,photo,https://www.facebook.com/MartinLawrence/photos/a.437044652282.236578.18478252282/10153584852957283/?type=3,2016-04-23 18:18:00,568,20,87,512,4,3,49,0,0
18478252282_10153584822667283,"She got them priorities. Pizza be makin you glad you single, see what that hot N ready talmbout",You Will Never Love Anything More Than This Sassy Single Lady Loves Pizza,link,http://goo.gl/6JHxbJ,2016-04-23 16:18:00,886,34,38,805,15,0,66,0,0
18478252282_10153584850497283,"They need to start pullin out, plain an simple.",Timeline Photos,photo,https://www.facebook.com/MartinLawrence/photos/a.437044652282.236578.18478252282/10153584850497283/?type=3,2016-04-23 13:18:00,19474,1180,4446,15922,111,91,3347,2,1
18478252282_10153584812177283,"Prince was one of the greatest. At EVERYTHING!!! Definitely made more than just an impact on this world, he changed the game. Cant come fa Prince, just like he said youd be playin yaself. One Love.",Prince Will Be Missed — And So Will His Masterful Shade,link,http://goo.gl/sFAizr,2016-04-23 11:16:00,10683,130,534,9831,480,5,24,342,1
18478252282_10153581354047283,Aight this had ya boy laughin fa real. Look like some stuff i would say. These kids be havin jokes.,HIs College Son Texts Him Late At Night. Dad's Response? I Can't Stop Laughing!,link,http://goo.gl/tc5kKw,2016-04-22 20:18:00,2508,46,475,2094,64,1,348,0,1
18478252282_10153581370167283,"Thats somebody wife yall. I know her husband over there embarrassed as hell. Couldnt be with her, id be scared for the mailman to drop by when i aint home, might be tryina drop off a different package.",Timeline Photos,photo,https://www.facebook.com/MartinLawrence/photos/a.437044652282.236578.18478252282/10153581370167283/?type=3,2016-04-22 18:04:00,19745,777,2801,16173,77,143,3344,4,4
18478252282_10153581352017283,He get paid to kick it with half neckid girls on the regular? I might be in the wrong field then. Who i need to send my resume to?,Social Media Star Dan Bilzerian Is Proof You Should Never Skip Leg Day,link,http://goo.gl/W4FVKv,2016-04-22 16:17:00,3823,233,142,3573,56,14,175,1,4
18478252282_10153581367372283,Damn Arlie's out here keepin it 100 aint they. They must be givin them tough love yoga classes.,Timeline Photos,photo,https://www.facebook.com/MartinLawrence/photos/a.437044652282.236578.18478252282/10153581367372283/?type=3,2016-04-22 13:17:00,12209,182,2114,10817,79,23,1289,0,1
18478252282_10153584850732283,"Raleigh, NC!  Limited great seats just opened up for tonight 4/22 at PNC Arena. Get them before they are gone! Tickets: http://bit.ly/DoinTimeTour #DoinTime",Martin Lawrence,link,http://bit.ly/DoinTimeTour,2016-04-22 13:06:13,92,17,16,87,4,0,1,0,0
18478252282_10153581350042283,"I know 1 way, pay some damn bills. What yall think ladies? Any of these worked on yall before?",10 Ways to Get Your Girl Off Without Touching Her,link,http://goo.gl/jgkCpz,2016-04-22 11:15:00,2513,127,183,2310,56,10,137,0,0
18478252282_10153581296452283,They need to gone head an leave Kim alone. Ronda betta watch it before Kanye interrupt one of her fights to verbally defend his lady.,Ronda Rousey Threatens To Beat The Life Out Of Kim Kardashian & We Don't Blame Her One Bit,link,http://goo.gl/Hn37gB,2016-04-21 20:01:00,7177,785,775,6008,163,38,951,3,14
