status_id,status_message,link_name,status_type,status_link,status_published,num_reactions,num_comments,num_shares,num_likes,num_loves,num_wows,num_hahas,num_sads,num_angrys
18478252282_10153651305687283,"Dont hold nothin back from me, I wanna know it all. Especially how i am in that bedroom, you gotta tell me if im puttin it down like i think i be puttin it down.",15 Things Your Partner Is Hiding From You,link,http://goo.gl/ffePTK,2016-05-29 20:01:00,974,59,75,900,11,3,59,1,0
18478252282_10153655272662283,Ya boy ol Marty Mar is back on the stage Doin' Time in June! Tickets available now! bit.ly/DoinTimeTour,Martin Lawrence,link,http://bit.ly/DoinTimeTour,2016-05-29 18:13:12,80,14,17,78,2,0,0,0,0
18478252282_10153651296877283,"I'm with yall on alotta this, especially with the dressing rooms but I cant fold them damn shirts like ya'll had em, I'm sorry. Where my Retail workers at? This true? What do ya'll hate?",Things You Do That Make Retail Workers Really Hate You,link,http://goo.gl/a6lB68,2016-05-29 18:11:00,415,48,39,391,0,0,22,1,1
18478252282_10153648198472283,That boy got a brow on him dont he yall? He did his thang in Barbershop make sure ya'll check that out if you havent already. Cube! What up!,Timeline Photos,photo,https://www.facebook.com/MartinLawrence/photos/a.437044652282.236578.18478252282/10153648198472283/?type=3,2016-05-29 16:21:00,8057,606,1994,6440,41,10,1562,3,1
18478252282_10153648161762283,"They bouta make bank! Eat one of these right after you hit the club aint gone be no drunk dialing the ex, we still gone text but be damned if we call too.",South Korea Invents Ice Cream They Say Cures Hangovers,link,http://goo.gl/YK0IWu,2016-05-29 13:38:00,222,24,28,208,4,1,9,0,0
18478252282_10153648197362283,"Me every time, i dont care how far i am from the crib either, we goin back to get mine. Pastor can be in the middle of a sermon, sorry pastor, i be right back.",Timeline Photos,photo,https://www.facebook.com/MartinLawrence/photos/a.437044652282.236578.18478252282/10153648197362283/?type=3,2016-05-29 11:20:00,12360,294,1777,10850,82,17,1408,2,1
18478252282_10153648186147283,They use to be all over this man! You couldn't tell my sisters he wasn't they man. Where my 80s babies at?,16 Experiences Every 1980s Girl Can Relate To,link,http://goo.gl/Obt0Ph,2016-05-28 19:45:00,830,64,29,785,26,2,17,0,0
18478252282_10153648193132283,I'm gone go with homie on the right. Ya'll agree?,Timeline Photos,photo,https://www.facebook.com/MartinLawrence/photos/a.437044652282.236578.18478252282/10153648193132283/?type=3,2016-05-28 18:14:00,33799,1714,8303,27156,253,61,6316,5,7
18478252282_10153653318972283,Ya boy ol Marty Mar is back on the stage in June! Tickets on sale now! #DoinTime,Martin Lawrence,link,http://bit.ly/DoinTimeTour,2016-05-28 16:56:46,65,10,5,63,2,0,0,0,0
18478252282_10153648181607283,Got his ass Red Handed!!! Glad the camera was on too!!,"They're Standing In An Elevator. Suddenly, The Hidden Camera Catches Him Doing THIS... Busted!",link,http://goo.gl/D72EE2,2016-05-28 16:08:00,3212,122,548,2740,96,13,357,1,4
18478252282_10153648177297283,"Mad respect for lil homie. That's big right there. He aint slick though, cause I know the girls was all on em after this. His summer bouta be on an Crackin.",Friends Are Shocked When He Takes His Mom To Prom. Then They Learn The Unbelievable Reason Why,link,http://goo.gl/Yb7yjy,2016-05-28 14:23:00,2878,71,217,2662,155,8,49,3,1
18478252282_10153653014217283,"I got y'all this weekend, for $50 in free rides",Timeline Photos,photo,https://www.facebook.com/MartinLawrence/photos/a.437044652282.236578.18478252282/10153653014217283/?type=3,2016-05-28 13:37:45,432,62,34,413,10,2,7,0,0
18478252282_10153648192502283,"Took ya boy a minute, i cant front.",Timeline Photos,photo,https://www.facebook.com/MartinLawrence/photos/a.437044652282.236578.18478252282/10153648192502283/?type=3,2016-05-28 12:45:00,25198,528,4980,22294,188,910,1800,2,3
18478252282_10153648174292283,"I'm a dog lover. I'm mad they aint get a pic of ya boy Marty Mar up in there, I'm probably in the next article.",Can You Make It Through These Big Men/Tiny Dog Pics Without Wetting Yourself?,link,http://goo.gl/TnZ5E4,2016-05-28 11:08:00,239,27,5,228,3,1,7,0,0
18478252282_10153644511442283,This be me everytime. What does USB even short for? Who know?,Timeline Photos,photo,https://www.facebook.com/MartinLawrence/photos/a.437044652282.236578.18478252282/10153644511442283/?type=3,2016-05-27 20:05:00,7263,211,495,6534,29,4,693,0,3
18478252282_10153648169432283,"#6, the ONLY person on the plane with they readin light on when everybody trying to sleep. Hate that shit, be wantin to get up an turn it off, an look em in the eye when i do it too.",The 5 Types Of Jerks You Meet In The Airport Security Line,link,http://goo.gl/Bo9MmL,2016-05-27 18:47:00,424,31,16,391,7,4,22,0,0
18478252282_10153651580892283,"Martin Lawrence is back on the stage Doin' Time June 17th in Houston, TX! More info here. #DoinTime",Martin Lawrence,link,http://bit.ly/DoinTimeTour,2016-05-27 17:20:35,79,17,7,72,5,1,1,0,0
18478252282_10153648166327283,"Well damn, glad i know now. Aint bouta catch ya boy slippin no more. They forgot about the nasty mufuckas that don't be washin they hands an grabbin the door handle.",Why You Might Want To Think Twice About Using A Public Bathroom,link,http://goo.gl/M1K2FZ,2016-05-27 16:43:00,264,28,29,248,4,2,9,1,0
18478252282_10153651256512283,You know you mad when you write a note about some shit. #14 liable to get they ass whooped if that had been my car.,"Hilarious ""You Suck at Parking!"" Notes You'll Want to Use",link,http://goo.gl/LjCJhm,2016-05-27 14:38:00,613,34,60,536,1,8,68,0,0
18478252282_10153644513102283,For all my dog people. This be how my babies be lookin at me when it's that time.,Timeline Photos,photo,https://www.facebook.com/MartinLawrence/photos/a.437044652282.236578.18478252282/10153644513102283/?type=3,2016-05-27 12:14:00,1186,64,488,1008,11,0,166,1,0
18478252282_10153644518902283,"Glad they explained it, cause I always wanted to know. Remember in school, you knew who was shittin cause you knew they shoes?",Ever WONDERED Why TOILET Stall Doors Aren't Fully ENCLOSED?!,link,http://goo.gl/XwoLtW,2016-05-27 10:14:00,1146,93,102,994,11,6,134,0,1
18478252282_10153644489232283,"You KNOW you fuckin a lot when you start makin ""how to"" videos, cant hate the playa.",This Guy Touches His Girlfriend's Bra And What He Does Next Is A Dream Of Every Boyfriend!,link,http://goo.gl/48N6Vm,2016-05-26 19:40:00,1015,74,67,929,21,3,61,1,0
18478252282_10153644522927283,"oooooooh weeeeee! #5 must be painful, some of these dont seem bad at all though.",These 9 Sex Disorders Prove That Our Genitalia Have Some Serous Authority,link,http://goo.gl/x7bCuv,2016-05-26 17:45:00,344,28,19,326,5,4,9,0,0
18478252282_10153644498297283,Waitin on Friday like...,Timeline Photos,photo,https://www.facebook.com/MartinLawrence/photos/a.437044652282.236578.18478252282/10153644498297283/?type=3,2016-05-26 16:28:00,424,19,77,383,5,2,32,2,0
18478252282_10153649627942283,Missouri! Marty Mar is coming July 29th to Chaifetz Arena in St. Louis & July 30th to Sprint Center in Kansas City! Tickets on sale now!,Martin Lawrence,link,http://bit.ly/DoinTimeTour,2016-05-26 15:02:29,45,11,2,45,0,0,0,0,0
18478252282_10153644482092283,"This just telling me 10 hotels not to visit. White people be killin me with this haunted shit. Black folks don't do ghosts, soon as we hear a funny sound we already packed up an in the car.",Be Ready To Be Creeped Out At These 10 Haunted American Hotels,link,http://goo.gl/w2ls45,2016-05-26 14:12:00,712,73,41,627,3,6,76,0,0
18478252282_10153648156392283,Hell Naw!! Can't blame the man for trying though. This is why some people should have supervision before they allowed to post some shit.,The Most Ridiculous Craigslist Ads of All Time,link,http://goo.gl/5UXqnr,2016-05-26 12:32:00,223,32,11,199,0,5,16,1,2
18478252282_10153648142617283,"These them breakup cakes, who the fuck want ice cream after readin this?",Passive Aggressive Cakes That Have Had It with You,link,http://goo.gl/FOKHqR,2016-05-26 10:45:00,1281,80,151,980,13,11,275,1,1
18478252282_10153648556352283,#WWMDW what would Martin do...today's episode is a good guy tryin to be a #badboy #Runteldat #mudholeindatass go to the app and check out the entire clip #teammartymar,,video,https://www.facebook.com/MartinLawrence/videos/10153648556352283/,2016-05-26 00:05:17,226,29,11,214,8,1,3,0,0
18478252282_10153648135952283,"Gotta be careful with them tatts, just make sure if you gone tattoo somebody name on yo ass, they gotta fixable names, you can change alex to A Lexus, can't change Quankisha.",Breakup Tattoo Wins,link,http://goo.gl/X6VOVT,2016-05-25 20:01:00,1487,71,70,1304,8,7,167,1,0
18478252282_10153644472257283,"Ay, thats just raw talent, cant hate on that. Doin one of these is impressive but 30? Shit, gotta show love.",Watch ONE Guy Sing 'Hello' As THIRTY Different Cartoon Characters…,link,http://goo.gl/eXww8b,2016-05-25 18:47:00,1148,73,437,1063,48,11,26,0,0
18478252282_10153644467252283,"They always get me with this shit, i dont know why i be fallin for it. Be honest, who got it right on the first try?",How Many Horses Can You See In This Painting… It's Harder Than It Looks!,link,http://goo.gl/A9FNsl,2016-05-25 16:28:00,503,203,62,486,6,10,1,0,0
18478252282_10153644410502283,"Some of this shit is just too much. I aint the one, you do some of this around me and thats yo ass, no other solution. Am i right?",Horribly OFFENSIVE Airplane Passengers Who Got ARRESTED,link,http://goo.gl/DEOKPs,2016-05-25 14:44:00,852,73,81,718,16,33,73,2,10
18478252282_10153644436207283,"Daaaaaaaaamn them Sharks rolled up like they had beef. ""You was talkin all that shit earlier, got my boys with me now"".",70 Tiger Sharks Obliterate A Whale As Tourists In Small Boats Watch From Just Above [VIDEO],link,http://goo.gl/CAqVzh,2016-05-25 12:27:00,1360,86,174,1221,12,44,75,8,0
18478252282_10153644506082283,"This for all them ""New"" parents out there thinkin they bouta get some rest, probably been up since 4am today already.",Timeline Photos,photo,https://www.facebook.com/MartinLawrence/photos/a.437044652282.236578.18478252282/10153644506082283/?type=3,2016-05-25 10:15:00,15838,1081,6106,13643,194,15,1971,13,2
18478252282_10153644503492283,"I miss my man Kermit, these pictures use to have me hollerin! Marty Mar always got love for em",Timeline Photos,photo,https://www.facebook.com/MartinLawrence/photos/a.437044652282.236578.18478252282/10153644503492283/?type=3,2016-05-24 20:28:00,4146,39,584,3574,43,4,525,0,0
18478252282_10153646267572283,"What can I say, I been tryina tell y'all winter was comin for years. Marty Mar was the original Jon Snow.",Leaked Game of Thrones Promo - New Character Revealed!,video,https://www.youtube.com/watch?v=kMI_HBO5FOM&feature=share,2016-05-24 19:31:04,2214,197,454,1787,43,4,379,0,1
18478252282_10153646011152283,"Texas! Ya boy Martin Lawrence is coming June 17th to NRG Park Arena & June 18th to Verizon Theatre at Grand Prairie! #DoinTime
#Houston Tickets: bit.ly/DoinTimeHouston 
#Dallas Tickets: bit.ly/DoinTimeDallas",Martin Lawrence,link,http://bit.ly/DoinTimeTour,2016-05-24 19:14:00,47,13,3,46,1,0,0,0,0
18478252282_10153644415407283,"Some of this cant even be put on the kids, some of they parents need they ass whooped for lettin em go out like that. Got the baby Lookin like the Compton Statue of Liberty.",28 Real-Life Prom Dress Fails That Will Make You CRINGE.,link,http://goo.gl/Zr12IN,2016-05-24 16:45:00,897,68,106,717,5,41,131,2,1
18478252282_10153646068607283,Just posted a new poll on my app #Runteldat! Go to the app and make your pick #TeamMartyMar #sneakerheads #jordans,Timeline Photos,photo,https://www.facebook.com/MartinLawrence/photos/a.437044652282.236578.18478252282/10153646068607283/?type=3,2016-05-24 16:43:18,128,32,5,121,7,0,0,0,0
18478252282_10153644441982283,"This for my Star Wars fans. Gotta love her, that mask scared the shit outta me at first tho.",This Ecstatic Mom Lost All Her Chill Over A Talking Chewbacca Mask,link,http://goo.gl/eHAnzf,2016-05-24 14:12:00,1645,90,77,1463,44,4,132,0,2
18478252282_10153644500447283,"If you aint dated them, you ARE them. Tag a yeller.",Timeline Photos,photo,https://www.facebook.com/MartinLawrence/photos/a.437044652282.236578.18478252282/10153644500447283/?type=3,2016-05-24 12:30:00,3262,222,2137,2763,36,4,457,0,2
18478252282_10153644403512283,"Anytime I see a white guy with a afro i gotta see whats goin on. I agree with a few of these but ladies educate the fellas, which one is the realest?","10 Things She Wants You To Know, That She Might Not Tell You",link,http://goo.gl/J4Rxc2,2016-05-24 10:33:00,227,22,12,222,1,0,4,0,0
18478252282_10153638819082283,Numbers don't lie ladies. Lemme stop before they start doin the shit to us an flippin it. Yall know we'd be outside in some flip flops an a cowboy hat on in the rain playin some Jodeci crying.,Timeline Photos,photo,https://www.facebook.com/MartinLawrence/photos/a.437044652282.236578.18478252282/10153638819082283/?type=3,2016-05-23 20:38:00,14891,963,2917,11980,59,209,2557,14,72
18478252282_10153644414342283,#Runteldat app for #MartinMemeMonday go to the app and caption this meme! This is what one of the fans came up with,Timeline Photos,photo,https://www.facebook.com/MartinLawrence/photos/a.437044652282.236578.18478252282/10153644414342283/?type=3,2016-05-23 20:02:29,9359,328,1869,8064,66,15,1118,9,87
18478252282_10153638830322283,Fellas ya'll gotta stop with the dick pics man. I got a in person situation i aint tryina have big Marty Mar all up in the cloud an shit. Mess around an it don't come down.,"Scientist Explains Why D*ck Pics Happen, And It Won't Surprise You",link,http://goo.gl/wd61K9,2016-05-23 18:05:00,296,68,12,262,0,2,29,3,0
18478252282_10153638838202283,Lotta ladies be doing #16 too much. Which one ya'll be seeing women do the most? Keep it real too!,AWKWARD Things Girls Do Which They REFUSE To Accept,link,http://goo.gl/ZkYoli,2016-05-23 16:04:00,446,30,32,402,5,6,32,0,1
18478252282_10153643998597283,"Texas! Ya boy Marty Mar is coming June 17th to NRG Park Arena & June 18th to Verizon Theatre at Grand Prairie! #DoinTime
#Houston Tickets: bit.ly/DoinTimeHouston 
#Dallas Tickets: bit.ly/DoinTimeDallas",Martin Lawrence,link,http://bit.ly/DoinTimeTour,2016-05-23 14:36:15,56,14,11,52,4,0,0,0,0
18478252282_10153638817577283,I like to have my window down an stare at em when they roll up so they know I peeped game.,Timeline Photos,photo,https://www.facebook.com/MartinLawrence/photos/a.437044652282.236578.18478252282/10153638817577283/?type=3,2016-05-23 14:36:00,19510,431,4610,17240,196,6,2065,2,1
18478252282_10153638835552283,"Billions? Shiiiiiiiit, I might have to holla at Barack real quick, get him to make some changes before November. Cause ya'll know I'm tryin to get to the yams!!",Study Shows That States Are Losing Out On Billions By Not Legalizing Weed,link,http://goo.gl/39f8UQ,2016-05-23 11:47:00,3778,196,562,3489,71,22,187,5,4
18478252282_10153638842727283,I rebuke thee in the name of Ratchet an Bad decisions! Stay back Satan. Mama Payne Voice.,Timeline Photos,photo,https://www.facebook.com/MartinLawrence/photos/a.437044652282.236578.18478252282/10153638842727283/?type=3,2016-05-23 10:28:00,25962,803,5919,22179,459,18,3301,3,2
18478252282_10153638814352283,"Thats creativity right there! Makin it happen out here with the arts an crafts, saved a grip of bread doin it that way. I wanna see her hustle the Walmart deal outta this.",Teen Recreated Beyonce's Gown For Prom With Walmart Supplies & It's Amazing,link,http://goo.gl/RVHJHS,2016-05-22 18:29:00,6271,210,293,5958,197,37,73,3,3
18478252282_10153638816847283,Lurkin asses!! Hi Hater! Keep killin em with success an make em watch.,Timeline Photos,photo,https://www.facebook.com/MartinLawrence/photos/a.437044652282.236578.18478252282/10153638816847283/?type=3,2016-05-22 16:15:00,24585,863,10757,20028,448,37,4062,7,3
18478252282_10153638811037283,Sometimes you need to keep yo ass in the house. Club shit get old after a while. Girl with the fist in her mouth tryina drop some hints.,"If You Still Think Clubbing Is Cool, These 14 Photos Will Change Your Mind",link,http://goo.gl/wIF8uf,2016-05-22 14:25:00,1821,106,347,1632,10,20,157,1,1
18478252282_10153641940827283,"Texas! Ya boy ol Marty Mar is heading your way soon! #DoinTime
#Houston Tickets: bit.ly/DoinTimeHouston 
#Dallas Tickets: bit.ly/DoinTimeDallas",Martin Lawrence,link,http://bit.ly/DoinTimeTour,2016-05-22 13:43:09,81,18,4,79,2,0,0,0,0
18478252282_10153638815912283,"Everybody got that auntie. Why they do my man Snoop like this tho! Can't front, this some funny shit. If you aint scared tag a auntie.",Timeline Photos,photo,https://www.facebook.com/MartinLawrence/photos/a.437044652282.236578.18478252282/10153638815912283/?type=3,2016-05-22 12:04:00,5622,255,2217,4316,49,15,1241,1,0
18478252282_10153638801392283,Ay I'm curious to what ya'll think on this one. How you feel when celebs don't sign autographs? I'm gone always show love when people show ya boy love.,11 Celebrities Who Refuse To Sign Autographs,link,http://goo.gl/mmhrbu,2016-05-22 10:45:00,1235,318,77,1171,20,22,9,6,7
18478252282_10153635859102283,"He think he slick, he brought his pussy with him....I couldnt resist yall, i had to.",A Teen Couldn't Find a Date For Prom So He Took The Family Cat Instead,link,http://goo.gl/WtQX50,2016-05-21 19:05:00,4970,275,414,4100,156,32,677,4,1
18478252282_10153635850682283,Happens to the best of us. I'm just glad Kanye had draws on and aint pull a Lenny Kravitz with the leather pants and the fallin out part. Pause by the way.,WORST Celebrity Wardrobe Malfunctions That Went Viral!,link,http://goo.gl/d4cq76,2016-05-21 17:34:00,553,45,22,505,4,3,41,0,0
18478252282_10153635878427283,"I hate seein this. Ladies help each other out, dont let a stranger do too much in the club. Please. Each one teach one, lookin like Ronald McDonald daughter an i'm not lovin it.",Timeline Photos,photo,https://www.facebook.com/MartinLawrence/photos/a.437044652282.236578.18478252282/10153635878427283/?type=3,2016-05-21 15:02:00,9260,463,1888,6983,50,85,2135,3,4
18478252282_10153635843947283,"Ay, now this some shit you can't unsee. You know if the ride only cost $3 you gone see some crazy shit. Public means anybody with $3 can get on.",The 25 Most WTF Things EVER Seen On Public Transit.,link,http://goo.gl/zJswkg,2016-05-21 13:34:00,173,28,22,157,2,1,13,0,0
18478252282_10153635876402283,"Maury done called my bluff, we been sayin we was goin all week. Gone head, aint nobody in there right now no way, get ya private workout on. Im right behind yall.",Timeline Photos,photo,https://www.facebook.com/MartinLawrence/photos/a.437044652282.236578.18478252282/10153635876402283/?type=3,2016-05-21 11:45:00,3768,98,555,3157,16,10,584,0,1
18478252282_10153635832612283,Oh Costco done messed up lettin this get out. Cause ya boy buys in bulk. I'm bouta be all up in this thang. Where my smart shoppers at?,8 Under-the-Radar Costco Perks You're Probably Missing Out On,link,http://goo.gl/gHOrjm,2016-05-20 18:45:00,1476,139,625,1412,23,13,28,0,0
18478252282_10153635871522283,"This bouta be all my weed heads faces after 5 today, get you some cranberry juice sunday morning though just in case they try an 'randomly' test yo ass come Monday morning. 100% too dont get the juice cocktail. I'm tryina help.",Timeline Photos,photo,https://www.facebook.com/MartinLawrence/photos/a.437044652282.236578.18478252282/10153635871522283/?type=3,2016-05-20 17:28:00,671,51,231,599,15,2,55,0,0
18478252282_10153635829282283,One of them secrets better be that somebody knew the end was comin and ain't say shit cause they was tired of workin there anyway.,11 Secrets of Former Blockbuster Employees,link,http://goo.gl/TwhJTx,2016-05-20 15:14:00,910,95,227,853,11,4,41,1,0
18478252282_10153637703602283,"Texas! Ol Marty Mar is coming your way soon! #DoinTime
#Houston Tickets: bit.ly/DoinTimeHouston 
#Dallas Tickets: bit.ly/DoinTimeDallas",Martin Lawrence,link,http://bit.ly/DoinTimeTour,2016-05-20 14:30:01,60,3,12,59,1,0,0,0,0
18478252282_10153635824417283,"Well damn, I aint gone front, some of this shit need to be banned everywhere though. The hell you doin with a mullet in 2016?","10 Things Banned in Other Countries, but Legal in the U.S.",link,http://goo.gl/1ZGZ9v,2016-05-20 12:34:00,508,37,57,460,2,6,38,1,1
18478252282_10153635867542283,Lookin at the clock tryina decide if you gone take a long bathroom break THEN go to lunch or fake a important phone call til lunch.,Timeline Photos,photo,https://www.facebook.com/MartinLawrence/photos/a.437044652282.236578.18478252282/10153635867542283/?type=3,2016-05-20 10:45:00,375,20,150,323,3,0,49,0,0
18478252282_10153637499072283,Special shout out to @ivbentaqiy who made this special piece for me. He was front row at my show in Philly. Much love man! #martysfansgottalent #MartinFanFriday #TeamMartyMar #Runteldat,Timeline Photos,photo,https://www.facebook.com/MartinLawrence/photos/a.437044652282.236578.18478252282/10153637499072283/?type=3,2016-05-20 10:06:49,21630,376,530,20590,895,33,111,0,1
18478252282_10153633996892283,"Be the dumbest shit in the world. I use to go straight in, ""look here, I don't know what I'm doin but I pick up shit quick, all i need is two checks to get back up and I'll be gone, how soon can I start on these fries?""",Timeline Photos,photo,https://www.facebook.com/MartinLawrence/photos/a.437044652282.236578.18478252282/10153633996892283/?type=3,2016-05-19 18:06:00,7537,162,1523,6879,82,8,548,16,4
18478252282_10153634020797283,Well damn. Some of that kinda make sense. I don't know on a lot of that though. Which ones yall agree with? Educate ya boy on this one.,"According To Science, These Are The People Most Likely To Cheat In Relationships!",link,http://goo.gl/MejTcU,2016-05-19 16:17:00,469,53,64,436,3,15,14,1,0
18478252282_10153633994267283,"They doin yall wrong ladies, it don't be this bad do it? These be the girls that don't be giving a damn though. All up in the grocery store with no scarf to be found.",Timeline Photos,photo,https://www.facebook.com/MartinLawrence/photos/a.437044652282.236578.18478252282/10153633994267283/?type=3,2016-05-19 14:30:00,9089,564,3904,6951,86,27,2020,3,2
18478252282_10153634004782283,"We done all had that look before, this the ""here come that bullshit"" face. Tag a momma.",Timeline Photos,photo,https://www.facebook.com/MartinLawrence/photos/a.437044652282.236578.18478252282/10153634004782283/?type=3,2016-05-19 12:45:00,761,37,392,652,13,1,94,0,1
18478252282_10153633969487283,"Shiiiiiiiiiit. Gigi trippin, all we gotta do is get married, not stay married. We can get the annulment after ""I do"", cash the check and split it 3 ways. 180 MILLION? Gigi Holla at ya boy. I respect her decision, but damn 180 mil!!!","Hong Kong Billionaire Is OFFERING $180,000,000 To ANY Man Willing To MARRY His Daughter!",link,http://goo.gl/WWRlF6,2016-05-19 11:00:00,1825,331,319,1637,15,61,104,7,1
18478252282_10153633963737283,"Damn a discount, soldiers should eat FREE. Bottom line. Don't matter what your political views. They fight for us and deserve it. Wish I was there, I woulda checked the shit out her ass.",Woman Tries to Put a U.S. Soldier in His Place. Here's HOW That Worked Out,link,http://goo.gl/SWqRFp,2016-05-18 20:05:00,3473,273,317,3209,68,23,13,8,152
18478252282_10153633991632283,"Hate when they be trying to be nosey. I got some shit in my phone that can ruin a friendship. Be lookin at me different after, just look at what I'm showin you an keep it movin am i right?",Timeline Photos,photo,https://www.facebook.com/MartinLawrence/photos/a.437044652282.236578.18478252282/10153633991632283/?type=3,2016-05-18 18:04:00,9557,264,2779,8626,119,6,806,0,0
18478252282_10153633957737283,"Ya'll know I had to click it cause I saw a brotha on there right. Alex Trebek done made bank, show been on for damn near 30 years.",10 Really Incorrect 'Jeopardy!' Answers,link,http://goo.gl/0MVtx6,2016-05-18 17:32:00,360,26,35,324,6,1,29,0,0
18478252282_10153633976417283,"They wrong, gone roast a baby? I might as well too then. That baby probably retired, pension bouta kick in right after naptime too. I bet he got high blood pressure an only like watchin wolf blitzer on CNN.",Timeline Photos,photo,https://www.facebook.com/MartinLawrence/photos/a.437044652282.236578.18478252282/10153633976417283/?type=3,2016-05-18 15:38:00,10762,1019,4171,8432,26,132,2155,9,8
18478252282_10153634025417283,Texas! Ol Marty Mar is coming to Houston at the NRG Park Arena June 17th and Dallas June 18th at Verizon Theatre at Grand Prairie! Houston Tickets: bit.ly/DoinTimeHouston Dallas Tickets: bit.ly/DoinTimeDallas,Martin Lawrence,link,http://bit.ly/DoinTimeTour,2016-05-18 14:08:50,93,17,12,89,3,0,1,0,0
18478252282_10153633937427283,"Damn this make me wish I aint throw out some of my old shit. Anybody know how much money I can get for some Cross Colour Overalls? I aint sayin I got em, but I'm sayin for the right price I can make em appear.",22 Things You Owned in the '90s That Are Worth a Fortune Today,link,http://goo.gl/CFFC1C,2016-05-18 13:16:00,2742,160,495,2583,37,9,113,0,0
18478252282_10153630306862283,"OOOOH WEEEE! I can already hear the arguments bouta pop off after this one. Gone be some playstations gettin broke, and cars getting keyed up. My bad fellas.",These Reasons Why Men Cheat Will Surprise You,link,http://goo.gl/JOOKkw,2016-05-17 20:46:00,690,177,97,634,4,15,32,2,3
18478252282_10153628642262283,Yall done went too far now. Internet aint lettin the birdman get off the hook no time soon i see.,Timeline Photos,photo,https://www.facebook.com/MartinLawrence/photos/a.437044652282.236578.18478252282/10153628642262283/?type=3,2016-05-17 18:15:00,12527,661,3444,10755,234,64,1463,6,5
