status_id,status_message,link_name,status_type,status_link,status_published,num_reactions,num_comments,num_shares,num_likes,num_loves,num_wows,num_hahas,num_sads,num_angrys
11768835826_10154494437695827,"Ever wonder what it's like to be an athlete competing at X Games?

Watch Nyjah Huston Unfilitered At X: https://youtu.be/uZjaTNw-358",Monster Energy: Nyjah Unfiltered At X,video,https://www.facebook.com/MonsterEnergy/videos/10154494437695827/,2016-06-24 14:30:00,1993,12,70,1913,68,12,0,0,0
11768835826_10154494604100827,"We're LIVE with Quinton ""Rampage"" Jackson and his trainer Tiki Ghosn as they get set for Rampage's Return tonight at  Bellator MMA #DYNAMITE2!

Send in your questions in the comments below...",,video,https://www.facebook.com/MonsterEnergy/videos/10154494604100827/,2016-06-24 11:24:32,2945,1725,64,2637,143,33,86,7,39
11768835826_10154492146755827,"Ballistic BJ Baldwin brought the🔥last year to Motorsports' biggest garden party, the Goodwood Festival of Speed. #FOS #throwbackthursday

See more: http://monsterne.ws/RKLHLVBB",Timeline Photos,photo,https://www.facebook.com/MonsterEnergy/photos/a.86648330826.81128.11768835826/10154492146755827/?type=3,2016-06-23 17:40:16,316,6,8,310,5,0,1,0,0
11768835826_10154490941960827,"Ed Zunda will be cruising the streets of Athens, Greece for his The Street Series jam on #BMXDAY 2016. 
Where will you and your crew be on July 23rd? 

Check out the stops here: http://monsterne.ws/BMXDay",#BMXDAY 2016 - Ed Zunda,video,https://www.facebook.com/MonsterEnergy/videos/10154490941960827/,2016-06-23 11:00:00,5039,59,489,4870,97,65,6,1,0
11768835826_10154489531640827,"Why go around the rocks when you can go over them! 

Troy Brosnan tearing down the course at the opening round of the UCI Mountain Bike World Cup in France.",Timeline Photos,photo,https://www.facebook.com/MonsterEnergy/photos/a.86648330826.81128.11768835826/10154489531640827/?type=3,2016-06-22 17:50:32,290,2,5,280,6,4,0,0,0
11768835826_10154489207920827,"Congratulations Nyjah Huston, Gus Kenworthy, Chloe Kim, and Jamie Anderson for being nominated for the 2016 #ESPYS!

Vote Now: http://espn.go.com/espys/2016/",,video,https://www.facebook.com/MonsterEnergy/videos/10154489207920827/,2016-06-22 14:57:42,1782,12,116,1720,42,17,2,0,1
11768835826_10154488735335827,"The battle for the 2016 MotoGP championship reignites this weekend in the Netherlands! #DutchGP

Who will grab the checkered flag?",Timeline Photos,photo,https://www.facebook.com/MonsterEnergy/photos/a.86648330826.81128.11768835826/10154488735335827/?type=3,2016-06-22 11:09:57,65781,288,1382,63349,1747,619,54,8,4
11768835826_10154486982895827,"Ishod Wair burns down the house!

CPH OPEN 2016 August 10th - 14th","CPH Open - Faelleparken, Burning Heart of Fire",video,https://www.facebook.com/MonsterEnergy/videos/10154486982895827/,2016-06-21 17:58:17,1131,19,118,1077,43,8,3,0,0
11768835826_10154486471280827,"It's all about the flow!

Watch Conner Coffin in Whatever Beach Episode 5",Vacation Club,video,https://www.facebook.com/vacationclubstudio/videos/1759627150927093/,2016-06-21 14:30:18,164,4,0,161,2,0,0,0,1
11768835826_10154486016755827,Get ready for  #TheUnknownRide! Coming soon...,Timeline Photos,photo,https://www.facebook.com/MonsterEnergy/photos/a.86648330826.81128.11768835826/10154486016755827/?type=3,2016-06-21 11:01:44,62718,55,1048,60831,1503,323,55,4,2
11768835826_10154484228315827,"The UFC Welterweight class has a new player, and his name is Donald ""Cowboy"" Cerrone! #UFCOttawa",Cerrone Dominates In His Second Fight In Welterweight,link,http://monsterne.ws/7XHEQJIL,2016-06-20 17:43:40,8790,12,67,8707,60,16,6,1,0
11768835826_10154483830225827,"To celebrate International Surfing Day #ISD2016, join Beyrick De Vries and Gearoid mcdaid as they make a break for the African tropical paradise of Mozambique in 'Beyrick's Beach Shack'! 

Watch here: http://monsterne.ws/31VDMIQY",Photos from Monster Energy's post,photo,https://www.facebook.com/MonsterEnergy/photos/a.86648330826.81128.11768835826/10154483829580827/?type=3,2016-06-20 14:41:40,36668,21,172,36118,434,91,24,1,0
11768835826_10154483444915827,"If dodging those concrete walls wasn't enough, Nico Rosberg goes DIY on his 900bhp silver arrow during #F1Baku",Rosberg rules the streets of Baku | Monster Energy,link,https://www.monsterenergy.com/news/rosberg-rules-the-streets-of-baku,2016-06-20 11:08:50,35962,28,92,35783,109,57,9,2,2
11768835826_10154481292160827,"The battle of the champions!

Vaughn Gittin Jr. conquers The Gauntlet in New Jersey and takes control of the Formula Drift standings. #FDNJ",Photos from Monster Energy's post,photo,https://www.facebook.com/MonsterEnergy/photos/a.86648330826.81128.11768835826/10154481291770827/?type=3,2016-06-19 14:37:00,32638,30,435,31737,738,134,26,0,3
11768835826_10154480813070827,"Joey Savatgy leading the charge and the Pro Motocross series, claiming his third overall win of the year at High Point MX!",Timeline Photos,photo,https://www.facebook.com/MonsterEnergy/photos/a.86648330826.81128.11768835826/10154480813070827/?type=3,2016-06-19 11:10:00,49638,31,435,48548,907,145,35,0,3
11768835826_10154478564795827,Slideways master Vaughn Gittin Jr. laying down smoke trials at Formula Drift New Jersey,Timeline Photos,photo,https://www.facebook.com/MonsterEnergy/photos/a.86648330826.81128.11768835826/10154478564795827/?type=3,2016-06-18 14:59:30,20406,24,259,19731,537,119,15,2,2
11768835826_10154478076990827,"Red looks good on the #37 of Joey Savatgy!

What are your predictions for Round 4 of the Pro Motocross series at High Point MX?",Timeline Photos,photo,https://www.facebook.com/MonsterEnergy/photos/a.86648330826.81128.11768835826/10154478076990827/?type=3,2016-06-18 11:13:31,46727,30,472,45706,885,104,28,3,1
11768835826_10154476291450827,"Did someone say Pool Party!? 

Check out all the photos from the 2016 #VansPoolParty",Monster Energy,link,http://monsterne.ws/UQJ7SCA1,2016-06-17 18:26:07,144,5,12,141,3,0,0,0,0
11768835826_10154475913125827,Parker Coffin rules Rincon and California's central coast in Whatever Beach: Episode 4,Vacation Club,video,https://www.facebook.com/vacationclubstudio/videos/1757402697816205/,2016-06-17 15:02:17,12218,65,0,11984,141,85,5,2,1
11768835826_10154475446370827,What adventure are you heading on this weekend?,Timeline Photos,photo,https://www.facebook.com/MonsterEnergy/photos/a.86648330826.81128.11768835826/10154475446370827/?type=3,2016-06-17 11:33:23,36781,63,421,35984,613,153,30,1,0
11768835826_10154473123575827,"Who's ready for more Rune Glifberg, Ishod Wair, and Raven Tershy epic sessions and near misses at Fælledparken Snakerun? #CPHOpen

CPH OPEN 2016 August 10th - 14th",CPH Open  - Faelledparken Snakerun,video,https://www.facebook.com/MonsterEnergy/videos/10154473123575827/,2016-06-16 14:33:08,21864,286,2519,20590,788,453,29,4,0
11768835826_10154472702540827,"""The dream was to create a hybrid evil love child of my two favorite things; dirt jumps and FEST series!"" 

Watch Sam Reynolds charge the 70ft drop-in in #PureDarkness 3: http://monsterne.ws/PD3",Pure Darkness 3,video,https://www.facebook.com/MonsterEnergy/videos/10154472702540827/,2016-06-16 11:17:02,14907,251,3206,14220,321,343,18,3,2
11768835826_10154471000505827,Nate Adams holdin' down #WhipItWednesday,Nate Adams - #WhipItWednesday,video,https://www.facebook.com/MonsterEnergy/videos/10154471000505827/,2016-06-15 17:49:16,639,2,84,618,10,10,1,0,0
11768835826_10154470502830827,"Heat for the ages!

John John Florence delivers incredible performance during heavyweight bout with Taj Burrow. #FijiPro",Timeline Photos,photo,https://www.facebook.com/MonsterEnergy/photos/a.86648330826.81128.11768835826/10154470502830827/?type=3,2016-06-15 14:33:13,56514,36,404,55830,451,207,22,2,2
11768835826_10154470138320827,"A source of inspiration, motivation and high-speed adrenaline for Valentino Rossi VR46 Official; get an exclusive look inside his private training facility in Episode 3 'Riding The Ranch'! #VR46TheSeries

 Watch here now: https://youtu.be/UADBZPp35VU",Valentino Rossi: The Doctor Series - Episode 3,video,https://www.facebook.com/MonsterEnergy/videos/10154470138320827/,2016-06-15 11:15:59,30089,648,8015,28685,1115,243,38,2,6
11768835826_10154468551340827,"Griffin Colapinto's buzzer beater at the Los Cabos Open of Surf!

Read more: http://monsterne.ws/LosCabosOpen16",Timeline Photos,photo,https://www.facebook.com/MonsterEnergy/photos/a.86648330826.81128.11768835826/10154468551340827/?type=3,2016-06-14 17:45:47,50937,43,196,50479,313,123,19,3,0
11768835826_10154468140535827,"We're going behind-the-scenes with Valentino Rossi VR46 Official to one of MotoGP's most exclusive but famous training locations. 

Episode 3 of #VR46TheSeries is coming soon to youtube.com/monsterenergy",Valentino Rossi: The Doctor - Episode 3 Trailer,video,https://www.facebook.com/MonsterEnergy/videos/10154468140535827/,2016-06-14 14:32:46,5288,126,1177,5088,149,40,6,0,5
11768835826_10154467759865827,Are we in the midst of the resurgence of Josh Grant? #ProMotocross,Timeline Photos,photo,https://www.facebook.com/MonsterEnergy/photos/a.86648330826.81128.11768835826/10154467759865827/?type=3,2016-06-14 11:17:04,40107,28,339,39329,677,78,21,1,1
11768835826_10154465677705827,"How many tricks can Nyjah Huston stomp in a row?

BONUS: See if you can list them all in the comments below",Nyjah Huston - How many tricks?,video,https://www.facebook.com/MonsterEnergy/videos/10154465677705827/,2016-06-13 14:53:26,8963,239,1004,8561,203,177,18,1,3
11768835826_10154465348305827,Lewis Hamilton dedicates triumphant victory at #CanadianGP to  'The Greatest'.,F1: Lewis wins big in Canada | Monster Energy,link,https://www.monsterenergy.com/news/f1-lewis-wins-big-in-canada,2016-06-13 11:24:09,40763,41,114,40548,139,53,14,1,8
11768835826_10154463330390827,"To Hell and back with a FIA World Rallycross Championship record. Andreas Bakkerud storms the #HellRX   

See more: http://monsterne.ws/WRXHAB16",Photos from Monster Energy's post,photo,https://www.facebook.com/MonsterEnergy/photos/a.86648330826.81128.11768835826/10154463322940827/?type=3,2016-06-12 15:01:36,73037,53,926,71802,898,284,46,3,4
11768835826_10154462784935827,"A full house at the Isle of Man TT!♠️♦️♣️

More on Michael Dunlop's record breaking speed and senior TT domination here: http://monsterne.ws/JJCX7R23",Timeline Photos,photo,https://www.facebook.com/MonsterEnergy/photos/a.86648330826.81128.11768835826/10154462784935827/?type=3,2016-06-12 11:02:00,59458,61,846,58034,1165,228,26,1,4
11768835826_10154460693235827,Cruisin'. Where are you rolling this weekend?,Timeline Photos,photo,https://www.facebook.com/MonsterEnergy/photos/a.86648330826.81128.11768835826/10154460693235827/?type=3,2016-06-11 14:50:36,4523,29,111,4400,77,40,4,2,0
11768835826_10154460338160827,"Ever wonder what it's like to take a run down a UCI Mountain Bike World Cup course?

Go on board with Brendan Fairclough & Troy Brosnan as they tackle the gnarly terrain in Leogang, Austria: https://youtu.be/_93V0KESF0E",Timeline Photos,photo,https://www.facebook.com/MonsterEnergy/photos/a.86648330826.81128.11768835826/10154460338160827/?type=3,2016-06-11 12:03:51,60409,78,538,59593,566,213,35,1,1
11768835826_10154458404800827,"Ventura, CA local Eithan Osborne shreds in Episode 3 of Vacation Club's ""Whatever Beach""",Vacation Club,video,https://www.facebook.com/vacationclubstudio/videos/1755435034679638/,2016-06-10 18:04:10,192,11,0,186,4,2,0,0,0
11768835826_10154457969900827,"Pol Espargaró getting low, really really low! #CatalanGP",Timeline Photos,photo,https://www.facebook.com/MonsterEnergy/photos/a.86648330826.81128.11768835826/10154457969900827/?type=3,2016-06-10 15:03:08,75187,255,2198,71224,2302,1591,58,11,1
11768835826_10154457384490827,"Dakota Roche will be bringing his crew to LA for The Street Series jam. 

Click the link to find your nearest #BMXDAY location and tag your crew to join! http://monsterne.ws/BMXDay",#BMXDAY 2016 - Dakota Roche,video,https://www.facebook.com/MonsterEnergy/videos/10154457384490827/,2016-06-10 10:59:38,367,4,41,360,6,1,0,0,0
11768835826_10154456766710827,What's your favourite TT race? Tell us why below! ,,status,,2016-06-10 05:31:17,83,11,0,83,0,0,0,0,0
11768835826_10154455811510827,"DIRT SHARK linked up with Dingo to capture the Monster Energy crew's domination at the 2016 Summer X Games in Austin, TX! #UnleashedAtX

Watch here: https://youtu.be/w1cu64CDJ3E",Photos from Monster Energy's post,photo,https://www.facebook.com/MonsterEnergy/photos/a.86648330826.81128.11768835826/10154455805370827/?type=3,2016-06-09 20:15:00,22098,44,853,20926,847,295,27,1,2
11768835826_10154455150155827,"10,000 horsepower burning the rubber off of it!",Timeline Photos,photo,https://www.facebook.com/MonsterEnergy/photos/a.86648330826.81128.11768835826/10154455150155827/?type=3,2016-06-09 14:46:34,17477,124,919,17172,199,94,11,1,0
11768835826_10154454709935827,The ruts couldn't slow down Eli Tomac who turned the fastest lap on his charge up to second in Moto Two. #ProMotocross,Timeline Photos,photo,https://www.facebook.com/MonsterEnergy/photos/a.86648330826.81128.11768835826/10154454709935827/?type=3,2016-06-09 11:31:02,49087,29,594,47973,924,150,38,1,1
11768835826_10154454163395827,Who do you think will podium in tomorrow's Senior TT? 🎉🏁,,status,,2016-06-09 06:52:19,148,3,0,147,1,0,0,0,0
11768835826_10154452935285827,"Watch Bobby Martinez dice through pumping beach breaks in ""Whatever Beach"" Episode 2: A Santa Barbara tale",Vacation Club,video,https://www.facebook.com/vacationclubstudio/videos/1753226154900526/,2016-06-08 17:40:29,4803,51,0,4666,80,47,9,0,1
11768835826_10154452575285827,"When in doubt, 🔥🔥",Timeline Photos,photo,https://www.facebook.com/MonsterEnergy/photos/a.86648330826.81128.11768835826/10154452575285827/?type=3,2016-06-08 14:53:23,91308,189,1196,89712,1116,415,59,0,6
11768835826_10154452114995827,"To be one of the best you have to put in the hours, but at the end of the day skateboarding is about how many of your buddies were there and what tricks went down! 

Watch more: https://youtu.be/R5hFqxOHQJI",Experimental Session at the T.F.,video,https://www.facebook.com/MonsterEnergy/videos/10154452114995827/,2016-06-08 11:29:17,11597,109,1273,10805,519,245,27,1,0
11768835826_10154450197210827,"Interested in going behind the scenes at the fastest, gnarliest, and most unique race in motorsports?! 

Follow our event for exclusive Isle of Man TT content.",Isle of Man TT 2016,event,https://www.facebook.com/events/1096984417042211/,2016-06-07 18:09:26,10097,69,0,9772,267,54,4,0,0
11768835826_10154449803525827,"Monster Energy athletes put in an epic performance throughout four days of competition at the 2016 X Games to take home 19 total medals across Skateboarding, BMX, and Moto! #UnleashedAtX

See full recap here: http://monsterne.ws/XGamesRecap",Photos from Monster Energy's post,photo,https://www.facebook.com/MonsterEnergy/photos/a.86648330826.81128.11768835826/10154449802010827/?type=3,2016-06-07 15:00:30,26362,32,286,25484,728,120,28,0,2
11768835826_10154449387930827,Kurt Busch secures spot in the 16-driver Chase for the NASCAR Sprint Cup with a win yesterday at Pocono Raceway 🏁,Timeline Photos,photo,https://www.facebook.com/MonsterEnergy/photos/a.86648330826.81128.11768835826/10154449387930827/?type=3,2016-06-07 11:14:27,12630,161,432,12400,155,33,14,6,22
11768835826_10154447277690827,"Dominick Cruz claims trilogy victory nearly a decade in the making! #UFC199

See more: http://monsterne.ws/AW1EM9YV",Timeline Photos,photo,https://www.facebook.com/MonsterEnergy/photos/a.86648330826.81128.11768835826/10154447277690827/?type=3,2016-06-06 15:04:22,170,5,2,166,4,0,0,0,0
11768835826_10154446784870827,"""It's a great victory, one of the best of my career""

Valentino Rossi VR46 Official was relentless in his mission to the top spot at the #CatalanGP. 🏆

Read more here: http://monsterne.ws/CNLO3EM7",Timeline Photos,photo,https://www.facebook.com/MonsterEnergy/photos/a.86648330826.81128.11768835826/10154446784870827/?type=3,2016-06-06 11:05:33,78178,212,1427,75969,1875,256,62,5,11
11768835826_10154444922590827,We're LIVE with André Villa and Axell Hodges at warmup for X Games Best Trick! #UnleashedAtX,,video,https://www.facebook.com/MonsterEnergy/videos/10154444922590827/,2016-06-05 16:05:22,2924,424,100,2465,251,112,60,14,22
11768835826_10154444423120827,Joey Savatgy blasting his way to a Pro Motocross win at Thunder Valley Motocross Park! Saturday's win also puts the red plate back on the #37.,Timeline Photos,photo,https://www.facebook.com/MonsterEnergy/photos/a.86648330826.81128.11768835826/10154444423120827/?type=3,2016-06-05 11:48:13,60254,44,849,58691,1334,178,46,2,3
11768835826_10154442010315827,"Monster Energy's rampage through X Games continued on Day Two as Sam Beckett, Jamie Bestwick, and Josh Sheehan take home Gold! #UnleashedAtX

See more: http://monsterne.ws/95WH26LG",X Games Austin - Day Two Highlights,video,https://www.facebook.com/MonsterEnergy/videos/10154442010315827/,2016-06-04 12:05:36,11555,62,1394,10968,402,158,22,3,2
11768835826_10154440139850827,"Dominick Cruz is set to defend his UFC Bantamweight belt Saturday night against longtime rival Faber! 

Watch #UFC199 LIVE on Saturday, June 4 from Los Angeles, CA at 10pm ET/ 7pm PT on PPV",Dominick Cruz - #UFC199,video,https://www.facebook.com/MonsterEnergy/videos/10154440139850827/,2016-06-03 16:38:14,3462,39,102,3422,26,10,3,1,0
11768835826_10154439717325827,We're LIVE from X Games Moto Freestyle practice with Nate Adams #UnleashedAtX,,video,https://www.facebook.com/MonsterEnergy/videos/10154439717325827/,2016-06-03 12:44:15,1947,567,50,1698,144,49,32,12,12
11768835826_10154437963560827,"Quick three with 7x X Games Skateboard Street Gold Medalist Nyjah Huston #UnleashedAtX

What event are you most looking forward to watching at #XGames Austin?",Quick Three With Nyjah Huston at X Games,video,https://www.facebook.com/MonsterEnergy/videos/10154437963560827/,2016-06-02 19:12:01,7786,87,737,7383,247,144,11,0,1
